事業名１,事業名２,事業名３,局名,事業の概要,２０１６（２８）主な取組,２０１６（２８）事業費（百万円）,２０１７（２９）主な取組,２０１７（２９）事業費（百万円）
６．帰宅困難者による混乱防止,,,,,,1953,,1001
一斉帰宅抑制に対する社会の理解を深めます,,,,,,1913,,961
ハンドブックの配布、各種イベントでのＰＲなど、あらゆる機会を活用した普及啓発を行います,,,,,,1913,,961
1,６－１,帰宅困難者対策,総務局,東京都帰宅困難者対策条例に基づき、都内の事業所は、従業員等の施設内待機のための計画を策定し、従業員等への周知や３日分の備蓄の確保などの取組を行う。／企業や学校などに所属していない行き場のない帰宅困難者を待機させるため、一時滞在施設を確保する。／混乱収拾後に徒歩帰宅する帰宅困難者を支援するため、災害時帰宅支援ステーションの充実を図る。／徒歩帰宅が困難な要配慮者を優先的に搬送するため、バスや船舶などの代替輸送手段を確保する。,・条例説明会・講演等の実施、中吊り広告等による普及啓発／・一時滞在施設の確保の推進／・備蓄及び施設整備に対する財政支援の実施／・アドバイザーの派遣／・災害時帰宅支援ステーションの拡充／・帰宅困難者対策訓練の実施（渋谷区）,1911,・条例説明会・講演等の実施、中吊り広告等による普及啓発／・一時滞在施設の確保の推進／・備蓄及び施設整備に対する財政支援の実施／・アドバイザーの派遣／・災害時帰宅支援ステーションの拡充／・帰宅困難者対策訓練の実施／・ＩＣＴを活用した情報通信提供体制の整備検討／・主要ターミナル駅周辺等緊急確保事業,960
3,６－３,事業所における帰宅困難者対策の推進,東京消防庁,帰宅困難者対策を盛り込んだ事業所防災計画の作成を促進するための防災指導書を作成し、帰宅困難者対策の周知推進を図る。,・防災指導書２１０００部の作成及び事業所への配布,2,・防災指導書２１０００部の作成及び事業所への配布,1
