事業名１,事業名２,事業名３,局名,事業の概要,２０１６（２８）主な取組,２０１６（２８）事業費（百万円）,２０１７（２９）主な取組,２０１７（２９）事業費（百万円）
避難者の安全を確保します,,,,,,72,,1414
高齢者など要配慮者及び女性の視点に配慮した避難所の運営基準や運営方法を定める避難所管理運営マニュアルを定めるよう区市町村を支援します,,,,,,7,,4
12,７－１,男女平等参画の視点からの防災・復興,生活文化局,各区市町村の地域防災計画等について、男女平等参画の視点の確認を行う。,・都内男女平等参画（女性）センター館長等会議の開催などを通じて、区市町村の男女平等参画センター等との連携強化、ネットワークの構築を進め、災害時における避難所運営をはじめ、災害から受ける影響の男女の違いや、女性に対する暴力・配偶者暴力等に関する情報共有、問題解決に向けた連携／・区市町村の地域防災計画及び避難所運営マニュアルの作成にあたり、計画全体を通して女性の視点を取り入れること、女性の視点に配慮した避難所運営を行うこと、防災訓練に女性参画を促すこと等の記載を求め、事前に内容確認等を実施／・区市町村との連絡会議などの機会を捉え、地域防災計画等の改正に当たり、男女平等参画の視点を取り入れるよう働きかけ／・災害時における男女平等参画の視点からの問題に対する相談支援、情報提供等の実施体制の整備,-,・都内男女平等参画（女性）センター館長等会議の開催などを通じて、区市町村の男女平等参画センター等との連携強化、ネットワークの構築を進め、災害時における避難所運営をはじめ、災害から受ける影響の男女の違いや、女性に対する暴力・配偶者暴力等に関する情報共有、問題解決に向けた連携／・区市町村の地域防災計画及び避難所運営マニュアルの作成にあたり、計画全体を通して女性の視点を取り入れること、女性の視点に配慮した避難所運営を行うこと、防災訓練に女性参画を促すこと等の記載を求め、事前に内容確認等を実施／・区市町村との連絡会議などの機会を捉え、地域防災計画等の改正に当たり、男女平等参画の視点を取り入れるよう働きかけ／・災害時における男女平等参画の視点からの問題に対する相談支援、情報提供等の実施体制の整備,-
13,７－２,避難所管理運営マニュアル整備の支援,福祉保健局,東日本大震災の教訓を踏まえ改訂した「避難所管理運営の指針（区市町村向け）」に基づき、区市町村の避難所管理運営マニュアル整備を支援する。,・避難所管理運営マニュアルの未策定の区市町村に対して、地域の実情に応じた「マニュアル」又は「運営基準」を策定するよう働きかけを継続実施,-,・避難所管理運営マニュアルの未策定の区市町村に対して、地域の実情に応じた「マニュアル」又は「運営基準」を策定するよう働きかけを継続実施,-
14,７－３,こころのケア,福祉保健局,大規模災害等の緊急時に、被災地において精神科医療及び精神保健活動の支援を行う「こころのケアチーム」を整備することにより、災害支援体制の強化を図る。,・東京都災害時こころのケア体制構築に向け、災害時こころのケア連絡調整会議を開催し、各機関との連携等を検討／・こころのケアに関する普及啓発研修を実施／・平成２８年熊本地震に「こころのケアチーム」を派遣,7,・東京都災害時こころのケア体制構築に向けた災害時こころのケア連絡調整会議の開催／・登録医療機関の確保／・「こころのケアチーム」に対する研修・訓練及びこころのケアに関する普及啓発,4
