番号,施設名,所在地,確保面積（ｍ２）,現況,備考
250,東光寺グラウンド,日野市栄町５－５先,5500,河川敷,
251,浅川スポーツ広場,日野市万願寺５－３先,4500,広場,
252,豊田児童グラウンド,日野市豊田１－３先,5000,河川敷,
253,多摩川総合グラウンド,日野市（新井）万願寺１－１－２先,4500,河川敷,
254,杉野女子大学日野キャンパス,日野市百草１００６,5000,大学グラウンド,
255,市民の森スポーツ公園,日野市日野本町７－１２,10000,グラウンド（公共等）,
256,日野市立多摩平第一公園,日野市多摩平４－２,,公園,日野市立病院
257,平山台健康・市民支援センター,日野市平山２－１－１,9310,グラウンド（公共等）,
258,万願寺中央公園グラウンド,日野市万願寺４－２０,7000,グラウンド（公共等）,
259,東村山市立東村山運動公園,東村山市恩多町１－５１－１,6400,グラウンド（公共等）,東京都保健医療公社多摩北部医療センター
260,経済産業研究所グラウンド,東村山市富士見町５－４－３６,,グラウンド（公共等）,
261,都立東村山中央公園,東村山市富士見町５丁目,,公園,
262,国分寺市立窪東公園,国分寺市東戸倉２－１９,4200,公園,
263,一橋大学グラウンド,国立市中２－１,,大学グラウンド,都立多摩・小児総合医療センター
264,多摩川河川敷グラウンド,国立市谷保９５４４,,河川敷,
265,福生市立多摩川中央公園,福生市北田園１－１７,3000,公園,
266,福生市立多摩川緑地福生南公園,福生市南田園１－１－１,26175,公園,
267,加美平野球場,福生市加美平１－２１,,野球場,公立福生病院
268,狛江市立多摩川緑地公園グラウンド,狛江市猪方４丁目先多摩川左岸,,河川敷,
269,防衛省共済組合狛江スポーツセンター,狛江市元和泉２－３０,16822,グラウンド（公共等）,
270,都立東大和南公園,東大和市桜が丘２－１０６－２,,公園,東大和病院
271,東大和市立第６小学校校庭,東大和市仲原１－５－１,4500,小中校庭,
272,東京都共済組合清瀬運動場,清瀬市竹丘３－１０－５,,グラウンド（公共等）,国立病院機構東京病院
273,東久留米市立滝山公園,東久留米市滝山２－４,5000,公園,
274,柳泉園組合グラウンド,東久留米市下里４－３－１０,5000,グラウンド（公共等）,
275,東京経済大学運動場,武蔵村山市学園５－２２－１,,大学グラウンド,
276,多摩市立多摩市東公園陸上競技場,多摩市諏訪４－９,,競技場,日本医科大学多摩永山病院
277,多摩市立関戸公園グラウンド,多摩市関戸３－５,5000,グラウンド（公共等）,
278,多摩市立一ノ宮公園,多摩市一ノ宮１０４９先,5000,河川敷,
279,宝野公園,多摩市落合５－５,7000,公園,
280,稲城市立中央公園総合グラウンド,稲城市長峰１－１,,競技場,稲城市立病院
281,九段尽性園グラウンド,稲城市押立１７２６－１,8100,グラウンド（公共等）,
282,日本大学商学部グラウンド,稲城市平尾１２８１番地,29000,大学グラウンド,
283,稲城市立南山グラウンド,稲城市東長沼２４０６番地１,69000,グラウンド（公共等）,
284,ふれんど平尾運動場,稲城市ふれんど平尾運動場,5126,運動場,
285,羽村市立宮ノ下運動公園,羽村市羽加美四丁目８７５番地先,,河川敷,
286,羽村市立江戸街道公園,羽村市五ノ神３４７,20525,公園,
287,学校法人菅生学園初等学校校庭,あきる野市菅生１４６８,,小中校庭,
288,市民運動場,あきる野市二宮６８３番地,,グラウンド（公共等）,
289,あきる野市立小和田グラウンド,あきる野市小和田８,5000,グラウンド（公共等）,
290,富士通株式会社あきる野テクノロジーセンター駐車場,あきる野市渕上５０番地,,駐車場,公立阿伎留医療センター
291,五日市カントリー,あきる野市網代７４５,,ゴルフ場,
292,立川国際カントリー,あきる野市草花２３９０,,ゴルフ場,
293,戸倉運動場,あきる野市戸倉６１１－１,,グラウンド（公共等）,
294,都立秋留台公園陸上競技場,あきる野市二宮,,競技場,
295,向台運動場,西東京市向台町５－４－４４,,グラウンド（公共等）,佐々総合病院
296,西東京市立文理台公園,西東京市東町一丁目４,9002,公園,
297,石畑公園,瑞穂町石畑,7000,公園,
298,瑞穂ビューパーク競技場,瑞穂町大字箱根ケ崎２４７５,11829,競技場,
299,町営第２グラウンド,瑞穂町箱根ケ崎西松原３－１,19300,グラウンド（公共等）,
300,亜細亜大学日の出グラウンド,日の出町平井１４６６,,大学グラウンド,公立阿伎留医療センター
301,日の出ヘリポート,日の出町平井谷戸沢廃棄物処理場,,ヘリポート,
302,谷戸沢グラウンド,日の出町平井３１４１,,グラウンド（公共等）,
303,檜原村ヘリポート,檜原村倉掛９４２８,,ヘリポート,
304,甲武トンネル待避所,檜原村南郷６０８１－６,,空地,
305,やすらぎの里（原則特異災害のみ）,檜原村三都郷２７１７,,空地,
306,数馬ヘリポート,檜原村数馬６８５８－２,,ヘリポート,
307,檜原総合グラウンド,檜原村三都郷,,グラウンド（公共等）,
308,東京消防庁奥多摩消防ヘリポート,奥多摩町氷川字栃久保１９３０－２外,,ヘリポート,
309,雲取山ヘリポート,奥多摩町日原１０２４－１,339,ヘリポート,
310,大丹波緊急離着陸場,奥多摩町大丹波５１６,,ヘリポート,
311,北蓑緊急離着陸場,奥多摩町川野１５２７,1359,ヘリポート,
312,登計原山林広場運動公園,奥多摩町氷川９４０,5600,公園,
313,小河内ダム緊急離着陸場,奥多摩町原５,,ヘリポート,
314,町立古里小学校校庭,奥多摩町小丹波７５,,小中校庭,
315,滝谷ノ峰ヘリポート（アララギ山）,奥多摩町日原孫惣谷滝谷ノ峰,,ヘリポート,
316,差木地ヘリコプター臨時着陸広場,大島町,,広場,
317,トウシキヘリコプター臨時着陸広,大島町,,広場,
318,利島臨時ヘリポート,利島村,,ヘリポート,
319,式根島臨時ヘリポート,新島村式根島,,ヘリポート,
320,神津島臨時ヘリポート,神津島村,,ヘリポート,
321,御蔵島臨時ヘリポート,御蔵島村,,ヘリポート,
322,冨士中学校,八丈町,,小中校庭,
323,冨士野球場,八丈町,,小中校庭,
324,大賀郷中学校,八丈町,,小中校庭,
325,三原中学校,八丈町,,小中校庭,
326,末吉中学校,八丈町,,小中校庭,
327,樫立小学校,八丈町,,小中校庭,
328,青ヶ島臨時ヘリポート,青ヶ島村,,ヘリポート,
329,母島臨時ヘリポート,小笠原村,,ヘリポート,
