施設名,施設名カナ,住所,URL,電話番号,経度,緯度
ムーミン保育室,ムーミンホイクシツ,墨田区太平三丁目19番1号,http://www.joy.hi-ho.ne.jp/mumin/,03-3626-2001,139.813185,35.7024639
ピノキオ幼児舎鐘ヶ淵園,ピノキオヨウジシャカネガフチエン,墨田区堤通二丁目8番2号,http://pinoh.co.jp/rooms/kanega/,03-3616-0611,139.817538,35.735087
こすもす保育園,コスモスホイクエン,墨田区錦糸一丁目14番7号,http://www.kosumosu-hoikuen.jp/index.php,03-5819-4588,139.81151,35.699278
ポピンズナーサリースクールすみだ,ポピンズナーサリースクールスミダ,墨田区太平四丁目1番1号,http://www.poppins.co.jp/,03-5637-2137,139.8161542,35.7003974
ゆらりん曳舟保育園,ユラリンヒキフネホイクエン,墨田区京島一丁目38番1-107号,http://www.lifesupport.co.jp/facility/hikifune/,03-5631-6888,139.81832,35.718049
マミーズエンジェル墨田みなみ保育園,マミーズエンジェルスミダミナミホイクエン,墨田区亀沢四丁目24番13号,http://www.mammys-angel.co.jp/branch/h20100321122637048.html,03-3621-8825,139.8058635,35.6983866
保育園夢未来錦糸町園,ホイクエンユメミライキンシチョウエン,墨田区太平三丁目3番12号,http://www.gakidaisyo.co.jp/kinshicho.html,03-5637-8737,139.814096,35.699717
