"全国地方公共団体コード","ID","地方公共団体名","施設名称","施設名称_カナ","施設名称_英字","営業の種類","業態","所在地_全国地方公共団体コード","町字ID","所在地_連結表記","施設所在地_都道府県","施設所在地_市区町村","施設所在地_町字","施設所在地_番地以下","施設方書","緯度","経度","施設電話番号","連絡先メールアドレス","連絡先FormURL","連絡先備考（その他、SNSなど）","郵便番号","法人名","法人番号","許可番号","初回許可年月日","許可年月日","許可開始日","許可満了日","廃業年月日","申請区分","許可条件","備考"
"131083","131083E00001","江東区","アトレ亀戸コンコース催事（成城石井前）","アトレカメイドコンコースサイジ(セイジョウイシイマエ)","","その他の食料・飲料販売業","食料品販売（製造なし）","131083","","東京都江東区亀戸五丁目1-1アトレ亀戸","東京都","江東区","亀戸5丁目","1-1 アトレ亀戸","","35.697636","139.826044","(090)1046-2203","","","","1360071","株式会社アトレスティル","6010001137388","7-503-00036","2021-06-01","2021-06-01","2021-06-01","","","新規","",""
"131083","131083E00002","江東区","アトレ亀戸コンコース催事（船橋屋跡）","アトレカメイドコンコースサイジ(フナバシヤアト)","","その他の食料・飲料販売業","食料品販売（製造なし）","131083","","東京都江東区亀戸五丁目1-1アトレ亀戸","東京都","江東区","亀戸5丁目","1-1 アトレ亀戸","","35.697638","139.826046","(090)1046-2203","","","","1360071","株式会社アトレスティル","6010001137388","7-503-00035","2021-06-01","2021-06-01","2021-06-01","","","新規","",""
"131083","131083E00003","江東区","株式会社有倉商店","カブシキガイシャアリクラショウテン","","野菜果物販売業","青果物納品業者","131083","","東京都江東区亀戸五丁目33-5","東京都","江東区","亀戸5丁目","33-5","","35.698550","139.830199","(03)3684-1875","","","","1360071","株式会社有倉商店","9010601022219","7-503-00001","2021-06-01","2021-06-01","2021-06-01","","","新規","",""
"131083","131083E00004","江東区","健康壱番館 亀戸店","ケンコウイチバンカン カメイドテン","","その他の食料・飲料販売業","店舗","131083","","東京都江東区亀戸七丁目44-3みどりハイツ店舗","東京都","江東区","亀戸7丁目","44-3 みどりハイツ店舗","","35.696296","139.834331","(03)3638-5073","","","","1360071","株式会社ヘルスウェイ","8010501012238","7-503-00028","2021-06-01","2021-06-01","2021-06-01","","","新規","",""
"131083","131083E00005","江東区","太陽の子 大島五丁目保育園","タイヨウノコ オオジマゴチョウメホイクエン","","集団給食施設","集団給食","131083","","東京都江東区大島五丁目27-13","東京都","江東区","大島5丁目","27-13","","35.686761","139.836032","(03)5609-7651","","","","1360072","ＨＩＴＯＷＡキッズライフ株式会社","8013301017398","7-503-00029","2021-06-01","2021-06-01","2021-06-01","","","新規","",""
"131083","131083E00006","江東区","福地 青果店","フクチ セイカテン","","野菜果物販売業","八百屋","131083","","東京都江東区北砂六丁目24-18","東京都","江東区","北砂6丁目","24-18","","35.682566","139.837364","(03)3648-8761","","","","1360073","","","7-503-00002","2021-06-01","2021-06-01","2021-06-01","","","新規","",""
"131083","131083E00007","江東区","太陽の子潮見保育園","タイヨウノコシオミホイクエン","","集団給食施設","","131083","","東京都江東区潮見一丁目28-8ベイフレール潮見2、3階","東京都","江東区","潮見1丁目","28-8 ベイフレール潮見2、3階","","35.657130","139.815432","(03)6666-5920","","","","1350052","ＨＩＴＯＷＡキッズライフ株式会社","8013301017398","7-503-00008","2021-06-01","2021-06-01","2021-06-01","","","新規","",""
"131083","131083E00008","江東区","北海道コレクション","ホッカイドウコレクション","","その他の食料・飲料販売業","","131083","","東京都江東区有明二丁目1-8有明ガーデン2階","東京都","江東区","有明2丁目","1-8 有明ガーデン2階","","35.638567","139.792724","(080)7641-5678","","","","1350063","株式会社ロケットメイカーズ","3010001203597","7-503-00016","2021-06-01","2021-06-01","2021-06-01","","","新規","",""
"131083","131083E00009","江東区","カレッジショップありあけ館","カレッジショップアリアケカン","","弁当販売業","","131083","","東京都江東区有明三丁目3-3武蔵野大学3館1階","東京都","江東区","有明3丁目","3-3 武蔵野大学3館1階","","35.631234","139.786684","(03)5503-7709","","","","1350063","株式会社エムユービジネスサポート","3012701007492","7-503-00004","2021-06-01","2021-06-01","2021-06-01","","","新規","",""
"131083","131083E00010","江東区","カレッジショップ有明（ありあけ館）","カレッジショップアリアケ(アリアケカン)","","弁当販売業","","131083","","東京都江東区有明三丁目3-3武蔵野大学1館1階","東京都","江東区","有明3丁目","3-3 武蔵野大学1館1階","","35.631234","139.786684","(03)5530-7709","","","","1350063","株式会社エムユービジネスサポート","3012701007492","7-503-00003","2021-06-01","2021-06-01","2021-06-01","","","新規","",""
"131083","131083E00011","江東区","仕立屋甚五郎ダイバーシティ東京プラザ店","シタテヤジンゴロウダイバーシティトウキョウプラザテン","","その他の食料・飲料販売業","","131083","","東京都江東区青海一丁目1-10ダイバーシティ東京プラザ4F","東京都","江東区","青海1丁目","1-10 ダイバーシティ東京プラザ4F","","35.625010","139.775624","(080)2137-1118","","","","1350064","株式会社日本きもの","5011101046141","7-503-00015","2021-06-01","2021-06-01","2021-06-01","","","新規","",""
"131083","131083E00012","江東区","株式会社上野珍味","カブシキガイシャウエノチンミ","","食品の小分け業","食品の小分け業","131083","","東京都江東区亀戸四丁目30-2","東京都","江東区","亀戸4丁目","30-2","","35.703978","139.827961","(03)3637-9028","","","","1360071","株式会社上野珍味","3010501010106","1-503-00395","2021-06-02","2021-06-02","2021-06-02","2028-06-30","","新規","",""
"131083","131083E00013","江東区","オーケー株式会社 亀戸店","オーケーカブシキガイシャ カメイドテン","","百貨店、総合スーパー","総合スーパー","131083","","東京都江東区亀戸九丁目4-5","東京都","江東区","亀戸9丁目","4-5","","35.696392","139.840797","(03)5875-2561","","","","1360071","オーケー株式会社","6010801001974","7-503-00025","2021-06-02","2021-06-02","2021-06-02","","","新規","",""
"131083","131083E00014","江東区","東京夢の島マリーナ 船名：アリエス","トウキョウユメノシママリーナ センメイ:アリエス","","その他の食料・飲料販売業","船上で物販販売","131083","","東京都江東区夢の島三丁目2-1","東京都","江東区","夢の島3丁目","2-1","","35.651904","139.831366","(03)5569-2710","","","","1360081","株式会社アズーロジャパン","2120001015470","7-503-00020","2021-06-02","2021-06-02","2021-06-02","","","新規","",""
"131083","131083E00015","江東区","炙りの幸","アブリノサチ","","その他の食料・飲料販売業","","131083","","東京都江東区豊洲四丁目1-2豊洲toskビル1F","東京都","江東区","豊洲4丁目","1-2 豊洲toskビル1F","","35.654633","139.797218","(03)6225-0233","","","","1350061","株式会社オーリー","9010601040823","7-503-00039","2021-06-02","2021-06-02","2021-06-02","","","新規","",""
"131083","131083E00016","江東区","江東亀戸サテライトグローバルキッズ堅川園 分園","コウトウカメイドサテライトグローバルキッズケンカワゾノ ブンエン","","集団給食施設","集団給食","131083","","東京都江東区亀戸二丁目18-5ルアナ亀戸1F","東京都","江東区","亀戸2丁目","18-5 ルアナ亀戸1F","","35.697954","139.823674","(03)3636-8551","","","","1360071","株式会社グローバルキッズ","7011801017596","7-503-00046","2021-06-03","2021-06-03","2021-06-03","","","新規","",""
"131083","131083E00017","江東区","セブン－イレブン 江東亀戸６丁目店","セブンーイレブン コウトウカメイド6チョウメテン","","コンビニエンスストア","コンビニエンスストア","131083","","東京都江東区亀戸六丁目25-5コンフォリア亀戸サウス1階","東京都","江東区","亀戸6丁目","25-5 コンフォリア亀戸サウス1階","","35.695940","139.826098","(03)3685-5390","","","","1360071","","","7-503-00055","2021-06-03","2021-06-03","2021-06-03","","","新規","",""
"131083","131083E00018","江東区","セブン－イレブン江東亀戸７丁目東店","セブンーイレブンコウトウカメイド7チョウメヒガシテン","","コンビニエンスストア","コンビニエンスストア","131083","","東京都江東区亀戸七丁目39-13","東京都","江東区","亀戸7丁目","39-13","","35.697014","139.839894","(03)3638-3033","","","","1360071","","","7-503-00058","2021-06-03","2021-06-03","2021-06-03","","","新規","",""
"131083","131083E00019","江東区","江東亀戸サテライトグローバルキッズ堅川園","コウトウカメイドサテライトグローバルキッズケンカワゾノ","","集団給食施設","集団給食","131083","","東京都江東区亀戸七丁目39-28","東京都","江東区","亀戸7丁目","39-28","","35.696566","139.839488","(03)5609-1077","","","","1360071","株式会社グローバルキッズ","7011801017596","7-503-00047","2021-06-03","2021-06-03","2021-06-03","","","新規","",""
"131083","131083E00020","江東区","セブンイレブン江東亀戸７丁目店","セブンイレブンコウトウカメイド7チョウメテン","","コンビニエンスストア","コンビニエンスストア","131083","","東京都江東区亀戸七丁目43-2ハイム丸共1階","東京都","江東区","亀戸7丁目","43-2 ハイム丸共1階","","35.696714","139.834255","(03)3683-6326","","","","1360071","株式会社よし野や","5011701014951","7-503-00057","2021-06-03","2021-06-03","2021-06-03","","","新規","",""
"131083","131083E00021","江東区","セブン－イレブン 江東西大島駅西店","セブイーンレブン コウトウニシオオジマエキニシテン","","コンビニエンスストア","コンビニエンスストア","131083","","東京都江東区大島一丁目8-17","東京都","江東区","大島1丁目","8-17","","35.689085","139.822962","(03)3684-3725","","","","1360072","","","7-503-00060","2021-06-03","2021-06-03","2021-06-03","","","新規","",""
"131083","131083E00022","江東区","セブン－イレブン 江東西大島駅前店","セブンーイレブン コウトウニシオオシマエキマエテン","","コンビニエンスストア","コンビニエンスストア","131083","","東京都江東区大島三丁目14-17-1階","東京都","江東区","大島3丁目","14-17 1階","","35.689509","139.828075","(03)3683-3818","","","","1360072","","","7-503-00056","2021-06-03","2021-06-03","2021-06-03","","","新規","",""
"131083","131083E00023","江東区","自然派家族こめ市場北砂店","シゼンハカゾクコメイチバキタスナテン","","米穀類販売業","米穀類販売業","131083","","東京都江東区北砂三丁目38-11","東京都","江東区","北砂3丁目","38-11","","35.679862","139.831230","(03)5690-8152","","","","1360073","株式会社オガワ総業","6030001050861","7-503-00043","2021-06-03","2021-06-03","2021-06-03","","","新規","",""
"131083","131083E00024","江東区","セブン イレブン 江東北砂５丁目店","セブン イレブン コウトウキタスナ5チョウメテン","","コンビニエンスストア","コンビニエンスストア","131083","","東京都江東区北砂五丁目17-35","東京都","江東区","北砂5丁目","17-35","","35.682794","139.834999","(03)3646-7780","","","","1360073","合同会社ｅｔｅｒｎａｌ Ｂｅｌｌ","9011703000748","7-503-00049","2021-06-03","2021-06-03","2021-06-03","","","新規","",""
"131083","131083E00025","江東区","ガリちゃんのぬか漬け屋","ガリチャンノヌカヅケヤ","","その他の食料品製造・加工業","店舗","131083","","東京都江東区北砂七丁目4-2","東京都","江東区","北砂7丁目","4-2","","35.678811","139.834836","","","","","1360073","エッチアンドエムリパブリック株式会社","2010601018842","7-503-00044","2021-06-03","2021-06-03","2021-06-03","","","新規","",""
"131083","131083E00026","江東区","セブンイレブン江東東砂５丁目店","セブンイレブンコウトウヒガシスナ5チョウメテン","","コンビニエンスストア","コンビニエンスストア","131083","","東京都江東区東砂五丁目1-2","東京都","江東区","東砂5丁目","1-2","","35.675826","139.840196","(03)5683-4130","","","","1360074","ケンコーポレーション株式会社","6011702003928","7-503-00050","2021-06-03","2021-06-03","2021-06-03","","","新規","",""
"131083","131083E00027","江東区","セブンイレブン江東東砂８丁目店","セブンイレブンコウトウヒガシスナ8チョウメテン","","コンビニエンスストア","コンビニエンスストア","131083","","東京都江東区東砂八丁目19-9","東京都","江東区","東砂8丁目","19-9","","35.668166","139.840988","(03)3646-4447","","","","1360074","有限会社吉田屋酒店","3010602023758","7-503-00054","2021-06-03","2021-06-03","2021-06-03","","","新規","",""
"131083","131083E00028","江東区","セブンイレブン江東南砂１丁目店","セブンイレブンコウトウミナミスナ1チョウメテン","","コンビニエンスストア","コンビニエンスストア","131083","","東京都江東区南砂一丁目5-20","東京都","江東区","南砂1丁目","5-20","","35.680943","139.822016","(03)3646-8922","","","","1360076","","","7-503-00053","2021-06-03","2021-06-03","2021-06-03","","","新規","",""
"131083","131083E00029","江東区","セブン－イレブン江東南砂葛西橋通り店","セブンーイレブンコウトウミナミスナカサイハシトオリテン","","コンビニエンスストア","コンビニエンスストア","131083","","東京都江東区南砂二丁目32-5","東京都","江東区","南砂2丁目","32-5","","35.675532","139.825025","(03)3645-0591","","","","1360076","","","7-503-00048","2021-06-03","2021-06-03","2021-06-03","","","新規","",""
"131083","131083E00030","江東区","セブンイレブン新木場１丁目店","セブンイレブンシンキバ1チョウメテン","","コンビニエンスストア","コンビニエンスストア","131083","","東京都江東区新木場一丁目4-7","東京都","江東区","新木場1丁目","4-7","","35.643796","139.824674","(03)3521-7711","","","","1360082","","","7-503-00052","2021-06-03","2021-06-03","2021-06-03","","","新規","",""
"131083","131083E00031","江東区","ｉｒｏＨａ","iroHa","","露店、仮設店舗等における飲食の提供のうち、営業とみなされないもの","露店、仮設店舗等における飲食の提供のうち、営業とみなされないもの","131083","","東京都江東区新木場一丁目6-1","東京都","江東区","新木場1丁目","6-1","","35.645061","139.827506","","","","","1360082","有限会社天平フーズ","3160002011398","7-503-00041","2021-06-03","2021-06-03","2021-06-03","","","新規","",""
"131083","131083E00032","江東区","セブンイレブン江東新大橋３丁目店","セブンイレブンコウトウシンオオハシ3チョウメテン","","コンビニエンスストア","コンビニエンスストア","131083","","東京都江東区新大橋三丁目9-9","東京都","江東区","新大橋3丁目","9-9","","35.688194","139.795415","(03)3846-3300","","","","1350007","","","7-503-00083","2021-06-03","2021-06-03","2021-06-03","","","新規","",""
"131083","131083E00033","江東区","セブンイレブン江東森下１丁目店","セブンイレブンコウトウモリシタ1チョウメテン","","コンビニエンスストア","コンビニエンスストア","131083","","東京都江東区森下一丁目10-5","東京都","江東区","森下1丁目","10-5","","35.687776","139.796944","(03)3632-4720","","","","1350004","","","7-503-00082","2021-06-03","2021-06-03","2021-06-03","","","新規","",""
"131083","131083E00034","江東区","セブンイレブン清澄白河駅東店","セブンイレブンキヨスミシラカワエキヒガシテン","","コンビニエンスストア","飲食店営業","131083","","東京都江東区白河二丁目17-10","東京都","江東区","白河2丁目","17-10","","35.682516","139.803550","(03)3641-0517","","","","1350021","","","7-503-00071","2021-06-03","2021-06-03","2021-06-03","","","新規","",""
"131083","131083E00035","江東区","築地やまの","ツキジヤマノ","","弁当販売業","弁当販売業","131083","","東京都江東区三好一丁目4-19","東京都","江東区","三好1丁目","4-19","","35.679236","139.800979","","","","","1350022","株式会社Ｓ＆Ｆ","1010901002506","7-503-00051","2021-06-03","2021-06-03","2021-06-03","","","新規","",""
"131083","131083E00036","江東区","セブン－イレブン江東平野２丁目店","セブンーイレブンコウトウヒラノ2チョウメテン","","コンビニエンスストア","コンビニエンスストア","131083","","東京都江東区平野二丁目12-5","東京都","江東区","平野2丁目","12-5","","35.677383","139.803556","(03)3642-8171","","","","1350023","","","7-503-00079","2021-06-03","2021-06-03","2021-06-03","","","新規","",""
"131083","131083E00037","江東区","セブンイレブン江東毛利店","セブンイレブンコウトウモウリテン","","コンビニエンスストア","コンビニエンスストア","131083","","東京都江東区毛利一丁目6-10","東京都","江東区","毛利1丁目","6-10","","35.692001","139.813176","(03)3631-0945","","","","1350001","","","7-503-00080","2021-06-03","2021-06-03","2021-06-03","","","新規","",""
"131083","131083E00038","江東区","セブンイレブン江東住吉２丁目店","セブンイレブンコウトウスミヨシ2チョウメテン","","コンビニエンスストア","コンビニエンスストア","131083","","東京都江東区住吉二丁目7-6","東京都","江東区","住吉2丁目","7-6","","35.688779","139.815212","(03)3631-1578","","","","1350002","有限会社黒澤商店","9010602008035","7-503-00075","2021-06-03","2021-06-03","2021-06-03","","","新規","",""
"131083","131083E00039","江東区","セブン－イレブン 江東猿江１丁目店","セブンーイレブン コウトウサルエ1チョウメテン","","コンビニエンスストア","コンビニエンスストア","131083","","東京都江東区猿江一丁目9-10","東京都","江東区","猿江1丁目","9-10","","35.685743","139.812781","(03)3632-3633","","","","1350003","","","7-503-00064","2021-06-03","2021-06-03","2021-06-03","","","新規","",""
"131083","131083E00040","江東区","セブンイレブン江東扇橋店","セブンイレブンコウトウオウギバシテン","","コンビニエンスストア","コンビニエンスストア","131083","","東京都江東区扇橋一丁目12-18","東京都","江東区","扇橋1丁目","12-18","","35.683110","139.813072","(03)3649-6697","","","","1350011","有限会社フジイ","6010602026089","7-503-00077","2021-06-03","2021-06-03","2021-06-03","","","新規","",""
"131083","131083E00041","江東区","セブンイレブン江東海辺店","セブンイレブンコウトウウミベテン","","コンビニエンスストア","コンビニエンスストア","131083","","東京都江東区海辺2-7","東京都","江東区","海辺","2-7","","35.680474","139.817972","(03)5634-1750","","","","1350012","有限会社黒澤商店","9010602008035","7-503-00062","2021-06-03","2021-06-03","2021-06-03","","","新規","",""
"131083","131083E00042","江東区","セブンイレブン江東佐賀１丁目店","セブンイレブンコウトウサガ1チョウメテン","","コンビニエンスストア","コンビニエンスストア","131083","","東京都江東区佐賀一丁目8-6","東京都","江東区","佐賀1丁目","8-6","","35.676471","139.790333","(03)3630-4077","","","","1350031","","","7-503-00086","2021-06-03","2021-06-03","2021-06-03","","","新規","",""
"131083","131083E00043","江東区","セブン－イレブン門前仲町駅西店","セブンーイレブンモンゼンナカチョウエキニシテン","","コンビニエンスストア","","131083","","東京都江東区永代二丁目31-1","東京都","江東区","永代2丁目","31-1","","35.673746","139.792373","(03)3643-3411","","","","1350034","","","7-503-00063","2021-06-03","2021-06-03","2021-06-03","","","新規","",""
"131083","131083E00044","江東区","セブン－イレブン江東木場１丁目店","セブンーイレブンコウトウキバ1チョウメテン","","コンビニエンスストア","コンビニエンスストア","131083","","東京都江東区木場一丁目5-25深川ギャザリアタワーS棟1階","東京都","江東区","木場1丁目","5-25 深川ギャザリアタワーS棟1階","","35.666718","139.804790","(03)5683-8701","","","","1350042","","","7-503-00084","2021-06-03","2021-06-03","2021-06-03","","","新規","",""
"131083","131083E00045","江東区","セブン－イレブン江東木場駅南店","セブンーイレブンコウトウキバエキナンテン","","コンビニエンスストア","コンビニエンスストア","131083","","東京都江東区木場五丁目1-4小林ニックハイム木場公園第2","東京都","江東区","木場5丁目","1-4 小林ニックハイム木場公園第2","","35.669023","139.805976","(03)3820-8208","","","","1350042","","","7-503-00087","2021-06-03","2021-06-03","2021-06-03","","","新規","",""
"131083","131083E00046","江東区","セブンイレブン東陽店","セブンイレブントウヨウテン","","コンビニエンスストア","コンビニエンスストア","131083","","東京都江東区東陽三丁目21-6","東京都","江東区","東陽3丁目","21-6","","35.669028","139.811773","(03)3644-4433","","","","1350016","株式会社テラモト","8010601018399","7-503-00067","2021-06-03","2021-06-03","2021-06-03","","","新規","",""
"131083","131083E00047","江東区","セブン－イレブン 江東区役所前店","セブンーンレブン コウトウクヤクショマエテン","","コンビニエンスストア","コンビニエンスストア","131083","","東京都江東区東陽五丁目31-17","東京都","江東区","東陽5丁目","31-17","","35.673144","139.815969","(03)3644-2101","","","","1350016","","","7-503-00065","2021-06-03","2021-06-03","2021-06-03","","","新規","",""
"131083","131083E00048","江東区","セブン－イレブン 江東塩浜２丁目店","セブンーイレブン コウトウシオハマ2チョウメテン","","コンビニエンスストア","","131083","","東京都江東区塩浜二丁目4-35","東京都","江東区","塩浜2丁目","4-35","","35.662323","139.803816","(03)5633-5785","","","","1350043","","","7-503-00070","2021-06-03","2021-06-03","2021-06-03","","","新規","",""
"131083","131083E00049","江東区","セブン－イレブン 江東塩浜店","セブンーイレブン コウトウシオハマテン","","コンビニエンスストア","","131083","","東京都江東区塩浜二丁目11-18ユンパーク木場1階","東京都","江東区","塩浜2丁目","11-18 ユンパーク木場1階","","35.663655","139.810091","(03)3645-1323","","","","1350043","有限会社矢数","3010602020400","7-503-00068","2021-06-03","2021-06-03","2021-06-03","","","新規","",""
"131083","131083E00050","江東区","セブンイレブン 江東枝川２丁目店","セブンイレブン コウトウエダカワ2チョウメテン","","コンビニエンスストア","","131083","","東京都江東区枝川二丁目2-8","東京都","江東区","枝川2丁目","2-8","","35.659207","139.807311","","","","","1350051","","","7-503-00066","2021-06-03","2021-06-03","2021-06-03","","","新規","",""
"131083","131083E00051","江東区","医療法人青峰会 くじらホスピタル","イリョウホウジンセイホウカイ クジラホスピタル","","集団給食施設","","131083","","東京都江東区枝川三丁目8-25","東京都","江東区","枝川3丁目","8-25","","35.659099","139.812592","(03)5634-1123","","","","1350051","医療法人青峰会","3500005003614","7-503-00091","2021-06-03","2021-06-03","2021-06-03","","","新規","",""
"131083","131083E00052","江東区","セブン－イレブン ＴＦＴ有明店","セブンーイレブン TFTアリアケテン","","コンビニエンスストア","","131083","","東京都江東区有明三丁目6-11TFTビル東館1階","東京都","江東区","有明3丁目","6-11 TFTビル東館1階","","35.630876","139.790550","(03)3529-5018","","","","1350063","有限会社吉田屋酒店","3010602023758","7-503-00074","2021-06-03","2021-06-03","2021-06-03","","","新規","",""
