指数同一の場合の優先項目,,,,,,,,,,,,,,,,,,,,,,,,,,,,,,,
きょうだいが同一の保育園に在園している,,,,,,,,,,,,,,,,,,,,,,,,,,,,,,,
生活保護受給世帯等生活が困窮していることが明らかな世帯,,,,,,,,,,,,,,,,,,,,,,,,,,,,,,,
保護者の就労状況（勤務地、勤務時間等）,,,,,,,,,,,,,,,,,,,,,,,,,,,,,,,
ひとり親世帯,,,,,,,,,,,,,,,,,,,,,,,,,,,,,,,
地域型保育事業、東上野乳児保育園、康保会乳児保育所、ミアヘルサ保育園ひびき浅草の卒園児（４月入園のみ）,,,,,,,,,,,,,,,,,,,,,,,,,,,,,,,
保護者どちらかが単身赴任（住居別）,,,,,,,,,,,,,,,,,,,,,,,,,,,,,,,
多胎児,,,,,,,,,,,,,,,,,,,,,,,,,,,,,,,
きょうだいの数,,,,,,,,,,,,,,,,,,,,,,,,,,,,,,,
待機期間,,,,,,,,,,,,,,,,,,,,,,,,,,,,,,,
同一年度内の入所内定で内定辞退をしていない,,,,,,,,,,,,,,,,,,,,,,,,,,,,,,,
単園希望ではない,,,,,,,,,,,,,,,,,,,,,,,,,,,,,,,
祖父母の状況,,,,,,,,,,,,,,,,,,,,,,,,,,,,,,,
保護者どちらかが身体障害者手帳・愛の手帳・精神障害者保健福祉手帳を交付されている,,,,,,,,,,,,,,,,,,,,,,,,,,,,,,,
