施設名称,所在地,備考,緯度,経度
品川区役所,東京都品川区広町2-1-36,"品川区広町2-1-36 電話03-3777-1111(代)併設 防災センター 国際友好協会 リサイクルショップリボン 1階　法務局品川出張所2階　都税事務所8階　建設局第二建設事務所",35.6093959,139.7301459
品川第一地域センター・区民集会所,東京都品川区北品川3-11-16,"住所 北品川3-11-16 電話 3450-2000交通 新馬場駅徒歩3分●届出●証明書●支払い●集会所あり",35.6166735,139.7399950
品川第二地域センター・区民集会所,東京都品川区南品川5-3-20,"住所 南品川5-3-20電話 3472-2000交通 青物横丁駅徒歩5分、大井町駅徒歩10分●証明書●支払い●集会所あり",35.6113482,139.7412774
大崎第一地域センター・区民集会所,東京都品川区西五反田3-6-3,"住所 西五反田3-6-3電話 3491-2000交通 五反田駅、目黒駅各徒歩10分、不動前駅徒歩5分●届出●証明書●支払い●集会所あり",35.6279721,139.7164476
大井第一地域センター,東京都品川区南大井1-12-6,"住所 南大井1-12-6　　(南大井文化センタ-内)電話 3761-2000交通 立会川駅徒歩5分●届出 ●証明書 ●支払い 集会所はありません",35.5963292,139.7375406
大井第二地域センター・区民集会所,東京都品川区大井2-27-20,"住所 大井2-27-20電話 3772-2000交通 大井町駅徒歩10分併設 大井保健相談所●証明書 ●支払い ●集会所あり",35.6040785,139.7304557
大井第三地域センター・区民集会所,東京都品川区西大井4-1-8,"住所 西大井4-1-8電話 3773-2000交通 西大井駅徒歩10分●証明書 ●支払い ●集会所あり",35.5976934,139.7211039
荏原第一地域センター・区民集会所,東京都品川区小山3-22-3,"住所 小山3-22-3電話 3786-2000交通 武蔵小山駅徒歩5分●届出 ●証明書 ●支払い ●集会所あり",35.6192605,139.7057503
荏原第二地域センター・区民集会所,東京都品川区荏原6-17-12,"住所 荏原6-17-12電話 3782-2000交通 旗の台駅、西小山駅各徒歩10分●証明書 ●支払い ●集会所あり",35.6110694,139.7043829
荏原第三地域センター・区民集会所,東京都品川区平塚1-13-18,"住所 平塚1-13-18電話 3783-2000交通 戸越駅徒歩3分、戸越銀座駅徒歩5分●証明書 ●支払い ●集会所あり",35.6133434,139.7153629
荏原第四地域センター・区民集会所,東京都品川区中延5-3-12,"住所 中延5-3-12電話 3784-2000交通 荏原町駅徒歩1分●届出 ●証明書 ●支払い ●集会所あり",35.6038249,139.7084941
八潮地域センター・区民集会所,東京都品川区八潮5-10-27,"住所 八潮5-10-27電話 3799-2000交通 JR大井町駅・品川駅からバス「八潮パ-クタウン」下車1分、モノレール大井競馬場前駅徒歩10分",35.6001681,139.7514663
東大井区民集会所,東京都品川区東大井2-16-12,品川区東大井2-16-12,35.6005168,139.7415771
防災センター,東京都品川区広町2-1-36,品川区広町2-1-36,35.6096778,139.7302715
大崎第二地域センター・区民集会所,東京都品川区大崎2-9-4,"住所 大崎2-9-4(大崎ウエストシティタワーズ貢献施設棟1、2階)電話 3492-2000交通 大崎駅南改札口徒歩5分（新西口方面）●証明書●支払い●集会所あり",35.6166490,139.7279883
荏原第五地域センター・区民集会所,東京都品川区二葉1-1-2,"TEL 3785-2000 FAX 3785-2016 交通 下神明駅徒歩1分 ・証明書 ・支払 ・集会所あり",35.6081773,139.7256994
