番号,名称
1,品川区行政不服審査会
2,品川区情報公開審議会
3,品川区個人情報保護審議会
4,品川区いじめ問題調査委員会
5,品川区特別職報酬等審議会
6,品川区財産価格審議会
7,品川区生活安全協議会
8,品川区青少年問題協議会
9,品川区奨学金運営委員会
10,品川区子ども・子育て会議
11,品川区介護保険制度推進委員会
12,品川区介護認定審査会
13,品川区民生委員推薦会
14,品川区障害者介護給付費等支給審査会
15,品川区国民健康保険事業の運営に関する協議会
16,品川区公害健康被害認定審査会
17,品川区公害健康被害補償診療報酬審査会
18,品川区大気汚染障害者認定審査会
19,品川区感染症診査協議会
20,品川区景観審議会
21,品川区都市計画審議会
22,品川区建築審査会
23,品川区建築紛争調停委員会
24,品川区空き家等適正管理審議会
25,品川区廃棄物減量等推進審議会
26,品川区交通安全対策会議
27,品川区防災会議
28,品川区国民保護協議会
29,品川区債権管理審議会
30,品川区文化財保護審議会
31,品川区いじめ対策委員会
32,品川区消防団運営委員会
33,品川区総合戦略推進委員会
34,品川区総合教育会議
35,品川区行動計画推進会議
36,品川区居住支援協議会
37,品川区地域公共交通会議
38,品川区自転車活用推進計画策定協議会
39,品川区庁舎跡地等活用検討委員会
40,旧荏原第四中学校跡地活用方針策定委員会
41,品川区政策評価委員会
