杉並区,JR東日本ホテルメッツ　高円寺
杉並区,JXTGエネルギー株式会社有限会社斉藤商店ハイウェル上高井戸サービスステーション
杉並区,葵交通株式会社
杉並区,株式会社ムサシノキカイ
杉並区,株式会社ルミネ荻窪店
杉並区,(株)ルミネクリエーツ荻窪営業所
杉並区,高円寺交通株式会社
杉並区,社会福祉法人　いたるセンター　SDGｓ推進室
杉並区,社会福祉法人　いたるセンター　あけぼの作業所
杉並区,社会福祉法人　いたるセンター　阿佐谷福祉工房
杉並区,社会福祉法人　いたるセンター　杉並区障害者地域相談支援センター（すまいる高井戸）
杉並区,社会福祉法人　いたるセンター　短期入所クローバー
杉並区,社会福祉法人　いたるセンター　パン工房PukuPuku
杉並区,社会福祉法人　いたるセンター　ピヨピヨおうちえん
杉並区,社会福祉法人　いたるセンター　ピヨピヨおうちえん荻窪駅前
杉並区,社会福祉法人　いたるセンター　包括ケアセンター
杉並区,東日本旅客鉄道株式会社　西荻窪駅
杉並区,京王電鉄株式会社富士見ヶ丘検車区
杉並区,京王電鉄株式会社富士見ヶ丘乗務区
墨田区,社会福祉法人　悠晴
墨田区,日信電子サービス株式会社
墨田区,アパホテル＆リゾート両国駅タワー
墨田区,イトーヨーカ堂曳舟店
墨田区,医療法人伯鳳会介護老人保健施設ベレール向島
墨田区,株式会社 第一ホテル両国
墨田区,株式会社　釣庄
墨田区,株式会社　東京楽天地
墨田区,株式会社　藤江
墨田区,株式会社　山田屋
墨田区,株式会社東武ホテルマネジメント東武ホテルレバント東京
墨田区,ジェイアール東日本ビルテック株式会社錦糸町駅ビル事業所
墨田区,社会福祉法人　賛育会　東京清風園
墨田区,東京不動産管理株式会社
墨田区,パンダ保育園
墨田区,冨士自動車株式会社
墨田区,有限会社　船宿釣新
墨田区,有限会社ヤマキ堤通給油所
墨田区,両国なかよし保育園
墨田区,株式会社鈴勘錦糸町サービスステーション
世田谷区,公益財団法人世田谷区スポーツ振興財団
世田谷区,ENEEOSフロンティア東京カンパニー
世田谷区,ENEOS株式会社　尾山台SS
世田谷区,出光石油セルフ上野毛SS
世田谷区,株式会社鈴美商亊セルフ等々力
世田谷区,株式会社世田谷サービス公社
世田谷区,関東燃料㈱　新町サービスステーション
世田谷区,関東燃料㈱尾山台給油所
世田谷区,京王電鉄株式会社鉄道事業本部車両電気部　通信管理所
世田谷区,京王電鉄株式会社鉄道事業本部鉄道営業部　井の頭北管区
世田谷区,京王電鉄株式会社鉄道事業本部鉄道営業部　京王東管区
世田谷区,京王電鉄株式会社鉄道事業本部鉄道営業部　桜上水乗務区
世田谷区,公益財団法人せたがや文化財団世田谷美術館
世田谷区,公益財団法人せたがや文化財団世田谷文学館
世田谷区,コスモ石油販売㈱セルフピュア尾山台ＳＳ
世田谷区,駒場学園高等学校
世田谷区,下北沢成徳高等学校
世田谷区,社会福祉法人　いたるセンター　イタール成城
世田谷区,社会福祉法人杉の子保育会遊愛保育園
世田谷区,スポーツクラブ＆スパ　ルネサンス経堂
世田谷区,世田谷区立大蔵第二運動場
世田谷区,世田谷区立総合運動場
世田谷区,世田谷区立総合運動場温水プール
世田谷区,世田谷区立千歳温水プール
世田谷区,世田谷祖師ヶ谷大蔵雲母保育園
世田谷区,田園調布学園中等部・高等部
世田谷区,東急セキュリティ株式会社
世田谷区,東洋油脂㈱駒沢給油所
世田谷区,特別養護老人ホーム　千歳敬心苑
世田谷区,日新商事株式会社Dr.Dｒｉｖｅ赤堤ＳＳ
世田谷区,マックスエネルギー株式会社
世田谷区,山文商事㈱サンライズ等々力SS
世田谷区,三信石油株式会社クルー１９玉堤
世田谷区,社会福祉法人青い空保育園
世田谷区,中央石油㈱用賀石油販売
世田谷区,日米石油㈱　上野毛ss
台東区,　有限会社　つり清
台東区,東京地下鉄株式会社本社
台東区,屋形船東京都協同組合事務局
台東区,JLLモールマネージメント株式会社
台東区,JR東日本ﾋﾞﾙﾃｯｸ株式会社 アトレ上野事業所
台東区,浅草ケアパークそよ風
台東区,アパホテル秋葉原駅北
台東区,アパホテル浅草駅前
台東区,アパホテル浅草雷門
台東区,アパホテル浅草蔵前
台東区,アパホテル浅草田原町駅前
台東区,アパホテル浅草橋駅北
台東区,アパホテル上野稲荷町駅北
台東区,アパホテル上野駅前
台東区,アパホテル京成上野駅前
台東区,医療法人社団　松山会　ことぶきわたなべ歯科医院
台東区,上野学園中学校高等学校
台東区,エスパス日拓上野新館
台東区,エスパス日拓上野本館
台東区,えびす屋浅草
台東区,株式会社　ＪＳＳ
台東区,株式会社　あみ清産業
台東区,株式会社　野田屋
台東区,株式会社アトレ上野店
台東区,株式会社ソニックスsonix永住
台東区,台東区役所
台東区,東京地下鉄株式会社　改良建設部　第一工事事務所
台東区,東京地下鉄株式会社上野変電区
台東区,東京地下鉄株式会社軌道工事所
台東区,東京地下鉄株式会社銀座線工務区
台東区,東京地下鉄株式会社銀座線信通区
台東区,東京地下鉄株式会社銀座線電機区
台東区,東京地下鉄株式会社工務部土木工事所
台東区,東京都立浅草高等学校
台東区,東京リバーサイド学園
台東区,特別区社会福祉事業団　更生施設　しのばず荘
台東区,日信電子サービス株式会社東京支店
台東区,ハビリス・リ・トキ台東
台東区,船宿　あみ春
台東区,船宿田中屋　有限会社
台東区,有限会社　あみ新
台東区,有限会社　井筒屋
台東区,有限会社　船宿三浦屋
台東区,有限会社サンエイプランニング
台東区,有限会社砂川屋旅館　ビジネスホテルつつみ
台東区,有限会社砂川屋旅館　ビジネスホテルつつみ本店
台東区,学校法人蔵前学園　蔵前幼稚園
台東区,日本ビューホテル株式会社浅草ビューホテル
中央区,ＴＯＨＯ株式会社
中央区,アパホテル銀座京橋
中央区,アパホテル銀座宝町
中央区,アパホテル小伝馬町駅前
中央区,アパホテル新富町駅北
中央区,アパホテル新富町駅前
中央区,アパホテル築地駅南
中央区,アパホテル日本橋馬喰町駅前
中央区,アパホテル日本橋馬喰横山駅前
中央区,アパホテル日本橋浜町駅南
中央区,アパホテル人形町駅北
中央区,アパホテル人形町駅東
中央区,アパホテル八丁堀駅南
中央区,アパホテル八丁堀新富町
中央区,アパホテル東日本橋駅前
中央区,学校法人開智学園　開智日本橋学園中学・高等学校
中央区,株式会社　晴海コーポレーション
中央区,株式会社アヅマ
中央区,株式会社エトワール海渡
中央区,株式会社グループファイブ
中央区,株式会社清水建設
中央区,株式会社新和興業
中央区,株式会社東武ホテルマネジメント　コートヤード・マリオット銀座東武ホテル
中央区,株式会社頭部ホテルマネジメントACホテル・バイ・マリオット東京銀座
中央区,株式会社飛和興業
中央区,株式会社はとバス　銀座キャピタルホテル
中央区,株式会社松屋銀座本店
中央区,株式会社マロニエゲート
中央区,株式会社三越伊勢丹　三越日本橋本店
中央区,株式会社和光
中央区,乾気船株式会社
中央区,京葉ロードメンテナンス株式会社
中央区,共立株式会社
中央区,銀座ホテルマネジメント合同会社ハイアットセントリック銀座東京
中央区,グローバルキッズかきがら園
中央区,松竹株式会社歌舞伎座
中央区,松竹株式会社新橋演舞場
中央区,住倉建物サービス株式会社　東京事業部
中央区,隅田商事株式会社　永代橋エコＳＳ
中央区,全電協株式会社本社
中央区,ダイヤビルテック株式会社
中央区,ティッセンクルップ・ウーデ・クロリンエンジニアリングズ株式会社
中央区,東京駅八重州大地下街商店会
中央区,東京海員会館
中央区,東京地下鉄株式会社｢銀座駅務管区銀座地域」
中央区,東京地下鉄株式会社｢銀座駅務管区東銀座地域」
中央区,東京都交通局電車部馬喰駅務管理所
中央区,日本運行システム株式会社
中央区,日本交通株式会社銀座営業所内ハイヤー研修センター
中央区,ファシリティパートナーズ株式会社
中央区,舟宿　小松屋
中央区,ミアヘルサ株式会社認可保育所日生東日本橋保育園ひびき
中央区,三井不動産株式会社日本橋一丁目オフィス
中央区,三井不動産株式会社ビルディング本部
中央区,三井不動産ファシリティーズ株式会社
中央区,明光石油株式会社日本橋カズヲスタンド店
中央区,屋形船　かねこ
中央区,有限会社　鈴木屋
中央区,株式会社明治座
中央区,隅田商事株式会社本石町エコサービスステーション
中央区,東京建物株式会社
中央区,東京地下鉄株式会社上野駅務管区茅場町地域
中央区,東京地下鉄株式会社日本橋駅務管区日本橋地域
千代田区,東京消防信用組合 本店
千代田区,東京都石油商業組合
千代田区,浜友観光株式会社東京本社
千代田区,ＡＬＳＯＫ東京株式会社
千代田区,ＡＬＳＯＫ昇日セキュリティーサービス株式会社
千代田区,JR東日本ビルテック株式会社　東京駅丸の内事業所
千代田区,JR東日本ビルテック株式会社 東京支店東京事業センター東京駅設備管理センター
千代田区,JR東日本ビルテック株式会社サウスタワー事業所
千代田区,JR東日本ビルテック株式会社サピアタワー事業所
千代田区,JR東日本ビルテック株式会社ホテルエドモント事業所
千代田区,JR東日本ホテルメッツ　秋葉原
千代田区,ＪＲ東日本ビルテック株式会社ＪＥＢＬ秋葉原スクエア事業所
千代田区,ＪＲ東日本ビルテック株式会社アトレ秋葉原事業所
千代田区,JR東日本ビルテック株式会社東京支店東京駅防災センター
千代田区,RB工装株式会社  東京事業部
千代田区,ｱｰﾊﾞﾝﾈｯﾄ大手町ビル管理
千代田区,暁星中学高等学校
千代田区,アパホテル秋葉原駅前
千代田区,アパホテル飯田橋駅前
千代田区,アパホテル飯田橋駅南
千代田区,アパホテル上野広小路
千代田区,アパホテル神田駅東
千代田区,アパホテル神田駅前
千代田区,アパホテル神田神保町駅東
千代田区,アパホテル東京九段下
千代田区,アパホテル日本橋馬喰町駅北
千代田区,アパホテル半蔵門平河町
千代田区,アパホテルプライド国会議事堂前
千代田区,アマン東京
千代田区,イイノ・ビルテック株式会社
千代田区,一般財団法人  法曹会
千代田区,一般財団法人主婦会館
千代田区,一般財団法人電力中央研究所
千代田区,エスパス日拓秋葉原駅前店
千代田区,株式会社　ＪＲ東日本クロスステーション（株式会社　鉄道会館から名称変更）
千代田区,株式会社エトワール海渡　商品部
千代田区,株式会社エム・シー・ファシリティーズ
千代田区,株式会社セノン東京システム支社
千代田区,株式会社セノン東京第一支社
千代田区,株式会社セノン東京第三支社
千代田区,株式会社セノン東京第二支社
千代田区,株式会社セブン＆アイ・ホールディングス
千代田区,株式会社タカシマ
千代田区,株式会社帝国ホテル
千代田区,株式会社帝国ホテルハイヤー
千代田区,株式会社東京會舘
千代田区,株式会社東京交通会館
千代田区,株式会社ナカタニ神田明神下給油所
千代田区,株式会社ニュー・オータニ
千代田区,株式会社宝珠ベビーケアサービス
千代田区,(株)毎日ビルディング
千代田区,共栄石油株式会社小川町ＳＳ
千代田区,共栄セキュリティーサービス株式会社
千代田区,グラングルメ
千代田区,グランスタ
千代田区,グランルーフ
千代田区,グランルーフフロント
千代田区,経団連会館防災センター
千代田区,ケッズスポーツマッサージ神田小川町
千代田区,公益財団法人ニッセイ文化振興財団
千代田区,公益財団法人日本ケアフィット共育機関
千代田区,公益財団法人日本武道館
千代田区,五大テック株式会社東京支社
千代田区,国家公務員共済組合連合会東京共済会館（ＫＫＲホテル東京）
千代田区,シアタークリエ
千代田区,住商ビルマネージメント株式会社
千代田区,隅田商事（株）東神田ＳＳ
千代田区,セントラル警備保障株式会社　東京事業部グラントウキョウサウスタワー事業所
千代田区,東海旅客鉄道株式会社東京駅
千代田区,東京高速道路株式会社
千代田区,東京商工会議所
千代田区,東京ステーション開発株式会社
千代田区,東京地下鉄株式会社飯田橋駅務管区九段下地域
千代田区,東京地下鉄株式会社霞ヶ関駅務管区国会議事堂前駅
千代田区,東京地下鉄㈱新御茶ノ水駅
千代田区,東京都交通局日比谷駅務管区（新宿から交付）
千代田区,東宝株式会社  帝国劇場
千代田区,東宝ファシリティーズ株式会社
千代田区,特別区社会福祉事業団　自立支援センター　千代田寮
千代田区,日経ビル・ＪＡビル・経団連会館全体共用部管理事務所
千代田区,日本経済新聞社東京本社ビル防災センター
千代田区,日本コンベンションサービス株式会社
千代田区,日本信号株式会社
千代田区,日本ホテル株式会社　東京ステーションホテル
千代田区,日本ホテル株式会社ホテルメトロポリタンエドモント
千代田区,パシフィックセンチュリープレイス丸の内防災センター
千代田区,防災士研修センター
千代田区,ホテルメトロポリタン丸の内
千代田区,三菱地所株式会社
千代田区,三菱地所プロパティマネジメント株式会社
千代田区,有楽町朝日ホール
千代田区,株式会社アトレ秋葉原店
千代田区,株式会社パレスホテル
千代田区,株式会社帝国ホテルサービス
千代田区,株式会社東京国際フォーラム
千代田区,東日本旅客鉄道株式会社有楽町駅
千代田区,東日本旅客鉄道株式会社東京駅
豊島区,日本ホテル（株）ホテルメトロポリタン
豊島区,JR東日本ﾋﾞﾙﾃｯｸ株式会社ﾒﾄﾛﾎﾟﾘﾀﾝﾌﾟﾗｻﾞﾋﾞﾙ事業所
豊島区,JR東日本ホテルメッツ　駒込
豊島区,JR東日本ホテルメッツ　目白
豊島区,アパホテル池袋駅北口
豊島区,アパホテル駒込駅前
豊島区,アパホテル巣鴨駅前
豊島区,アパホテル東京板橋駅前
豊島区,アパホテル山手大塚駅タワー
豊島区,学校法人本郷学園
豊島区,株式会社KSP・EAST
豊島区,株式会社ケアリッチ
豊島区,株式会社黒龍堂　ホテルグランドシティ
豊島区,株式会社東武百貨店
豊島区,公益財団法人東京都歴史文化財団東京芸術劇場
豊島区,サンシャインシティプリンスホテル
豊島区,すずらん通り商店街
豊島区,ダイヤ通商株式会社巣鴨給油所
豊島区,東京燃料林産株式会社池袋給油所
豊島区,特別養護老人ホームアトリエ村
豊島区,豊島区役所
豊島区,浜友観光株式会社　楽園　池袋店
豊島区,ホテルベルクラシック東京
豊島区,社会福祉法人毛里田睦会　まちの保育園東池袋
中野区,株式会社七星科学研究所
中野区,株式会社マルイファシリティーズ
中野区,ケッズ鍼灸接骨院中野
中野区,渋谷石油株式会社中野サービスステーション
中野区,スギコーケアセンター野方
中野区,東亜学園高等学校
中野区,日本自動車交通株式会社
中野区,まつざわ動物病院
中野区,大和幼稚園
中野区,実践学園中学・高等学校
中野区,専門学校東京工科自動車大学校
中野区,東京地下鉄株式会社新宿駅務管区中野坂上地域
中野区,明治大学付属中野中学・高等学校
中野区,弥生交通株式会社
練馬区,社会福祉法人マーガレット学園　マーガレット保育園
練馬区,かちどき製粉株式会社
練馬区,学校法人愛和学園愛和幼稚園
練馬区,株式会社新都市ライフホールディングス光が丘事業本部
練馬区,株式会社太平洋シルバーサービスシルバーシティ石神井北館
練馬区,株式会社太平洋シルバーサービスシルバーシティ石神井南館
練馬区,株式会社トリートップ
練馬区,公園南住宅防災隊
練馬区,社会福祉法人エンゼル保育園
練馬区,社会福祉法人大泉松和会大泉保育園
練馬区,社会福祉法人マーガレット学園　マーガレット保育園分園
練馬区,社会福祉法人南光会なんこう保育園
練馬区,社会福祉法人武蔵野会練馬福祉園
練馬区,スポーツクラブＮＡＳ光が丘
練馬区,東京少年鑑別所
練馬区,にじいろ保育園上石神井
練馬区,認定こども園南光幼稚園
練馬区,練馬区立光が丘体育館
練馬区,ホテル都
練馬区,武蔵大学体育連合会
練馬区,中村石油株式会社練馬北町給油所
練馬区,東京地下鉄株式会社有楽町・副都心線乗務管区小竹運転事務室
練馬区,東京地下鉄株式会社有楽町・副都心線乗務管区小竹車掌事務室
練馬区,豊玉タクシー株式会社
文京区, 文京学院大学女子中学校高等学校
文京区,アパホテル御茶ノ水駅北
文京区,一般財団法人東京大学運動会
文京区,科研製薬株式会社
文京区,学校法人　桜蔭学園
文京区,株式会社CAPITA湯島ＳＳ
文京区,株式会社東京ドームホテル
文京区,こころおちゃのみず第一保育園
文京区,こころおちゃのみず第二保育園
文京区,こどもヶ丘保育園本駒込園
文京区,こどもヶ丘保育園第二本駒込園
文京区,宗教法人天心聖教
文京区,新北斗警備保障株式会社
文京区,テンダーラビング保育園千駄木
文京区,東京地下鉄株式会社営業部後楽園役務管区後楽園地域
文京区,特定非営利活動法人　FBO
文京区,文京区役所
文京区,ヤマト徽章株式会社
文京区,京華学園
文京区,中央シェル石油販売株式会社セルフ本郷給油所
港区,（株）阪急阪神ホテルズ第一ホテル東京
港区,アパホテル株式会社
港区,ティッセンクルップ・ジャパン株式会社
港区,ANAインターコンチネンタルホテル東京
港区,ＪＲ東日本ビルテック株式会社ウォーターズ竹芝事業所
港区,ＪＲ東日本ビルテック株式会社品川イーストビル事業所
港区,ＭＴ＆ヒルトンホテル株式会社コンラッド東京
港区,ＴＭＥＳ株式会社
港区,ＴＯＴＯ株式会社
港区,赤坂インターシティマネジメント株式会社
港区,アパヴィラホテル赤坂見附
港区,アパホテル品川泉岳寺駅前
港区,アパホテル新橋御成門
港区,アパホテル新橋虎ノ門
港区,アパホテル西麻布
港区,アパホテル三田駅前
港区,アパホテル六本木SIX
港区,アパホテル六本木駅前
港区,アラコム株式会社
港区,アンダーズ東京
港区,一般財団法人アジア会館
港区,一般社団法人東京アメリカンクラブ
港区,一般社団法人東京倶楽部
港区,出光リテール販売株式会社東京カンパニー青山中央サービスステーション
港区,エームサービス株式会社
港区,エスパス日拓赤坂見附駅前店
港区,株式会社　網長
港区,株式会社　スタッフ・ユー
港区,株式会社アトレ品川店
港区,株式会社関東東急ホテルズ新橋愛宕山東急ＲＥＩホテル
港区,株式会社グランドニッコー東京　グランドニッコー東京台場
港区,株式会社西武・プリンスホテルズワールドワイド　東京プリンスホテル
港区,株式会社田町ビル
港区,株式会社ティッセンクルップ　オットー
港区,株式会社トラスト
港区,株式会社フィリップス・ジャパン
港区,株式会社プリンスホテル　品川プリンスホテル
港区,株式会社プリンスホテルグランドプリンスホテル高輪ｸﾞﾗﾝﾄﾞﾌﾟﾘﾝｽﾎﾃﾙ新高輪ザ・プリンスさくらタワー東京　
港区,株式会社ホテルオークラ東京
港区,株式会社森トラスト・ホールディングス
港区,笄小地区防災協議会
港区,国際自動車株式会社
港区,ザ・ロイヤルパークホテルアイコック東京汐留
港区,サントリーホール
港区,社会福祉法人東京聖ビンセンシオ・ア・パウロ会愛星保育園
港区,住電電業株式会社
港区,ストリングスホテル東京インターコンチネンタル
港区,聖徳学園三田幼稚園
港区,世界貿易センタービルディング
港区,大東建託パートナーズ株式会社
港区,田中燃料㈱シアロ
港区,ティッセンクルップ・アクセス・ジャパン株式会社
港区,東京インターナショナルスクール
港区,東京警備保障株式会社東京支社
港区,東京港埠頭株式会社お台場海浜公園
港区,東京港埠頭株式会社　客船ターミナル管理事務所
港区,東京地下鉄株式会社白金高輪運転事務室
港区,東京地下鉄株式会社白金変電区
港区,東京都交通局電車部大門駅務管理所
港区,東京都立青山特別支援学校
港区,東京ミッドタウンマネジメント株式会社
港区,日鉄興和不動産株式会社
港区,日本オラクル株式会社　オラクル青山センター
港区,日本ロバロ株式会社
港区,野村不動産パートナーズ株式会社　施設管理部サービスセンター
港区,ﾊｰﾊﾞｰﾄ･ｽﾐｽ・ﾌﾘｰﾋﾙｽﾞ外国法事務弁護士事務所
港区,パナソニック株式会社ライフソリューションズ社
港区,パナソニックファシリティーズ㈱
港区,ヒルトン東京お台場
港区,不二建設株式会社
港区,船宿　縄定
港区,船宿　丸長
港区,ベクターリスクマネジメント株式会社
港区,丸新石油株式会社赤坂支店
港区,三菱地所株式会社開東閣
港区,港区スポーツセンター
港区,明治記念館
港区,メズム東京　オートグラフコレクション
港区,本村小地区防災協議会
港区,森トラスト・ビルマネジメント株式会社
港区,森トラスト株式会社
港区,森ビル株式会社
港区,屋形船　なわ安
港区,有限会社　石川釣船店
港区,有限会社　和泉屋商店
港区,有限会社　えびや
港区,有限会社　竹内釣船店
港区,有限会社　辰金
港区,ランチBOXあいちゃん
港区,株式会社西武・プリンスホテルズワールドワイド　ザ・プリンスパークタワー東京
港区,㈱共和ショップス麻布給油所
港区,東京都交通局電車部泉岳寺常務管理所
港区,有限会社　船宿はしや
目黒区,(株)鈴美商事セルフ駒沢通り給油所
目黒区,（株）佐藤商会CaReS中目黒ステーション
目黒区,出光リテール販売（株）東京カンパニー八雲給油所
目黒区,ウエスティンホテル東京
目黒区,学校法人目黒日本大学学園
目黒区,社会福祉法人　いたるセンター　目黒区目黒本町福祉工房
目黒区,東光サービス株式会社
目黒区,目黒区清掃事務所
目黒区,目黒区中小企業センター・目黒区勤労福祉会館
目黒区,目黒区役所
目黒区,祐天寺付属幼稚園
目黒区,若築建設株式会社
目黒区,二引（株）Ｄｒ．Drive中目黒ＳＳ
目黒区,明光石油（株）池尻店
昭島市,アーバンリゾーツ昭和の森(株)フォレスト・イン昭和館
昭島市,昭島市清掃センター
昭島市,昭島市役所
昭島市,介護老人保健施設アゼリア
昭島市,学校法人啓明学園
昭島市,京王自動車株式会社昭島営業所
昭島市,社会福祉法人愛信福祉会上ノ原保育園
昭島市,社会福祉法人昭島愛育会昭和保育園
