ゾーン,将来像
センター・コア再生ゾーン,・歴史や文化を感じさせる街並みの中で、世界の経済を支える活発なビジネス活動が展開され、都心居住が進みます。／・中核拠点を結ぶ道路沿道には、緑の軸やにぎわいのある空間がつくられ、業務、商業、住宅などの機能が複合した特色ある市街地が形成されます。
東京湾ウオーターフロント活性化ゾーン,・空港、港湾などの交通機能、水辺のうるおい、都心との近接性、豊かな土地資源などを生かし、文化やアミューズメントなども含む多様な機能が計画的に導入されます。／・ダイナミックな市街地景観や東京湾のゆとりある水辺空間など、既成市街地にはない魅力的な都市空間が創造されます。
都市環境再生ゾーン,・木造住宅密集地域は安全で良好な住宅地に再生されます。／・環状方向の道路は、緑の軸と一体的に整備され、沿道の活気ある街並みと緑豊かな空間の中を円滑に移動できます。／・残されたまとまりのある農地は、緑や防災などの多様な機能を持つ都市の貴重なオープンスペースとして保全されます。
核都市広域連携ゾーン,・核都市や鉄道駅周辺では、業務、商業など多様な機能と中高層住宅が複合した市街地が形成されます。／・質の高い住環境や魅力ある街並みを備えた低層住宅地では、緑豊かな環境の中で、職住近接などにより充実した余暇時間を楽しむライフスタイルが実現されます。
自然環境保全・活用ゾーン,・豊かな自然と特色ある観光資源に恵まれた西多摩の山間部を中心とした地域は、都県境を越えた連携により、秩父、甲斐なども含めた広域的な観光拠点となり、多くの観光客が訪れます。／・島しょ地域では、長期滞在型リゾートとして豊富な海洋資源を生かした観光振興が図られ、地域が活性化されます。
