主なご意見,主なご意見の概要,ご意見に対する考え方
民間のみどりづくりについて（１８件）／【公・民の連携】,公共と民間の連携には、東京が目指すみどりづくりの目標を共有し共通のものとすることが大切。また全体のみどりづくりの計画は公共で行なわなければならない。,東京のみどりづくりにおいていては、公共が、みどりの拠点と軸の形成を推進するとともに、民間事業者等によるみどりづくりを誘導し、みどりの公的空間の確保に努めていきます。
民間のみどりづくりについて（１８件）／【民間のみどりの効果】,都心の大規模開発で創出されたオープンスペースは十分な緑は得られていない。屋上緑化も補助的なものととらえるべき。また公開空地など民間が造ったみどりを、如何に良好に維持していくかの施策が必要。,都市の過半を占める民有地におけるみどりづくりは極めて重要と考えます。今後も、公共はもとより民間においても屋上緑化や敷地の緑化の推進など、みどりづくりを着実に進めていく必要があり、施策の充実に努めていきます。
民間のみどりづくりについて（１８件）／【公共支援】,民間の役割では、ボランティア・NPOの活動の余地は大きいので、行政の支援体制が必要。また緑の基本計画など緑の情報は誰でも入手できるようにするとともに、広報など様々な機会を捉えて周知する。,助成金等の支援などに加えて、ＮＰＯ・市民団体等に対する支援策についても検討していきます。また緑の基本計画など緑の情報は、誰でも入手できるよう努めていきます。
都民のみどりづくりについて（６件）,落ち葉の清掃やごみ拾いなど、公園や道路の管理を希望する都民のグループにやらせる。また、個人がボランティアで作れる庭を提供し、庭の作成や管理をする。,公園や街路樹の美化等への住民の参加をはじめとして、住民参加のみどりづくりのあり方について、引き続き検討していきます。
様々なみどりづくりについて（１３件）,みどりづくりや、みどりの管理についての提案・意見,ご提案の具体的な意見については、道路や河川、公園・緑地の整備・管理等に際し、又みどりの計画書の作成や緑化指導など、今後の様々なみどりづくりの施策充実のため、参考にしていきます。
