主なご意見,主なご意見の概要,ご意見に対する考え方
公園の整備について（２０件）／【都市計画公園・緑地の整備】,公園のあり方は、地域の環境を考えたものとする。特に河川に隣接した公園では、親水化を含めての計画が必要。また未供用の都市計画公園・緑地の事業化を図り、計画全体の整備を早く進める。など,お寄せいただいたご意見等を参考に、利用者が高い満足感を得られる一層質の高い公園づくりに取り組んでいきます。また未供用の都市計画公園・緑地の整備促進のため、「都市計画公園・緑地の整備方針」を策定し、重点的、効率的に公園整備を進めていきます。
公園の整備について（２０件）／【公園の配置】,公園は都民が必要とする社会的共通資本として地域格差をなくし、より公平な配置を実現する。また重点的に公園増やすため、都立公園の設置基準を変えてもよい。,都市計画公園緑地の適正配置については、今後の課題として検討していきます。
都市計画の見直しについて（５件）,同様の立地であるのに、一方は都市計画公園等の網がかかり、有効な土地利用が出来ないのは不平等である。,都市計画公園・緑地は、まだ多くの未整備区域を残しており、今後とも着実な整備促進を図り、その効果を発現させていく必要があります。
公園の管理について（８件）,公園の生態管理や管理マニュアルの作成など維持管理についての意見。,
公園の運営・利用促進について（３件）,ガーデニングショーなど民間主導型イベントへの助成制度の確立や「都立公園サポータ基金」等の充実などについての意見。,
公園の管理について（８件）／公園の運営・利用促進について（３件）,,公園の維持管理マニュアル作成などに努めていきます。また公園における民間主導型イベントや、都市緑化の推進、観光振興等に貢献する事業への支援策の充実について検討していきます。／民間によるみどりづくりに係る活動等への支援策の充実について検討していきます。
