機関名,郵便番号,所在地,緯度,経度,座標系,電話番号
東京都交通事故相談,163-8001,新宿区西新宿2-8-1都庁第一本庁舎北塔35階,,,,03-5320-7733
警視庁交通相談コーナー,100-8929,千代田区霞が関2-1-1,35.67360255,139.7553004,JGD２０１１,03-3593-0941
東京都外国人相談,163-8001,新宿区西新宿2-8-1都庁第一本庁舎3階北側,,,,03-5320-7744
東京ウィメンズプラザ相談室,150-0001,渋谷区神宮前5-53-67,35.65979203,139.7109329,JGD２０１１,03-5467-2455
東京都女性相談センター,―,―,―,―,―,03-5261-3110
東京都女性相談センター多摩支所,―,―,―,―,―,042-522-4232
東京都消費生活総合センター 消費生活相談,162-0823,新宿区神楽河岸1-1セントラルプラザ16階,35.69771939,139.7468106,JGD２０１１,03-3235-1155
東京都ＨＩＶ／エイズ電話相談,―,―,―,―,―,03-3292-9090
東京都南新宿検査・相談室,―,―,―,―,―,03-3377-0811
