都道府県コード又は市区町村コード,NO,都道府県名,市区町村名,名称,名称_カナ,名称_英語,POIコード,住所,方書,緯度,経度,利用可能曜日,開始時間,終了時間,利用可能日時特記事項,料金(基本),料金(詳細),説明,説明_英語,アクセス方法,駐車場情報,バリアフリー情報,連絡先名称,連絡先電話番号,連絡先内線番号,画像,画像_ライセンス,URL,備考,郵便番号,料金要否,駐車場_有無,利用条件_有無,利用条件_詳細,託児所_有無,託児所_詳細,画像_詳細,最終確認日
131041,1,東京都,新宿区,聖徳記念絵画館,セイトクキネンカイガカン,,802,東京都新宿区霞ヶ丘町1-1,,35.678727,139.717628,月火木金土日,10:00,16:30,"水曜日が祝日の場合は、直後の平日休館。※入館は16:00まで
年末年始（12月29日～1月3日）のみ開館時間10:00から16:00。※入館は15:30まで",500,,幕末から明治時代までの明治天皇の生涯を描いた絵画を展示しています。,,JR信濃町駅より徒歩5分、都営大江戸線国立競技場駅より徒歩5分、東京メトロ銀座線・半蔵門線・都営大江戸線青山一丁目駅より徒歩10分,駐車スペース396台(有料),,聖徳記念絵画館,03-3401-5179,,,,http://www.meijijingugaien.jp/art-culture/seitoku-gallery/,,160-0013,1,1,0,,0,,,2023/1/1
131041,2,東京都,新宿区,末広亭,スエヒロテイ,,1014,東京都新宿区新宿3-6-12,,35.691152,139.705892,月火水木金土日,12:00,20:30,自由席2部制（昼の部12:00～16：15、夜の部16：45 ～20:30）※入場終了19:15、年末（12月30日、12月31日）休業。,3000,一般3000円、シニア（65歳～）2700円、学生2500円、小学生2200円、友の会会員・会員同伴1名様のみ2500円、平日一般30名以上2700円,江戸以来の寄席の伝統を重んじ、その雰囲気を現代にとどめる落語色物定席です。,,JR新宿駅東口より徒歩7分、丸ノ内線新宿三丁目駅より徒歩2分,,,末広亭,03-3351-2974,,,,https://www.suehirotei.com,,160-0022,1,0,0,,0,,,2023/1/1
131041,3,東京都,新宿区,佐伯祐三アトリエ記念館,サエキユウゾウアトリエキネンカン,,803,東京都新宿区中落合2-4-21,,35.72084,139.69364,火水木金土日,10:00,16:30,"月曜日が祝休日にあたるときは、その翌平日休館。年末年始（12月29日～1月3日）休館。
※10月～4月は10：00～16：00営業。",0,,洋画家佐伯祐三が大正10年（1921）に構えたアトリエ付住宅の跡に建つ記念館で、祐三の生涯や作品、家族との暮らしをパネル展示や映像等で紹介しています。記念館は佐伯公園内にあります。,,西武新宿線下落合駅より徒歩10分、JR目白駅より徒歩20分、都営バス（白61、池65）聖母病院入口より徒歩5分、関東バス（宿02）聖母病院前より徒歩2分,,,佐伯祐三アトリエ記念館,03-5988-0091,,http://www.city.shinjuku.lg.jp/content/t_skyztr01.jpg,本データと同様,https://www/regasu-shinjuku.or.jp/saeki,,161-0032,0,0,0,,0,,,2023/1/1
131041,4,東京都,新宿区,中村彝アトリエ記念館,ナカムラツネアトリエキネンカン,,803,東京都新宿区下落合3-5-7,,35.72088,139.70118,火水木金土日,10:00,16:30,"月曜日が祝休日にあたるときは、その翌平日休館。年末年始（12月29日～1月3日）休館。
※入館は16：00まで",0,,洋画家中村彝が大正5年（1916）に構えたアトリエ兼住居の跡に建つ記念館で、彝の生涯や画業をパネル展示して紹介しています。復元されたアトリエは、新築時の建築部材の一部を再利用しています。,,JR目白駅より徒歩10分、都営バス（白61、池65）下落合三丁目より徒歩5分,,,中村彝アトリエ記念館,03-5906-5671,,http://www.city.shinjuku.lg.jp/content/t_nkmrts01.jpg,本データと同様,https://www/regasu-shinjuku.or.jp/tsune,,161-0033,0,0,0,,0,,,2023/1/1
131041,5,東京都,新宿区,林芙美子記念館,ハヤシフミコキネンカン,,803,東京都新宿区中井2-20-1,,35.71586,139.68425,火水木金土日,10:00,16:30,"月曜日が祝休日にあたるときは、その翌平日休館。年末年始（12月29日～1月3日）休館。
※入館は16：00まで",150,"一般150円、小中学生50円、団体（20名以上）の場合は、一般80円、小中学生30円
※小中学生および20名以上の中学生以下の者を引率する方は、土日祝日、都民の日、新宿区立小中学校の夏季・冬季・春季休業期に限り無料。
※障害者手帳等をお持ちの方は、受付にてご提示いただくと観覧料が無料。（介助者も1名まで無料）",作家林芙美子が昭和16年（1941）から亡くなる昭和26年（1951）まで暮らした家です。数寄屋造りの平屋建てで、設計は山口文象が手がけました。,,都営地下鉄大江戸線・西武新宿線中井駅より徒歩7分、地下鉄東西線落合駅より徒歩15分、西武バス中井駅より徒歩5分,,,林芙美子記念館,03-5996-9207,,http://www.city.shinjuku.lg.jp/content/t_hyshfm01.jpg,本データと同様,https://www/regasu-shinjuku.or.jp/fumiko,,161-0035,1,0,0,,0,,,2023/1/1
131041,6,東京都,新宿区,漱石山房記念館,ソウセキサンボウキネンカン,,803,東京都新宿区早稲田南町7,,35.70391,139.72548,火水木金土日,10:00,18:00,"月曜日が祝休日にあたるときは、その翌平日休館。年末年始（12月29日～1月3日）休館。展示替え期間休館。
※入館は17：30まで",300,"一般300円、小中学生100円、団体（20名以上）の場合は、一般150円、小中学生50円
※特別展については別途定める料金。
※小中学生は、土日祝日、都民の日、新宿区立小中学校の夏季・冬季・春季休業期に限り無料。
※障害者手帳等をお持ちの方は、受付にてご提示いただくと観覧料が無料。（介助者も1名まで無料）",作家夏目漱石が明治40年（1907）から亡くなる大正5年（1916）まで暮らした住居・漱石山房の跡に建つ記念館です。漱石山房の書斎やベランダ式回廊等を再現しています。ブックカフェや漱石関連図書をそろえた図書室を併設しています。,,東京メトロ東西線早稲田駅より徒歩10分、都営大江戸線牛込柳町駅より徒歩15分、都営バス（白61）牛込保健センター前より徒歩2分,身障者用駐車場1台,,漱石山房記念館,03-3205-0209,,http://www.city.shinjuku.lg.jp/content/t_ntsmss01.jpg,本データと同様,https://soseki-museum.jp,,162-0043,1,1,0,,0,,,2023/1/1
