"都道府県コード又は市区町村コード","No","都道府県名","市区町村名","名称","名称_カナ","名称_通称","POIコード","住所","方書","電話番号","内線番号","法人番号","団体名","利用可能曜日","開始時間","終了時間","利用可能日時特記事項","説明","バリアフリー情報","URL","備考","郵便番号","アクセス方法","駐車場_有無","駐車場情報","料金_要否","料金_基本","料金_詳細","利用条件_有無","利用条件_詳細","託児所_有無","託児所_詳細","画像","画像_ライセンス","画像_詳細","経度","緯度","分類"
"131148","1","東京都","中野区","もみじ山文化センター（本館）","モミジヤマブンカセンター（ホンカン）","なかのＺＥＲＯ","1016a","中野区中野2-9-7","","03-5340-5000","","","","月火水木金土日","９：００","２２：００","２月、６月、１１月の第４月曜日（休日にあたる場合はその翌日）、年末年始は休館日","","障害者用トイレあり","","","164-0001","JR中野駅南口から徒歩8分","1","施設利用主催者及び体の不自由な方専用","1","","","0","","0","","","","","139.671135596872","35.7046273589013","文化施設"
"131148","2","東京都","中野区","もみじ山文化センター（西館）","モミジヤマブンカセンター（ニシカン）","なかのＺＥＲＯ","1016a","中野区中野2-9-7","","03-5340-5000","","","","月火水木金土日","９：００","２２：００","２月、６月、１１月の第４月曜日（休日にあたる場合はその翌日）、年末年始は休館日","","障害者用トイレあり","","","164-0001","JR中野駅南口から徒歩8分","1","施設利用主催者及び体の不自由な方専用","1","","","0","","0","","","","","139.671135596872","35.7046273589013","文化施設"
"131148","3","東京都","中野区","野方区民ホール","ノガタクミンホール","","1016a","中野区野方5-3-1","","03-3310-3861","","","","月火水木金土日","９：００","２２：００","毎月第２月曜日（休日にあたる場合はその翌日）、年末年始は休館日","","障害者用トイレあり","","","165-0027","西武新宿線野方駅南口から徒歩3分","0","主催者専用","1","","","0","","0","","","","","139.653372525234","35.7183322407295","文化施設"
"131148","4","東京都","中野区","なかの芸能小劇場","ナカノゲイノウショウゲキジョウ","","1012a","中野区中野5-68-7","","03-5380-0931","","","","月火水木金土日","９：００","２２：００","毎月第３月曜日（休日にあたる場合はその翌日）、年末年始は休館日","","障害者用トイレあり","","","164-0001","JR中野駅北口から徒歩5分","0","主催者専用","1","","","0","","0","","","","","139.665265201647","35.7091819538123","文化施設"
"131148","13","東京都","中野区","歴史民俗資料館","レキシミンゾクシリョウカン","れきみん","803a","中野区江古田4-3-4","","03-3319-9221","","","","火水木金土日","","","第３日曜日は休館。リニューアル工事のため、２０２０年３月３１日まで休館。","","","","","165-0022","西武新宿線「沼袋駅」北口より徒歩8分、JR「中野駅」北口より練馬駅行（京王バス中92系統）江古田二丁目下車徒歩2分、都営地下鉄大江戸線「新江古田駅」より徒歩15分","1","3台分","0","","","0","","0","","","","","139.665036753402","35.7243232298674","文化施設"
