"都道府県コード又は市区町村コード","No","都道府県名","市区町村名","名称","名称_カナ","名称_通称","POIコード","住所","方書","電話番号","内線番号","法人番号","団体名","利用可能曜日","開始時間","終了時間","利用可能日時特記事項","説明","バリアフリー情報","URL","備考","郵便番号","アクセス方法","駐車場_有無","駐車場情報","料金_要否","料金_基本","料金_詳細","利用条件_有無","利用条件_詳細","託児所_有無","託児所_詳細","画像","画像_ライセンス","画像_詳細","経度","緯度","分類"
"131148","112","東京都","中野区","南部高齢者会館","ナンブコウレイシャカイカン","南部高齢者会館","1499a","中野区南台5-27-24","","03-3381-4261","","","","月火水木金","9:00","17:00","土・日・祝日・年末年始（12/29から1/3）は利用不可。","","","","","164-0014","東京メトロ丸ノ内線方南町駅徒歩6分・京王バス（ＪＲ中野駅南口発 中83系統）「南部高齢者会館」徒歩0分","0","","0","","","1","","0","","","","","139.660898453958","35.6833024599498","区民活動センター・高齢者会館等_南部"
"131148","113","東京都","中野区","しんやまの家","シンヤマノイエ","しんやまの家","1499a","中野区南台4-25-1","","03-3229-8175","","","","月火水木金","9:00","17:00","土・日・祝日・年末年始（12/29から1/3）は利用不可。","","車椅子用トイレ有り","","","164-0014","京王線笹塚駅徒歩15分・京王バス（ＪＲ中野駅南口発 宿45/渋63系統、ＪＲ新宿駅西口発 宿41/宿45系統）「新山通り」徒歩5分","0","","0","","","1","","0","","","","","139.667490446402","35.6807852251249","区民活動センター・高齢者会館等_南部"
"131148","114","東京都","中野区","本一高齢者会館","ホンイチコウレイシャカイカン","本一高齢者会館","1499a","中野区本町1-7-6","","03-3373-2958","","","","月火水木金","9:00","17:00","土・日・祝日・年末年始（12/29から1/3）は利用不可。","","多目的トイレ有り","","","164-0012","東京メトロ丸ノ内線中野坂上駅徒歩8分・京王バス（ＪＲ中野駅南口発 渋64系統）「成願寺前」徒歩1分","0","","0","","","1","","0","","","","","139.682692565423","35.6937637675912","区民活動センター・高齢者会館等_南部"
"131148","142","東京都","中野区","南部すこやか福祉センター","ナンブスコヤカフクシセンター","南部すこやか福祉センター","1399a","中野区弥生町5-11-26","","03-3382-1750","","","","月火水木金土","8:30","17:00","日・祝日・年末年始（12/29から1/3）は利用不可。","","誰でもトイレ有り、車椅子貸出有り","","","164-0013","東京メトロ丸ノ内線「中野富士見町」駅徒歩7分、バス 京王バス（渋63、宿45）「富士高校」下車 徒歩1分 来館の際は、公共の交通機関をご利用ください。駐車台数に限りがあります。","1","","1","","","1","","0","","","","","139.66850453217","35.6881107502144","区民活動センター・高齢者会館等_南部"
"131148","151","東京都","中野区","南中野区民活動センター","ミナミナカノクミンカツドウセンター","南中野区民活動センター","1305a","中野区弥生町5-5-2","","03-3382-1456","","","","月火水木金土日","9:00","22:00","館内一斉清掃日（年4回）・年末年始（12/29から1/3まで）は全日使用不可","","","","","164-0013","東京メトロ丸ノ内線「中野富士見町」駅下車徒歩10分・ＪＲ中野駅南口から京王バス渋63渋谷駅行・宿45新宿駅西口行「南台交差点」下車・ＪＲ新宿駅西口から京王バス宿33永福町行・宿32佼成会聖堂前行「南台図書館」下車　車での来館は、ご遠慮ください。障害のある方は、事前にお問い合わせください。","0","","1","","","1","","0","","","","","139.666354101205","35.6861567510087","区民活動センター・高齢者会館等_南部"
"131148","152","東京都","中野区","弥生区民活動センター","ヤヨイクミンカツドウセンター","弥生区民活動センター","1305a","中野区弥生町1-58-14","","03-3372-4000","","","","月火水木金土日","9:00","22:00","館内一斉清掃日（年4回）・年末年始（12/29から1/3まで）は全日使用不可","","","","","164-0013","東京メトロ丸ノ内線「中野新橋駅」下車徒歩6分・ＪＲ中野駅南口から京王バス渋64 中野坂上経由 渋谷駅行「弥生町一丁目」下車徒歩8分　車での来館はご遠慮ください。障害のある方は、事前にお問い合わせください。","0","","1","","","1","","0","","","","","139.678453378405","35.6923674003137","区民活動センター・高齢者会館等_南部"
"131148","153","東京都","中野区","鍋横区民活動センター","ナベヨコクミンカツドウセンター","鍋横区民活動センター","1305a","中野区本町5-47-13","","03-3383-2731","","","","月火水木金土日","9:00","22:00","館内一斉清掃日（年4回）・年末年始（12/29から1/3まで）は全日使用不可","","誰でもトイレ有り、車椅子貸出有り","","","164-0012","東京メトロ丸ノ内線「新中野」駅下車徒歩10分・ＪＲ中野駅南口から京王バス宿45新宿西口行、渋63渋谷駅行「十貫坂上」下車徒歩3分　車での来館はご遠慮ください。障害のある方は、事前にお問い合わせください。","0","","1","","","1","","0","","","","","139.668036299239","35.6936428672459","区民活動センター・高齢者会館等_南部"
"131148","154","東京都","中野区","鍋横区民活動センター分室","ナベヨコクミンカツドウセンターブンシツ","鍋横区民活動センター分室","1305a","中野区本町4-44-3","","03-3384-5678","","","","月火水木金","9:00","17:00","館内一斉清掃日（年2回）・年末年始（12/29から1/3まで）は全日使用不可","","","","","164-0012","東京メトロ丸ノ内線「新中野」下車徒歩4分　駐車場は、ありません。","0","","0","","","1","","0","","","","","139.669565770594","35.6965123987574","区民活動センター・高齢者会館等_南部"
"131148","155","東京都","中野区","やよいの園","ヤヨイノソノ","やよいの園","","中野区弥生町3-33-8","","03-3370-9841","","","","月火水木金土","9:00","17:00","日・祝日・年末年始（12/29から1/3まで)は利用不可","","","","","164-0013 ","東京メトロ丸ノ内線「中野新橋」下車徒歩７分・JR中野駅南口から京王バス（渋63、宿45系統）「富士高校」下車　徒歩１５分","","","","","","2","区内在住の60歳以上の方","0","","","","","139.674376638726","35.6887961717645","区民活動センター・高齢者会館等_南部"
