発生年月日,患者数,病因物質,責任の所在,原因食品,発生要因等,担当保健所
H23.11.7,126,ウェルシュ菌,飲食店（弁当）,弁当,「牛肉里芋煮」「切干大根煮」「小松菜シチュー」を前日調理後、高い室温で放冷する等の取扱不良により、ウェルシュ菌が増殖したものと考えられた。,江戸川区
H24.1.27,263,ノロウイルス,飲食店（仕出し）,弁当,事前発症していた調理従事者からノロウイルスが検出されたことから、感染した調理従事者の手指から食品が汚染されたと考えられた。,墨田区
H25.3.2,112,ノロウイルス,飲食店（すし）,飲食店の食事,ノロウイルスに感染した調理従事者の手洗い不足等により食品を二次汚染した可能性が示唆された。,町田市
H25.6.30,201,ウェルシュ菌,飲食店（一般）,弁当,製造能力を超えた作業により、製造から喫食まで、最大約10時間、常温に放置したことで、ウェルシュ菌に増菌の機会を与えたものと考えられた。,中央区
H25.9.18,109,化学物質（ヒスタミン）,集団給食（届出）,イワシのつみれ汁,イワシのつみれの原材料であるイワシすり身が、製造段階から卸市場に到着するまでの間に、ヒスタミンが生成するような温度管理状況にあったものと推測された。,多摩小平
H27.1.28,321,ノロウイルス,飲食店（仕出し）,仕出し弁当,検便よりノロウイルスが検出された2名の調理従事者が手洗い不足により仕出弁当を汚染させたことによる。,葛飾区
H27.1.30,105,ノロウイルス,飲食店（一般）,飲食店の食事,ノロウイルスに感染した調理従事者が食品を汚染したため。,台東区
H27.10.23,103,ノロウイルス,飲食店（一般）,飲食店の食事,体調不良の調理従事者が調理を行ったことによる食品汚染の可能性が高いと考えられる。,品川区
