区市町村通番,所管地域,名称,ヨミガナ,電話番号,ＦＡＸ番号,郵便番号,住所,緯度,経度,座標系,対応時間帯,特記事項,施設種別／地域包括支援センター,施設種別／ブランチ・サブセンター,施設種別／在宅介護支援センター,施設種別／その他相談窓口,相談内容／高齢者の異変,相談内容／消費者被害のおそれ
1,牛浜第一町会、牛浜第二町会、原ヶ谷戸町会、志茂第一町会、志茂第二町会、永田町会、長沢町会、加美町会、本町第一町会、本町町会、本町中央町会、本町第六町会、本町第七町会、本町第八第一町内会、加美平団地自治会、本町第八第二町内会、武蔵野第一丁目町会,福生市地域包括支援センター福生,ﾌｯｻｼﾁｲｷﾎｳｶﾂｼｴﾝｾﾝﾀｰﾌｯｻ,042-551-1537 〔夜間・休日〕／042-551-1511,042-551-2133,197-8501,福生市本町5番地,35.738701,139.326782,JGD2011,月曜日～土曜日8時30分～17時15分（水曜日のみ20時まで）※,,〇,,,,〇,
2,南町会、内出町会、武蔵野町会、富士見台町会、鍋ヶ谷戸第一町会、鍋ヶ谷戸第二町会、熊川牛浜町会、福生団地自治会、福生熊川住宅自治会、福栄町会、玉川台町会、福東町会、南田園一丁目町会、南田園二丁目町会、南田園三丁目町会,福生市地域包括支援センター熊川,ﾌｯｻｼﾁｲｷﾎｳｶﾂｼｴﾝｾﾝﾀｰｸﾏｶﾞﾜ,042-510-2945,042-510-7397,197-0004,福生市南田園2-13-1,35.727993,139.332336,JGD2011,月曜日～土曜日8時30分～17時15分※,,〇,,,,〇,
3,富士見台町会、福栄町会、牛浜第二町会、原ヶ谷戸町会、本町第七町会、本町第八第一町内会、本町第八第二町内会、武蔵野台一丁目町会,在宅介護支援センター武蔵野,ｻﾞｲﾀｸｶｲｺﾞｼｴﾝｾﾝﾀｰﾑｻｼﾉ,042-553-6695,042-553-6686,197-0011,福生市福生2300-4,35.740284,139.337677,JGD2011,月曜日～土曜日9時～19時,,,,〇,,〇,
4,牛浜第一町会、志茂第一町会、志茂第二町会、本町第一町会、本町町会、本町中央町会、本町第六町会、永田町会、長沢町会、加美町会、加美平団地自治会,在宅介護支援センター加美,ｻﾞｲﾀｸｶｲｺﾞｼｴﾝｾﾝﾀｰｶﾐ,042-553-3720,042-553-3729,197-0011,福生市福生3244-10,35.74612,139.317993,JGD2011,月曜日～土曜日9時～19時,,,,〇,,〇,
5,福生熊川住宅自治会、南町会、内出町会、武蔵野町会、福東町会、南田園一町名町会、鍋ヶ谷戸第一町会、鍋ヶ谷戸第二町会、玉川台町会、熊川牛浜町会、福生団地自治会、南田園二丁目町会、南田園三丁目町会,在宅介護支援センター南田園,ｻﾞｲﾀｸｶｲｺﾞｼｴﾝｾﾝﾀｰﾐﾅﾐﾃﾞﾝｴﾝ,042-539-0007,042-539-0012,197-0004,福生市南田園2-9-1-103,35.720776,139.330933,JGD2011,月曜日～土曜日9時～19時,,,,〇,,〇,
6,市内全域,福生市消費者相談室,ﾌｯｻｼｼｮｳﾋｼｬｿｳﾀﾞﾝｼﾂ,042-551-1699,042-553-7500,197-8501,福生市本町18,35.739086,139.327423,JGD2011,月曜日、水曜日、金曜日10時～12時／13時～16時※,月曜日、水曜日、金曜日以外の緊急相談窓口 東京都消費生活総合センター／（03-3235-1155〕／9時～17時／月曜日～土曜日／（祝日・年末年始を除く。）,,,,〇,,〇
