設置,施設名,郵便番号,所在地,経度,緯度,座標系,電話番号,定員
社福法人,日本視覚障害者団体連合点字図書舘,169-0051,新宿区西早稲田２－１８－２,139.711164,35.710077,JGD2011,03-3200-6160,-
社福法人,東京ヘレン・ケラー協会点字図書館,169-0072,新宿区大久保３－１４－２０,139.708381,35.707863,JGD2011,03-3200-0987,-
社福法人,日本点字図書館,169-0075,新宿区高田馬場１－２３－４,139.704682,35.710894,JGD2011,03-3209-0241,-
社福法人,ロゴス点字図書館,135-0052,江東区潮見２－１０－１０　日本カトリック会館１階,139.816721,35.656691,JGD2011,03-5632-4428,-
区市町村,大田区立障がい者総合サポートセンター声の図書室,143-0024,大田区中央４－３０－１１,139.718238,35.579492,JGD2011,03-5728-9133,-
区市町村,豊島区立中央図書館（ひかり文庫）,170-0013,豊島区東池袋４－５－２　ライズアリーナビル５階,139.718902,35.726948,JGD2011,03-3983-7864,-
