No,実施日,時間,会場,テーマ,講師,受講者数（名）
1,平成26年2月24日,19：00 ～ 20：30,東大和療育センター,「重症児者の診療とは＜基礎編＞」,東大和療育センター医長　江添　隆範氏,15
2,平成26年3月24日,19：30 ～ 20：45,東大和療育センター,「重症児者の身体的特徴と合併症―呼吸器障害、消化器症状―」,東大和療育センター医長　江添　隆範氏,15
3,平成26年7月8日,19：30 ～ 21：00,東大和療育センター,「在宅医からみた重症心身障害児（者）の地域連携とその課題―青年期の1 事例を通して―」,さいわいこどもクリニック院長　宮田　章子氏,21
4,平成26年10月28日,19：30 ～ 20：30,東大和療育センター,「当院における在宅医療の現状と課題」,奥山内科クリニック院長　奥山　尚氏,16
5,平成27年2月18日,19：30 ～ 20：45,東大和療育センター,「目でみるてんかん発作―重症心身障害児（者）を中心に―」,東大和療育センター医長　平山　恒憲氏,14
6,平成27年7月14日,19：30 ～ 20：45,立川市医師会館,「障害のある方の摂食指導と医療ケアについて」／「重症心身障害児（者）の摂食嚥下障害と経腸栄養」／「経腸栄養剤の種類」,日本歯科大学口腔リハビリテーション多摩クリニック科長　田村　文誉氏／東大和療育センター医長　西條　晴美氏／東大和療育センター看護長　川原　ゆかり氏,35
7,平成27年10月27日,19：30 ～ 20：45,東大和療育センター,「重症心身障害児（者）のための福祉制度と福祉サービスについて」／「都立東大和療育センターでの福祉サービス」,東大和市福祉部障害福祉課課長　小川則之氏／東大和療育センター在宅支援室係長　勝間 裕美氏,18
8,平成28年3月10日,19：30 ～ 20：45,東大和療育センター,「重症心身障害児（者）の豊かな生涯と終末医療について」,東大和療育センター院長　倉田　清子氏／東大和療育センター医長　西條　晴美氏,41
