施設名,所在地,緯度,経度,座標系,指定管理者名,指定期間,総合評価,評価内容
東京体育館,東京都渋谷区千駄ヶ谷1-17-1,35.68005,139.713501,JGD2011,(公財)東京都スポーツ文化事業団グループ,平成23年4月～平成28年3月,Ａ,・世界・全国レベルの大会を多数開催するなど、大規模施設としての役割を十分に果たしている。また、各種事業についても曜日や時間及び内容について、利用者ニーズを踏まえた見直しを行い、より多くの参加者を獲得している。／・トレーニングルームなどの個人利用者数が、増加しているなかで、顧客満足度の高いサービスを維持できるようにしていただきたい。また、東京２０２０大会に向けて、東京都とともに案内表示板等の多言語化も進めていただきたい。
駒沢オリンピック公園総合運動場,東京都世田谷区駒沢公園1-1,35.626083,139.657501,JGD2011,(公財)東京都スポーツ文化事業団,平成26年4月～平成31年3月,Ａ,・利用者ニーズを踏まえ、曜日によりトレーニングルームの時間延長を実施した結果、弓道場が休館であるにもかかわらず、個人利用者数は、昨年度を大きく上回った。施設数が多く、利用団体の数や種類も豊富な中で、長年のノウハウを生かして円滑な利用調整を実施している。／・今後も施設毎の特性に応じたきめ細かな管理運営に努めていただきたい。
東京武道館,東京都足立区綾瀬3-20-1,35.765015,139.825058,JGD2011,(公財)東京都スポーツ文化事業団グループ,平成23年4月～平成28年3月,Ａ,・耳マーク設置やiPadを活用した多言語対応など、きめ細かな接遇が利用者の満足度につながっている。また、オリンピックや世界選手権の優勝経験者等と触れ合う機会を提供する「有名選手・指導者ふれあい事業」等を行い、青少年の武道への関心を高めるなど、施設の役割を踏まえた事業展開を行っている。／・子供や若年層の方々が武道に親しんでもらえるような取組に対して、引き続き工夫や充実を講じていただきたい。
東京辰巳国際水泳場,東京都江東区辰巳2-8-10,35.647079,139.818619,JGD2011,オーエンス・セントラル・都水協グループ,平成23年4月～平成28年3月,Ａ,・接遇や人材育成等のソフト面の取組、及び、設備の修繕等ハード面の取組がバランスよく実施されている。施設運営側が柔軟に大会主催者のニーズに応える結果、大会誘致に成功し、大会開催日数が24日増加し、収入増につながっている。また、収益を老朽化した設備の更新等、利用者に還元を行っている点が評価できる。／・メダリストのパネル設置など、東京２０２０大会に向けた情報発信に努めている。今後も障害者スポーツの普及啓発DVDを活用するなど、引き続き気運醸成に取り組んでいただきたい。
有明テニスの森公園テニス施設,東京都江東区有明2-2-22,35.636097,139.787003,JGD2011,有明テニス・マネージメントチーム,平成23年4月～平成28年3月,Ａ,・国際大会をはじめ、多数の大規模大会やスポーツイベント等を開催し、高い稼働率を維持した。また、収益の一部を災害備蓄品の購入や施設の修繕に充てるなど、積極的な利用者還元に努めている。／・東京２０２０大会に向けて今後実施を予定している大規模改修工事など、引き続き東京都との連携協力に努めていただきたい。
若洲海浜公園ヨット訓練所,東京都江東区若洲3-1-1,35.614788,139.834015,JGD2011,若洲シーサイドパークグループ,平成25年4月～平成32年3月,Ａ,・競技会やヨット教室の募集にあたって、ホームページや広報東京都、雑誌等に掲載し、広くＰＲ活動を行った結果、参加者数の増加につながっている。また、競技力向上についても力を入れており、国際大会の出場権を得る選手なども出てきている。／・ヨットやセーリングスポーツの裾野拡大に向け、初心者や障害者の体験教室実施などに積極的に取り組んでいただきたい。
東京都障害者総合スポーツセンター,東京都北区十条台1-2-2,35.753452,139.728302,JGD2011,(公社)東京都障害者スポーツ協会,平成23年4月～平成28年3月,Ａ,・「車いすテニスジュニア選手強化練習」教室など、競技力向上の観点からの事業も積極的に行っている。／・地域における障害者スポーツの普及啓発をさらに推進していくためには、指導者を増やすことが必要であることから、人材育成の取組に工夫をしていただきたい。また、改修後の円滑な施設運営のための準備を着実に進めていただきたい。
東京都多摩障害者スポーツセンター,東京都国立市富士見台2-1-1,35.6866,139.44635,JGD2011,(公社)東京都障害者スポーツ協会,平成23年4月～平成28年3月,Ａ,・各事業について、アンケート結果を分析し、事業の見直しや新規に事業を開始するなど、利用者ニーズに合わせた事業展開を行っている。／・センターで現在実施している、スポーツやレクリエーションを地域に普及啓発していく取組をさらに充実させていただきたい。
