施工場所,施設名,事業実施主体,事業内容,確定額（支払額）／事業費（円）,確定額（支払額）／都補助金額（円）,確定額（支払額）／地元負担（円）
大島町,つきいそ,大島町,コンクリート礁4700基,25439650,19079000,6360650
大島町,つきいそ,大島町,自然石2880m3,25499999,19124000,6375999
大島町,展示販売施設附帯設備,大島町,冷凍庫・急速冷凍庫屋外機及び展示室空調設備更新,3327750,2495000,832750
大島町,船揚ウィンチ,伊豆大島漁協,電動ウィンチ2.2ｋW1基,2312280,1605000,707280
大島町,冷凍庫,伊豆大島漁協,プレハブ冷凍庫用冷却機械設備1.5坪更新,972000,675000,297000
神津島村,つきいそ,神津島村,コンクリート礁39基,29592000,22194000,7398000
神津島村,船揚施設,神津島漁協,油圧式上架ウィンチ1基、上架用台車、建物23.98m2,50436000,35025000,15411000
神津島村,燃油等供給施設設計,神津島漁協,地上型100kl燃油タンク(設計),7560000,5250000,2310000
神津島村,漁具資材倉庫,神津島漁協,コンテナハウス93.03m2,18900000,13125000,5775000
