事業名１,事業名２,事業名３,局名,事業の概要,２０１６（２８）主な取組,２０１６（２８）事業費（百万円）,２０１７（２９）主な取組,２０１７（２９）事業費（百万円）
９公助による救出救助活動の展開,,,,,,35037,,44881
救出救助活動に必要となる道路の閉塞を防ぎます,,,,,,6168,,10006
緊急輸送道路沿道の建築物の耐震化を進めます,,,,,,4623,,8344
1,９－１,緊急輸送道路沿道建築物耐震化促進事業,都市整備局,「東京における緊急輸送道路沿道建築物の耐震化を推進する条例」に基づき、特定緊急輸送道路沿道建築物の耐震診断等を義務付けるともに、助成制度を拡充し、耐震化を促進する。,・特定沿道建築物耐震診断、補強設計、改修等への財政支援／・耐震化状況報告書、耐震診断実施結果報告書を基に、耐震診断及び耐震改修等の状況を集計・管理／・耐震化支援として、電話窓口開設や建築士の現地派遣の継続／など,4550,・特定沿道建築物耐震診断、補強設計、改修等への財政支援／・耐震化状況報告書、耐震診断実施結果報告書を基に、耐震診断及び耐震改修等の状況を集計・管理／・耐震化支援として、電話窓口開設や建築士の現地派遣の継続／など,8266
2,９－２,建築物の耐震化資金融資制度,都市整備局,提携の実施金融機関が民間建物所有者に対して低利の融資を行えるよう預託し、実施金融機関は、耐震診断・改修を行う建物所有者に対し、資金を低利で融資を行う。,提携の実施金融機関が民間建物所有者に対して低利の融資を行えるよう預託し、実施金融機関は、耐震診断・改修を行う建物所有者に対し、資金を低利で融資を行う。,73,提携の実施金融機関が民間建物所有者に対して低利の融資を行えるよう預託し、実施金融機関は、耐震診断・改修を行う建物所有者に対し、資金を低利で融資を行う。,78
3,（１－２４）,耐震工法・事例の情報提供,都市整備局,（再掲）,（再掲）,（再掲）,（再掲）,（再掲）
4,（１－２５）,建築物の耐震化総合相談窓口,都市整備局,（再掲）,（再掲）,（再掲）,（再掲）,（再掲）
5,（１－１４）,区市町村耐震化促進普及啓発活動支援事業,都市整備局,（再掲）,（再掲）,（再掲）,（再掲）,（再掲）
6,（１－２６）,耐震診断等技術者講習会の実施,都市整備局,（再掲）,（再掲）,（再掲）,（再掲）,（再掲）
