昭島市内の野菜メニュー店,定休日,営業時間,所在地,緯度,経度,座標,電話,メニュー,価格(円),税込／税抜,野菜の量(g),アピールポイント
そばの里   いろは,日曜日／第３木曜,11:30～20:00,昭島市東町 4-17-5,35.699478,139.388321,JGD2011,042-541-0518,野菜の天ざる,1000,税込,135,当店のそばは大きな石臼で自家製粉したそば粉を使用しています。いろいろな種類の野菜の天ぷらを揚げています。【地場野菜使用】
日高屋昭島南口店,不定休,10:00～深夜 4:00,昭島市昭和町 2-1-9,35.712898,139.362152,JGD2011,042-542-5123,野菜たっぷりタンメン,520,税込,350,成人が一日に必要な 350ｇの野菜を使用し、甘みの強い食塩を使用し、ホタテ貝柱、豚肉、鶏肉の旨みを独自にブレンドし、キャベツ、白菜、玉ねぎ、にんじん、きくらげ、にら、もやし、豚肉などの具材を使用しております。
石臼挽二八そば あづま家,水曜日,11:00-15:00/17:00-21:00,昭島市松原町 5-18-5,35.719742,139.340149,JGD2011,042-541-1073,五目あんかけうどん,1078,税込,130,【地場野菜使用】
角ふじラーメン 心麺,月曜日,11:00-22:00,昭島市玉川町３-1８-12,35.705395,139.381699,JGD2011,042-542-0687,角ふじ,720,税込,410,もやしたっぷり。400ｇの野菜がと れます。
大戸屋ごはん処 ｲﾄｰﾖｰｶﾄﾞｰ拝島店,不定休,11:00～21:00,昭島市松原町 3-2-12 イトーヨーカドー拝島店２Ｆ,35.714825,139.347794,JGD2011,042-500-5860,鶏と野菜の黒酢あん定食,810,税抜,,彩り豊かな野菜と鶏の竜田揚げを、特製 の黒酢あんでからめた、人気 No.1 メニ ュー！
砂場（そば・うどん）,木曜日,11:00～20:00,昭島市松原町 1-27-4,35.711243,139.357452,JGD2011,042-543-7100,野菜炒めうどん,950,税抜,175,何品かのメニューを用意しております。
うな瀧,月曜日／火曜日,11:30～14:00,昭島市玉川町 1-19-10,35.70602,139.380768,JGD2011,042-543-7345,タンメン,650,税抜,310,野菜たっぷりタンメンです。
中華料理喜楽,火曜日,11:30～14:00／17:00～21:00,昭島市玉川町 5-15-30,35.702164,139.37439,JGD2011,042-543-7570,タンメン,700,税抜,220,他にも野菜の多いメニューがありま す。 【地場野菜使用】
有限会社レストラン・トスカーニ,火曜日,11:00～21:00,昭島市玉川町 1-8-102,35.705715,139.383545,JGD2011,042-543-4657,イタリアンサラダ,840,税込,280,ガーリックのきいた自家製ドレッシングでめしあがれ。
