永福寺の銅造地蔵菩薩半跏像,"",指定有形文化財,彫刻,東京都新宿区新宿7-11-2  ,永福寺,"",2018-10-24,"","",35.698078,139.712458,"嘉永6年（1853）4月に造られた銅造の地蔵菩薩半跏像で、作者は藤原國信である。若々しく精悍な表情や体軀、衣の写実性、手指の繊細な表現からは、手慣れた造形感覚がみとめられる。台座には、4名の僧、22家の物故者、363名の結縁者の名が刻まれる。総高は179.8cmである。　　　　　　　　　　　　　　　　　　　　　　　　　　　　　　　　　　　
台座に刻まれた結縁者名には、刑死者の解剖を行ったことで知られる医師・高須松齋や幕府天文方の船山左司馬のほか、医師、町名主、菓子屋などの名がみえる。地蔵信仰の隆盛を受けて造像された本像の、江戸周縁部に住む人々の信仰の一面をあらわす資料といえる。作者の藤原國信は、天明元年（1781）から明治4年（1871）までの90年間に62例の鋳造を行っているが、その多くは梵鐘である。活動期間から、國信は数代にわたって踏襲された名とみられるが、仏像の作例はわずか4例（現存2例）で、大変貴重である。
近世新宿区域の寺院における檀徒の広がりを考察できる資料として、また藤原國信の制作活動をうかがい知れる数少ない仏像の現存作例として重要である。

","","","",""
済松寺の加藤文麗筆絵画作品,"",指定有形文化財,絵画,東京都新宿区榎町77,済松寺,"",2018-10-24,"","",35.706094,139.727816,"済松寺に伝来する、江戸中期の画家・加藤文麗の作品5件である。加藤文麗（1706〜1782）は、伊予の大洲藩主加藤泰恒の六男で、狩野周信（1660〜1728）に学んだ。画風は、当時の狩野派の典型的なもので、有名な谷文晁（1763〜1840）はその弟子である。済松寺の第九世住職・大鼎禅圭と文麗は日頃より交流があり、その縁で制作されたと推定される。江戸中期以降、寺院等を中心とした文化人の交流が数多く見られた。済松寺では第九世住職・大鼎禅圭の代にこのようなサークルができ、文麗もそのメンバーであった。文晃は文麗の弟子として済松寺と関わりを持ち、以降その中心的存在となった。
徳川家光ゆかりの寺院である済松寺は、宝暦13年（1763）の類焼にあたり、翌年にはいち早く仏殿が、明和7年（1770）には家康・秀忠・秀忠室崇源院を祀る三仏堂が再興されている。伽藍の再興と同時に重要な祖師像等の制作が、文化人サークルの繋がりから文麗に依頼されたこと、また法系を重視する禅宗寺院において大切なこれらの作品が揃いで伝来することは、制作の事情から見て、この時代の一つの基準になると思われる。区域の寺院資料として重要であるとともに、江戸中後期における新宿区域の文化状況を伺い知れる重要な資料である。","","","",""
谷文晁の絵,"",登録有形文化財,絵画,東京都新宿区上落合一丁目26-19,月見岡八幡神社,"",1985-08-02,"","",35.71285,139.69092,月見岡八幡神社の旧社殿の格天井に描かれていた板絵30数枚のうちの1枚で、第二次世界大戦の戦災を免れて残ったものである。絵柄は、春の野の早蕨を描いたもので、作者は谷文晁（1763〜1840）と伝えられる。当時、神社の近くにあった熊酒屋という酒屋が、文晁の師加藤文麗（1706〜1782）と親しかったため、文晁も天井絵の製作に参加したと伝えられる。,"","","",""
月見岡八幡神社の鰐口,"",登録有形文化財,工芸品,東京都新宿区上落合一丁目26-19,月見岡八幡神社,"",1985-08-02,"","",35.71285,139.69092,"上落合村の氏子により奉納されたもので、明治以後一時失われていたが、昭和初期に北海道で地方巡業していた芝居一座が使用しているのが発見され、再奉納されたという。
江戸時代の典型的な鰐口で、両面とも中央に蓮華の形のつき座があり、その周囲を3本の紐帯で区画し、一番外の区画に「奉納八幡宮 天明五乙巳年六月吉日 武州豊嶋郡上落合村氏子中」という銘文が刻まれている。","","","",""
市谷亀岡八幡宮の軍配団扇,"",登録有形文化財,工芸品,東京都新宿区市谷八幡町15,市谷亀岡八幡宮,"",1987-01-30,"","",35.69249,139.73428,"市谷亀岡八幡宮に伝来する軍配団扇で、同八幡宮を創建した武将太田道灌（1432〜86）が奉納したと伝えられている。
柄は木製、団扇の部分は和紙を芯に、幅1㎝位の短冊状の竹板を並べ、黒漆を塗って仕上げられているが、現状は全体に亀裂が散見され、漆はかなり剥離し、竹板や和紙が露出している。文字や文様はみられない。
『御府内備考続編』によると、「団扇一本右者太田道灌所持之品図之通」とあり、図と寸法などが記してある。製作・奉納年代など、正確には不明な点が多いが、「山吹の里」など新宿区周辺に多くの伝説を残した道灌をしのぶことができる貴重な文化財である。","","","",""
林光寺の高僧先達連座画像,"",登録有形文化財,絵画,東京都新宿区南元町15-3,林光寺,"",1991-12-06,"","",35.67962,139.7231,"わが国仏教の先達として、浄土真宗で信仰のあつい聖徳太子とその侍臣及び、真宗系の高僧の肖像を配置した連座画像である。
絵柄は、中央に上から法然上人（源空）と恵心僧都源信を配し、左右に西仏・信性・親鸞・聖覚・（不明）・法善・真仏・信空の8名の先徳を配列する。源信の下には仏教の先達である聖徳太子をおき、その周囲に小野妹子・蘇我馬子・日羅上人・百済博士学哿・阿佐太子・恵慈法師ら太子と縁の深い人物が取り巻く形で配置されている。各像主は大きく重なり合うように描かれ、表情は個性的である。
製作年代や作者は不明であるが、絵絹の劣化具合や僧侶の袈裟等の表現、また法然が比較的下に配置されている様式からみて、南北朝時代頃の作品と推定される。","","","",""
木造十一面観音坐像,"",登録有形文化財,彫刻,東京都新宿区袋町15,光照寺,"",1997-03-07,"","",35.7006,139.73819,両手で水瓶を抱えるようにして持ち、蓮華座上に座る十一面観音坐像である。頭上面は上下三段、上から一、四、五面で計十面を数える。像は本体と頭光、台座すべてを一本の木から彫りだしており、頭光の円光部には梵字で種子が墨書され、像の背面にも墨書の痕跡がみられる。全体に丸みを帯びつつ柔らかくうねるような独特の造形と円満な表情などから、江戸時代後期の造仏僧木食五行明満（1718〜1810）の作と判断される。光照寺には明治以後、檀家から奉納されたものと伝えられる。,"","","",""
亮朝院の梵鐘,"",登録有形文化財,工芸品,東京都新宿区西早稲田三丁目16-24,亮朝院,"",2000-03-02,"","",35.71174,139.71346,"元禄15年（1702）、亮朝院の第五世住職日匡の時に浅草権兵衛が発起人となり鋳造された。
四区ある池の間や中帯、縦帯には「市谷田町講中」「関口講」などの講中や、鋳造に喜捨した武士・庶民の名が刻まれており、個人名は戒名397名、俗名109名にのぼる。
江戸鋳物師の鋳造技術が極めて高かった時期である元禄年間に鋳造されたもので、竜頭・乳・撞座などにその高い技術の一端が表れている。","","","",""
宝泉寺の梵鐘,"",登録有形文化財,工芸品,東京都新宿区西早稲田一丁目1-2,宝泉寺,"",2000-03-02,"","",35.70743,139.71909,"正徳元年（1711）宝泉寺の第六世住職玄海の発願により鋳造された。江戸鋳物師・西嶋伊賀守藤原正重の作。四区ある池の間と縦帯の三方に銘文が刻まれ、宝泉寺の創建から梵鐘鋳造の経緯などの歴史がわかり、史料的価値が高い。
江戸鋳物師の鋳造技術が極めて高かった時期である正徳年間に鋳造されたもので、竜頭や乳などの入念な造りに高い技術の一端が表れている。また、縦帯に仏像が陽鋳されるなど新しい試みも施されている。","","","",""
銅造地蔵菩薩半跏像,"",登録有形文化財,彫刻,東京都新宿区喜久井町61,誓閑寺,"",2001-02-14,"","",35.70485,139.71944,"右手に鍚杖、左手に宝珠を持つ地蔵菩薩半跏像である。銅造で、肉身部のみ鍍金が施される。鍚杖は柄のみ竹製。
台座にはたくさんの銘文が刻まれている。それによると文政元年9月、誓閑寺第十世住職・進誉求道の時に鋳造された像で、江戸神田に住む鋳物師・太田駿河守藤原政義の作。
台座正面の蓮弁には「百万遍講中」と記され、「市ヶ谷大奥中」以下180名余りの戒名、俗名が刻まれている。「市ヶ谷大奥中」は近接する尾張徳川家に関連するものと考えられ、資料的価値が高い。","","","",""
正受院の梵鐘,"",登録有形文化財,工芸品,東京都新宿区新宿二丁目15-20,正受院,"",2002-02-01,"","",35.69101,139.70885,"宝永8年4月25日、正受院第五世覚誉上人が発願し、第八世仰誉が万人講の助力を得て完成した。江戸鋳物師河合兵部藤原周徳の鋳造による銅造の梵鐘。
竜頭は中央に宝珠を持つ両頭式。乳は四区に五段五列100個を配する。上帯は無文、下帯は唐草文を鋳出、撞座は２ヶ所で、複弁八葉の蓮華文、池の間全区に銘文が陰刻され、鋳造の由来、鋳物師名、寄付者などが記されている。
江戸鋳物師の製造技術が頂点に達した時期の宝永8年（1711）に鋳造されたものである。写実的で精巧かつ精悍な表情の竜頭、突出した乳の間が大きく張り出されたように見える。また全体は寸詰まった感を受け、同時期の特徴がよくあらわれている。
この梵鐘は、第二次世界大戦の際、昭和17年（1942）に金属供出に出された。しかし、戦後アメリカのアイオア州立大学内の海軍特別訓練隊に保存されていたものが発見され、昭和37年（1962）12月に返還されたもので、「平和の鐘」と呼ばれている。","","","",""
西迎寺の梵鐘,"",登録有形文化財,工芸品,東京都新宿区舟町13,西迎寺,"",2006-03-07,"","",35.69116,139.72099,"西迎寺第八世・超誉萬愚が、大檀越の伏見勘七郎為智等多くの喜捨を得て、貞享3年（1686）に完成した、江戸鋳物師・椎名伊予守良寬の鋳造による銅造の梵鐘。
竜頭は中央に宝珠を持つ両頭式。上帯は無文、下帯は連続唐草文を鋳出す。撞座は2ヶ所で八葉複弁の蓮華文、撞座のない2ヶ所の縦帯上には「丸に梅鉢」が陽鋳される。
池の間一区に銘文が陰刻され、鋳造の由来、鋳造師名などが記され、同寺の銅造阿弥陀如来坐像と同じ寄進者、鋳物師であることがわかる。
江戸鋳物師の鋳造技術が頂点に達しようとした時期である貞享3年に鋳造されたものである。写実的で精巧かつ精悍に仕上げられた竜頭、上帯をなくし口径に比して肩部の径を絞り、大粒の乳を配する乳の間を広げることにより全体に寸詰まった感じを受けるという、同時期の特徴がよく表れている。","","","",""
浄栄寺の梵鐘,"",登録有形文化財,工芸品,東京都新宿区市谷薬王寺27,浄栄寺,"",2006-03-07,"","",35.69703,139.72646,"浄栄寺第三世覚円が願主となり、元禄9年（1696）に完成した。江戸鋳物師・西嶋伊賀守藤原兼長の鋳造による銅造の梵鐘。
竜頭は中央に宝珠を持つ両頭式、上帯は無文、下帯は縦帯の下部に蓮華唐草文を鋳出す。撞座は八葉複弁の蓮華文で、竜頭の長軸線上の縦帯に2個配されている。
池の間一区と二区に銘文が陰刻され、鋳造年や願主、鋳物師名などが陰刻され、三区には後刻であるが寺歴の銘文が刻まれている。また撞座のある縦帯に「南無阿弥陀仏」と陽刻されている。
江戸鋳物師の鋳造技術が頂点に達しようとした時期に鋳造されたもので、写実的で精巧かつ精悍に仕上げられた竜頭、乳の形状の入念さ等、同時期の江戸鋳物師の特徴がよくあらわれている。また西嶋伊賀守藤原兼長の作品は現在3口しか知られておらず、その内2口が新宿区に現存する（もう一つは誓閑寺にある）。江戸鋳物師の一人である西嶋兼長の鋳造技術を知る上でも貴重な鐘といえる。","","","",""
善慶寺の梵鐘,"",登録有形文化財,工芸品,東京都新宿区富久町2-12,善慶寺,"",2006-03-07,"","",35.69268,139.71838,"善慶寺第五世沙門貞祐・貞岳が願主となり、元文4年（1739）に完成した。江戸鋳物師大田近江大掾藤原正次の鋳造による銅造の梵鐘。
竜頭は中央に宝珠を持つ両頭式で、上帯は無文。下帯は連続唐草文を鋳出す。撞座は八葉複弁の蓮華文で、竜頭の長軸線上の縦帯に2個配されている。
銘文は、池の間一区、二区、三区、四区に、鐘銘、撰人、願主、鋳造年、鋳物師名などが陰刻され、また撞座のある縦帯に「南無阿弥陀仏」と陽刻されている。
江戸鋳物師の鋳造技術が頂点に達しようとした時期より少し下がる時期である元文4年に鋳造されたものであるが、写実的で精巧かつ精悍に仕上げられた竜頭や乳の形状の入念さ等、その技術的特徴がよくあらわれている。当時、江戸鋳物師を代表する鋳工の一人であった大田正次の鋳造技術を知る上でも貴重な鐘といえる。","","","",""
法雲寺の梵鐘,"",登録有形文化財,工芸品,東京都新宿区愛住町10−3,法雲寺,"",2006-08-04,"","",35.68972,139.71898,"法雲寺第四世順意が、桝屋、長谷川氏、飯田氏、江藤氏などの喜捨を受け、享保8年（1723）に完成した、江戸鋳物師・河合兵部藤原周徳の鋳造による銅造の梵鐘。
竜頭は中央に宝珠を持つ両頭式、上帯は無文、下帯は連続唐草文を鋳出す。撞座は八葉複弁の蓮華文で、竜頭の長軸線上の縦帯に2個配されている。
池の間一区と二区に鋳造年や鋳物師・寄進者名などが陰刻され、また撞座のある縦帯に「南無阿弥陀仏」と陽鋳されている。
本梵鐘は、江戸鋳物師による梵鐘鋳造の減少期において、精功かつ精悍に仕上げられた竜頭や乳の形状の入念さ等、同時期の技術的特徴をよく表したものである。なお、河合兵部藤原周徳は宝永8年（1711）に鋳造された正受院の梵鐘（新宿区登録有形文化財）の作者でもある。","","","",""
圓照寺の梵鐘,"",登録有形文化財,工芸品,東京都新宿区北新宿三丁目23-2,圓照寺,"",2014-03-26,"","",35.703906,139.69013,"真言宗豊山派圓照寺が所有する銅造の梵鐘である。寛政2年（1790）の銘を持ち、圓照寺の中興開山琳伝和尚を発願者、柏木村名主川本又四郎を施主、西村和泉守藤原政時を製作者とする。総高124㎝、口径68㎝。梵鐘に刻まれた銘文からは、この鐘の鋳造経緯等がわかる。
この梵鐘は、全体に精巧に仕上げられ、江戸鋳物師の技術的特徴が良く表わされている。またその銘文は、地域史料として重要である。江戸時代以降の梵鐘は、太平洋戦争中供出されたことから現存数は少ない。その中で、江戸鋳物師の鋳造技術を知る資料として価値が高いばかりか、銘文からは寺の歴史や鋳造の由来等を知ることができ史料的価値も高い。","","","",""
薬王院の梵鐘,"",登録有形文化財,工芸品,東京都新宿区下落合四丁目8-2,薬王院,"",2014-03-26,"","",35.718235,139.697248,"真言宗豊山派薬王院が所有する銅造の梵鐘である。寛政2年（1790）の銘を持ち、薬王院住職辨海が発願し、同じく住職の良周が近郷の村々から寄付を集めた。製作は西村和泉守藤原政平である。総高116・5㎝、口径64㎝。梵鐘に刻まれた銘文からは薬王院の歴史や鐘の鋳造経緯、寄付をした講名・人名がわかる。
この梵鐘は、全体に精巧に仕上げられ、江戸鋳物師の技術的特徴が良く表わされている。またその銘文は、地域史料として重要である。江戸時代以降の梵鐘は、太平洋戦争中供出されたことから現存数は少ない。その中で、江戸鋳物師の鋳造技術を知る資料として価値が高いばかりか、銘文からは寺の歴史や鋳造の由来等を知ることができ史料的価値も高い。","","","",""
西應寺の梵鐘,"",登録有形文化財,工芸品,東京都新宿区須賀町11-4,西應寺,"",2015-02-06,"","",35.683978,139.723072,"西應寺の梵鐘で、正徳2年（1712）に鋳造された。西應寺の第四世住職惠白の発願により、小沼播磨守藤原長政により鋳造された。高さ130.5㎝、口径70.3㎝。梵鐘に刻まれた銘文からは、この鐘の鋳造経緯や670名に及ぶ寄進者名がわかる。
この梵鐘は、全体に精巧に仕上げられ、江戸鋳物師の技術的特徴が良く表わされている。またその銘文は、地域史料として重要である。江戸時代以降の梵鐘は、太平洋戦争中供出されたことから現存数は少ない。その中で、江戸鋳物師の鋳造技術を知る資料として価値が高いばかりか、銘文からは寺の歴史や鋳造の由来等を知ることができ史料的価値も高い。","","","",""
光照寺の涅槃図,"",登録有形文化財,絵画,東京都新宿区袋町15  ,光照寺,"",2018-10-24,"","",35.700534,139.738114,光照寺に伝来する涅槃図で、縦317.2cm×横196.4cmの大振りな涅槃図である。人物表現などの描写の特徴から、元禄から正徳年間（1688〜1714）頃の、画技に習熟した江戸狩野派の画家によって描かれたものと推定される。画面の地には、約9cm角の金箔が全面に貼られ、釈迦には金泥が塗られているが、切金等の技法は見られない。本紙上部に剥落箇所も見られるが、すでに修復済みであり、保存状態はおおむね良好である。区内に現存する貴重な江戸初中期の涅槃図として、また江戸狩野派の涅槃図として推定できる作品としても重要である。,"","","",""
長安寺の六地蔵塔,"",登録有形文化財,歴史資料,東京都新宿区信濃町2-8,長安寺,"",2019-03-07,"","",35.684431,139.719262,"長安寺の六地蔵塔は、石塔の正面と両側面に六地蔵を示す地蔵菩薩立像を各二体ずつ彫っている。背面の銘文によれば、弘化2年（1845）１月24日に発生した青山の大火の犠牲者を弔うため、翌弘化3年10月に建立された。青山の大火は火元である青山権太原（現在の港区）より南へ燃え広がり、翌日には海へ到達した。数百人が焼死、水死し、赤羽橋には罹災者のためのお救い小屋が設置されたという。総高は105.5cmである。なお伝承によれば、大火のおり、長安寺門前の地蔵菩薩像前で火勢が止まり、四谷方面を大火から救ったという。六地蔵塔は大火の犠牲者を弔うために建立されたものであり、この伝承に登場する地蔵菩薩像は現存しないが、現在、六地蔵塔の脇には、古い墓石に「火防地蔵」と改刻した石塔が建っている。
六体の地蔵菩薩立像は表情、装束、持物ともに細やかに表現されており、保存状態もおおむね良好である。地蔵菩薩立像を左右正面に二体ずつ彫った造形は極めて珍しく、希少である。本塔は江戸時代に周辺地域を襲った災害の記憶をとどめる資料として、また希少な像容を持つ石造物として貴重である。","","","",""
太宗寺墓地出土品,"",指定有形文化財,考古資料,東京都新宿区新宿二丁目9-2,太宗寺,"",1986-10-03,"","",35.68982,139.70921,"
太宗寺墓地内にある信州高遠藩主内藤家の墓地より出土した副葬品910点である。
太宗寺は、寛永６（1629）年内藤家五代藩主正勝の葬儀を行って以来同家と縁を結び、六代藩主重頼によって寺地が寄進され、菩提寺として歴代藩主や一族の墓地が営まれた。
墓地は約300坪に及び、57基の墓石が建っていたが、昭和27〜28（1952〜53）年にかけて区画整理事業により縮小されることとなり、現在の３基の墓石に改葬された。
この出土品は、その際に各被葬者の甕棺内から出土したもので、人骨は埋葬し直したが、副葬品は文化財として保存した。内容は鏡・煙管・小刀・かんざし・懐中時計・銭貨などの金属製品851点、人形・ミニチュアなどの土製品12点、陶磁器33点、仏像・筆・漆器などの木製品６点、硯などの石製品4点、眼鏡などのガラス製品３点、布製品１点の計910点である。この中で銭貨は中世のものや宋銭・明銭など中国のものも含み計779点に及ぶ。","","","",""
小銅鐸,"",指定有形文化財,考古資料,東京都新宿区四谷三栄町12-16（新宿歴史博物館）,新宿区,"",2001-02-14,"","",35.69006,139.72568,"平成3〜4（1991〜92）年にかけて発掘調査を行った高田馬場三丁目遺跡から出土した青銅製の小銅鐸。弥生時代後期の土器が伴出した小型の竪穴住居跡（第7号住居跡）の北側壁中央部から発見された。
素文で正面にのみ二つの型持孔があけられる。舌は発見されなかったが、内突帯があり音響具としての機能を備えていたことがわかる。
小銅鐸は弥生時代の祭祀用具で、北九州から関東地方にかけて広く出土例が報告されているが、都内では珍しく、最初の出土例として知られている。","","","",""
隆起線文系土器,"",指定有形文化財,考古資料,東京都新宿区四谷三栄町12-16（新宿歴史博物館）,新宿区,"",2001-02-14,"","",35.69006,139.72568,"平成６〜７（1994〜1995）年にかけて発掘調査を行った、百人町三丁目西遺跡から出土した隆起線文系の深鉢形土器。埋没谷の谷頭の谷底で、割れて散らばったような状態で出土したが、調査範囲からは住居跡のような遺構は発見されなかった。
出土した80点の破片のうち69点が接合し、その結果、形状は丸底で、楕円形の口縁部をもち、その下に２条の隆起線文が施されていた。
隆起線文系土器は、縄文時代草創期（約12,000年前）に製作された日本最古級の土器として知られるが、これまでの発見例はいずれも細片での出土であり、このような本来の器形に復元できる資料は、全国的にも極めて少なく貴重である。","","","",""
下落合横穴墓出土品,"",登録有形文化財,考古資料,東京都新宿区四谷三栄町12-16（新宿歴史博物館）,新宿区,"",1986-03-07,"","",35.69006,139.72568,"昭和41（1966）年７月に、下落合４丁目３番地付近の落合台地上で、宅地造成工事が行われた際に発見された３基の横穴墓から出土した被葬者の人骨２体と副葬品の直刀一振である。
横穴墓は３基並んで発見され（北から１･２･３号墓）、２基は工事により崩壊していたが、南寄りの３号墓は原形をとどめていた。3号墓は羨道や玄室も明確で、関東ローム層を掘り込み玄室には砂利を敷きつめている。すでに人骨や副葬品は腐蝕し失われていたが、崩壊した３号墓には人骨と直刀が残っていた。人骨は２体分であったが、それぞれ一部しか残っておらず、１体が壮年の男性であることが判明したにとどまった。
下落合横穴墓群は、８世紀（奈良時代）のものと推定される横穴式古墳群で、妙正寺川にのぞむ落合台地の斜面に造られたものである。現在、下落合弁財天（下落合4-3-7）が建っている裏手の崖地一帯に分布しているものと考えられるが、横穴墓の総数や分布状態については不明である。","","","",""
