1000000564,事業者向け,木の街並み創出事業,都民の目に触れ、接することができる都内に所在する民間施設において、一定の多摩産材及び国産木材を使用した建築物の外壁や外構の木質化を支援,"補助対象経費の1/2以内（下限額5,000千円、上限額30,000千円）",公益財団法人東京都農林水産振興財団　森の事業課森の整備係 電話：042-528-0641,https://www.tokyo-aff.or.jp/site/forest/1209.html,,,2019/4/1 0:00,2027/3/31 0:00,,,,助成・補助金;成長・成熟期の支援,補助金,設備投資;環境・省エネ,,https://www.support-navi.metro.tokyo.lg.jp/detail/2/4mDRB9O6sVfoTlLDe,13,東京都,2024/3/22,,,,,,,,,,,,,,,,,,,,,,,,,,,,,,,
1000000563,両方,農林水産物認証取得支援事業（森林認証取得支援事業）,森林所有者や製材業者等が森林認証を取得する際に必要となる経費について支援を実施します。,森林管理認証(FM認証)、木材認証(CoC認証)に係る審査取得費用を助成します。初回認証時に限り、コンサルタント契約料も助成対象とします。 助成率：1/2以内（ただし、コンサルタント契約料は補助額上限40万円）,公益財団法人東京都農林水産振興財団　地産地消推進課　認証支援係 電話：042-528-0510,https://www.tokyo-aff.or.jp/site/business/1130.html,,,2023/4/17 0:00,2024/2/29 0:00,環境・自然;産業・仕事,,手当・助成金等,助成・補助金;規制・許認可;成長・成熟期の支援,補助金;規制・許認可その他,事業計画・経営企画,https://www.support-navi.metro.tokyo.lg.jp/detail/1/g04jvlHmDu3VgJlK3,https://www.support-navi.metro.tokyo.lg.jp/detail/2/g04jvlHmDu3VgJlK3,13,東京都,2024/3/22,,,,,,,,,,,,,,,,,,,,,,,,,,,,,,,
1000000562,両方,多摩産材の情報発信力強化事業,東京の森林と、とうきょうの木の恵みを感じることができる体験型ショールームとして、多摩産材情報発信拠点「TOKYO MOKUNAVI」を運営,・Webサイトの運営 ・多摩産材事業者の紹介 ・セミナー・イベント等の開催 ・映像コンテンツ等による東京の森林・林業の紹介,公益財団法人東京都農林水産振興財団　森の事業課森の整備係 電話：042-528-0641,https://tokyomokunavi.metro.tokyo.lg.jp/,,,2023/9/15 0:00,2024/3/31 0:00,子供・教育;環境・自然;産業・仕事,,教室・講習会;イベント;情報提供,サービス;成長・成熟期の支援,セミナー・研修・イベント;情報提供・相談,販路開拓,https://www.support-navi.metro.tokyo.lg.jp/detail/1/WyvKcE0jeVxQZr4DG,https://www.support-navi.metro.tokyo.lg.jp/detail/2/WyvKcE0jeVxQZr4DG,13,東京都,2024/3/22,,,,,,,,,,,,,,,,,,,,,,,,,,,,,,,
1000000561,両方,国産木材の魅力発信拠点の運営,国産木材の活用に向けた様々な情報を発信し、国産木材やオフィスの木質化に興味のある方々を「活かす繋げる」活動の場として、国産木材魅力発信拠点「MOCTION」を運営,・Webサイトの運営 ・国産木材事業者の紹介 ・セミナー・イベント等の開催 ・全国の木材関連事業の補助金案内,公益財団法人東京都農林水産振興財団　森の事業課森の整備係 電話：042-528-0641,https://moction.jp/,,,2023/4/1 0:00,2024/3/31 0:00,子供・教育;環境・自然;産業・仕事,,教室・講習会;イベント;情報提供,サービス;成長・成熟期の支援,セミナー・研修・イベント;情報提供・相談,販路開拓,https://www.support-navi.metro.tokyo.lg.jp/detail/1/m2jqKsxOj85KD3R1c,https://www.support-navi.metro.tokyo.lg.jp/detail/2/m2jqKsxOj85KD3R1c,13,東京都,2024/3/22,,,,,,,,,,,,,,,,,,,,,,,,,,,,,,,
1000000560,両方,木造木質化を担う建築士の育成事業,中・大規模木造建築物の計画・設計・施工を担う知識と技術を有する建築士を育成することを目的とし、中・大規模木造建築物の構造や内装等の実践的な知識を得られる講習会を開催,〇現地講習会及び現地見学会 〇Web講習会,産業労働局農林水産部森林課 03-5320-4855,https://www.sangyo-rodo.metro.tokyo.lg.jp/nourin/news/2023/1101_18363.html,,,2023/11/1 0:00,,子供・教育;産業・仕事,,教室・講習会,サービス;成長・成熟期の支援,セミナー・研修・イベント,人材育成・教育・研修,https://www.support-navi.metro.tokyo.lg.jp/detail/1/cFkOgbuQAm3IVaMk2,https://www.support-navi.metro.tokyo.lg.jp/detail/2/cFkOgbuQAm3IVaMk2,13,東京都,2024/3/22,,,,,,,,,,,,,,,,,,,,,,,,,,,,,,,
1000000559,事業者向け,中・大規模建築物の木造木質化支援事業,都内に所在し、都民の目に触れることのできる中・大規模の民間施設において、主要構造部に多摩産材及び国産木材を一定以上使用する建築に係る実施設計及び建築工事を支援,"〇設計：補助対象経費の1/2以内（下限額5,000千円、上限額50,000千円） 〇施工：木造木質化に係る経費の1/2以内、又は建築工事費の15％以内（下限額50,000千円、上限額500,000千円）",公益財団法人東京都農林水産振興財団　森の事業課森の整備係 電話：042-528-0641,https://www.tokyo-aff.or.jp/site/forest/33227.html,,,2020/4/1 0:00,,,,,助成・補助金;成長・成熟期の支援,補助金,設備投資;環境・省エネ,,https://www.support-navi.metro.tokyo.lg.jp/detail/2/IchMpQvctfNXmB29K,13,東京都,2024/3/22,,,,,,,,,,,,,,,,,,,,,,,,,,,,,,,
1000000558,両方,多摩産材情報センターの運営,多摩産材の利用拡大と、多摩地域の林業・木材産業の活性化を目的に、利用者と供給者とのマッチングをする「多摩産材情報センター」を運営,多摩産材の製品や調達方法について、多摩産材を取扱う業者から収集した情報をもとに、相談内容に応じた情報を提供。相談方法は、窓口への来訪、メール、電話,公益財団法人東京都農林水産振興財団　森の事業課森の整備係 多摩産材情報センター 電話：0428-20-1181,https://tamasanzai.tokyo/,,,2023/4/1 0:00,2024/3/31 0:00,くらし・住まい;環境・自然;産業・仕事,引越し・住まい,相談;情報提供,サービス;成長・成熟期の支援,情報提供・相談,販路開拓,https://www.support-navi.metro.tokyo.lg.jp/detail/1/NfLdeVzxHFnlRXtjs,https://www.support-navi.metro.tokyo.lg.jp/detail/2/NfLdeVzxHFnlRXtjs,13,東京都,2024/3/22,,,,,,,,,,,,,,,,,,,,,,,,,,,,,,,
1000000557,事業者向け,にぎわい施設で目立つ多摩産材推進事業,商業施設や駅舎等、人が多く集まり、だれでも利用できる、民間事業者が運営する都内施設において、多摩産材を目立つ形で使った内装・外装の木質化、什器の整備等を支援,"補助対象経費の1/2以内（上限50,000千円）",公益財団法人東京都農林水産振興財団　森の事業課森の整備係 電話：042-528-0641,https://www.tokyo-aff.or.jp/site/forest/1203.html,,,2016/4/1 0:00,2026/3/31 0:00,,,,助成・補助金;成長・成熟期の支援,補助金,設備投資;環境・省エネ,,https://www.support-navi.metro.tokyo.lg.jp/detail/2/uGKJHZ21iVzMeYTy7,13,東京都,2024/3/22,,,,,,,,,,,,,,,,,,,,,,,,,,,,,,,
1000000556,事業者向け,森林作業道改良補助,補助金の目的：東京都森林作業道作設指針に則る作業道の改良であって、造林又は間伐事業と一体的に実施され、かつ国の要領に規定する事前計画に記載された既設の林内路網の状況から整備することが相当であると知事が認めたものに対し、交付する。  ,補助対象経費：事業費 負担割合　　：都29/50、事業体21/50,産業労働局森林事務所森林産業課 0428-22-1159,http://www.sangyo-rodo.metro.tokyo.jp/nourin/ringyou/promotion/zourin/,林業事業体,,2023/4/1 0:00,2024/2/29 0:00,,,,助成・補助金;成長・成熟期の支援,補助金,設備投資,,https://www.support-navi.metro.tokyo.lg.jp/detail/2/EpAybqhZUPzrixlYn,13,東京都,2024/3/22,,,,,,,,,,,,,,,,,,,,,,,,,,,,,,,
1000000555,事業者向け,林業労働力総合対策事業,林業労働力不足を解消するため、林業技術者の確保・育成、林業経営体等の強化に必要な経費の一部を助成します。,①林業技術者の確保・育成 　研修準備費や資材費等について定額を助成 ②林業経営体等の強化 　経営の拡大・多角化の経費や装備等の支給経費について1/2～定額を助成 　,公益財団法人東京都農林水産振興財団　東京都林業労働力確保支援センター 電話：042-528-0643,https://www.ringyou-navi.tokyo/company/,,,,,,,,助成・補助金;成長・成熟期の支援,給付・助成,事業計画・経営企画;設備投資;雇用・人材採用;人材育成・教育・研修;社会保障・福利厚生,,https://www.support-navi.metro.tokyo.lg.jp/detail/2/dvi8hf4QJGy4Fw94C,13,東京都,2024/3/22,,,,,,,,,,,,,,,,,,,,,,,,,,,,,,,
1000000554,事業者向け,高品質木材のための保育管理事業費補助金（間伐対策）,補助金の目的：高品質木材のための保育管理事業に要する経費について交付する。  ,補助対象経費：事業費 負担割合　　：都2/5、事業体3/5,産業労働局森林事務所森林産業課 0428-22-1159,https://forestry-office.metro.tokyo.lg.jp/about/zou/index.html,林業事業体,,2023/4/1 0:00,2024/2/29 0:00,,,,助成・補助金,補助金,,,https://www.support-navi.metro.tokyo.lg.jp/detail/2/X7a9oPbHuN2qdbvCS,13,東京都,2024/3/22,,,,,,,,,,,,,,,,,,,,,,,,,,,,,,,
1000000553,事業者向け,東京都林業用優良種苗生産事業等補助金,補助金の目的：東京都産の優良な種苗生産の安定化を図るため、①裸苗生産補助、②コンテナ苗生産補助を実施する。  ,補助対象経費：生産経費 負担割合　　：①都1/2、事業者1/2、②都1/8、事業者7/8,産業労働局森林事務所森林産業課 0428-22-1159,,林業種苗生産団体,,2023/4/1 0:00,2024/2/29 0:00,,,,助成・補助金,補助金,,,https://www.support-navi.metro.tokyo.lg.jp/detail/2/Z4yGizMdImsqkUfu4,13,東京都,2024/3/22,,,,,,,,,,,,,,,,,,,,,,,,,,,,,,,
1000000552,事業者向け,木材利用普及啓発強化推進事業費補助金（木育活動の推進）,補助金の目的：未就学児が生活・活動する施設等において、森林の役割や木材の良さ・利用意義等を学ぶ木育活動に係る経費を補助することにより、子供だけでなく大人も木や森への親しみを深め、多摩産材の利用拡大を図るとともに、森づくりへの意識向上を図ることを目的とする。  ,補助対象経費：行事等開催経費 負担割合　　：都3/4、事業体1/4,産業労働局農林水産部森林課 03-5320-4855,https://www.sangyo-rodo.metro.tokyo.lg.jp/nourin/ringyou/kiiku/tama/,多摩産材を使った木育活動実施団体,,2023/4/1 0:00,2023/12/31 0:00,,,,助成・補助金;成長・成熟期の支援,補助金,人材育成・教育・研修;環境・省エネ,,https://www.support-navi.metro.tokyo.lg.jp/detail/2/CNYbUKSgewMHirHvs,13,東京都,2024/3/22,,,,,,,,,,,,,,,,,,,,,,,,,,,,,,,
1000000551,事業者向け,森林作業道整備促進,補助金の目的：森林作業道整備において、搬出間伐等の計画により森林整備及び森林経営の効率化に資すると認められる木製構造物等の施設整備に係る経費について交付する。  ,補助対象経費：事業費 負担割合　　：都10/10　又は　国3/10、都7/25、事業体21/50,産業労働局森林事務所森林産業課 0428-22-1159,http://www.sangyo-rodo.metro.tokyo.jp/nourin/ringyou/promotion/zourin/,林業事業体,,2023/4/1 0:00,2024/2/29 0:00,,,,助成・補助金;成長・成熟期の支援,補助金,設備投資;環境・省エネ,,https://www.support-navi.metro.tokyo.lg.jp/detail/2/9sgmW7FRlSBUBqdYf,13,東京都,2024/3/22,,,,,,,,,,,,,,,,,,,,,,,,,,,,,,,
1000000550,事業者向け,高品質木材のための保育管理事業費補助金（造林対策）,補助金の目的：高品質木材のための保育管理事業に要する経費について交付する。  ,補助対象経費：事業費 負担割合　　：都2/5、事業体3/5,産業労働局森林事務所森林産業課 0428-22-1159,https://forestry-office.metro.tokyo.lg.jp/about/zou/index.html,林業事業体,,2023/4/1 0:00,,,,,助成・補助金,補助金,,,https://www.support-navi.metro.tokyo.lg.jp/detail/2/xYw358oeX1zK7CFqh,13,東京都,2024/3/22,,,,,,,,,,,,,,,,,,,,,,,,,,,,,,,
1000000549,事業者向け,東京都苗木生産施設整備支援事業費補助金,補助金の目的：スギ及びヒノキ苗木の生産に必要な施設整備に要する経費を助成する。  ,補助対象経費：苗木生産施設に係る経費 負担割合　　：都1/2、事業者1/2,産業労働局森林事務所森林産業課 0428-22-1159,,林業種苗生産事業者,,2023/4/1 0:00,2024/2/29 0:00,,,,助成・補助金;成長・成熟期の支援,補助金,設備投資,,https://www.support-navi.metro.tokyo.lg.jp/detail/2/PwU7RHNnfvmL6MqQs,13,東京都,2024/3/22,,,,,,,,,,,,,,,,,,,,,,,,,,,,,,,
1000000548,事業者向け,木材利用普及啓発強化推進事業（多摩産材利用啓発推進事業費補助金）,補助金の目的： 多摩産材の利用や多摩産材を使用した家づくりを推進するイベントの開催等に係る経費を補助することにより、木材利用の推進及び健全な森林の維持を図ることを目的とする。  ,補助対象経費：行事開催経費 負担割合　　：都3/4、事業体1/4,（23区・島しょ）産業労働局農林水産部森林課　03-5320-4855  （多摩）産業労働局森林事務所森林産業課　0428-22-1162,https://www.sangyo-rodo.metro.tokyo.lg.jp/nourin/ringyou/kiiku/tama/,都内で木材利用の普及啓発を行う団体,,2023/4/28 0:00,2023/6/2 0:00,,,,助成・補助金;成長・成熟期の支援,補助金,販路開拓;環境・省エネ,,https://www.support-navi.metro.tokyo.lg.jp/detail/2/AZWutSsgXv2GU1bfu,13,東京都,2024/3/22,,,,,,,,,,,,,,,,,,,,,,,,,,,,,,,
1000000547,事業者向け,林産物搬出運搬支援事業補助金,補助金の目的：広葉樹の搬出・運搬に必要な経費について交付する。  ,補助対象経費：広葉樹に係る搬出・運搬経費 負担割合　　：定額,産業労働局森林事務所森林産業課 0428-22-1163,,林業事業体等,,2023/4/1 0:00,2024/2/29 0:00,,,,助成・補助金,補助金,,,https://www.support-navi.metro.tokyo.lg.jp/detail/2/7IlsEwdGgw82RDoaf,13,東京都,2024/3/22,,,,,,,,,,,,,,,,,,,,,,,,,,,,,,,
1000000546,事業者向け,間伐材搬出補助,補助金の目的：間伐等で発生した木の搬出集積に係る経費について交付する。  ,補助対象経費：事業費 負担割合　　：都7/10、事業体3/10,産業労働局森林事務所森林産業課 0428-22-1159,http://www.sangyo-rodo.metro.tokyo.jp/nourin/ringyou/promotion/zourin/,林業事業体,,2023/4/1 0:00,2024/2/29 0:00,,,,助成・補助金;成長・成熟期の支援,補助金,環境・省エネ,,https://www.support-navi.metro.tokyo.lg.jp/detail/2/hksrZ3B8eMcInvZfg,13,東京都,2024/3/22,,,,,,,,,,,,,,,,,,,,,,,,,,,,,,,
1000000545,事業者向け,造林事業費補助,補助金の目的：植え付け、下刈り、枝打ち、除伐等に係る経費を補助する。,補助対象経費：事業費 負担割合　　：都2/5（国費が入る場合は国3/10、都1/10）、事業体3/5,産業労働局森林事務所森林産業課 0428-22-1159,http://www.sangyo-rodo.metro.tokyo.jp/nourin/ringyou/promotion/zourin/,林業事業体,,2023/4/1 0:00,,,,,助成・補助金,補助金,,,https://www.support-navi.metro.tokyo.lg.jp/detail/2/OxPejFJNimRerLtaV,13,東京都,2024/3/22,,,,,,,,,,,,,,,,,,,,,,,,,,,,,,,
1000000544,事業者向け,製材業等の生産基盤向上支援事業費補助金,補助金の目的：都内の木材加工流通施設に係る整備に必要な経費について交付する。  ,補助対象経費：施設整備費 負担割合　　：都1/2、事業体1/2,産業労働局森林事務所森林産業課 0428-22-1162,,多摩産材認証協議会登録の製材事業者,,2023/4/1 0:00,2023/12/31 0:00,,,,助成・補助金;成長・成熟期の支援,補助金,設備投資,,https://www.support-navi.metro.tokyo.lg.jp/detail/2/YLQtXnEC7EBNwTrib,13,東京都,2024/3/22,,,,,,,,,,,,,,,,,,,,,,,,,,,,,,,
1000000543,事業者向け,森林作業道補助,補助金の目的：東京都森林作業道作設指針に則る作業道の開設であって、造林又は間伐事業と一体的に実施され、かつ国の要領に規定する事前計画に記載された既設の林内路網の状況から整備することが相当であると知事が認めたものに対し、交付する。  ,補助対象経費：事業費 負担割合　　：都29/50（国費が入る場合は国3/10、都が7/25）、事業体21/50,産業労働局森林事務所森林産業課 0428-22-1159,http://www.sangyo-rodo.metro.tokyo.jp/nourin/ringyou/promotion/zourin/,林業事業体,,2023/4/1 0:00,2024/2/29 0:00,,,,助成・補助金;成長・成熟期の支援,補助金,設備投資;環境・省エネ,,https://www.support-navi.metro.tokyo.lg.jp/detail/2/vuBnkAmoPZ7FwzlyS,13,東京都,2024/3/22,,,,,,,,,,,,,,,,,,,,,,,,,,,,,,,
1000000542,事業者向け,保育園等による木育活動の支援事業費補助金,補助金の目的：未就学児が生活・活動する施設等において、森林の役割や木材の良さ・利用意義等を学ぶ木育活動に係る経費を補助することにより、子供だけでなく大人も木や森への親しみを深め、多摩産材の利用拡大を図るとともに、森づくりへの意識向上を図ることを目的とする。  ,補助対象経費：内装木質化、木製遊具等に係る経費 負担割合　　：都1/2、事業体1/2 ,（23区）産業労働局農林水産部森林課　03-5320-4855  （多摩）産業労働局森林事務所森林産業課　0428-22-1162,https://www.sangyo-rodo.metro.tokyo.lg.jp/nourin/ringyou/kiiku/mokuiku/,民間保育園、幼稚園等,,2023/4/28 0:00,2023/6/30 0:00,,,,助成・補助金;成長・成熟期の支援,補助金,設備投資;人材育成・教育・研修;環境・省エネ,,https://www.support-navi.metro.tokyo.lg.jp/detail/2/j5RSn0wu8WwkNpHlO,13,東京都,2024/3/22,,,,,,,,,,,,,,,,,,,,,,,,,,,,,,,
1000000541,事業者向け,森林経営効率化支援事業費補助金,補助金の目的：所有境界の不明森林において、境界明確化等への支援を行うことにより、効率的な施業の実施を促進し、林業経営の基盤を確立していくことを目的とする。  ,補助対象経費：①説明会開催経費　②現地調査等経費 負担割合　　：①都1/2、事業体1/2　②10/10,産業労働局森林事務所森林産業課 0428-22-1159,https://forestry-office.metro.tokyo.lg.jp/approach/syuyaku/index.html,林業事業体,,2023/4/1 0:00,2023/12/31 0:00,,,,助成・補助金;成長・成熟期の支援,補助金,事業計画・経営企画,,https://www.support-navi.metro.tokyo.lg.jp/detail/2/vuBnkAmoPZ7F8zlyS,13,東京都,2024/3/22,,,,,,,,,,,,,,,,,,,,,,,,,,,,,,,
1000000540,事業者向け,間伐対策,補助金の目的：市町村森林整備計画に定められる標準伐期齢の林分で行う、適正な密度管理を目的とした不用木の除去、不良木の淘汰に係る経費について交付する。  ,補助対象経費：事業費 負担割合　　：都29/50（国費が入る場合は国3/10、都7/25）、事業体21/50,産業労働局森林事務所森林産業課 0428-22-1159,http://www.sangyo-rodo.metro.tokyo.jp/nourin/ringyou/promotion/zourin/,林業事業体,,2023/4/1 0:00,2024/2/29 0:00,,,,助成・補助金;成長・成熟期の支援,補助金,環境・省エネ,,https://www.support-navi.metro.tokyo.lg.jp/detail/2/1SoAYj79GEeDULT4w,13,東京都,2024/3/22,,,,,,,,,,,,,,,,,,,,,,,,,,,,,,,
1000000539,両方,農林水産物認証取得支援事業（農家認証取得支援事業）,持続可能性に配慮した認証取得者の販路を維持し、または認証を取得することで収益拡大を目ざす農業者等に対して、その取得等に係る支援を実施します。  ,ＪＧＡＰ認証、ＡＳＩＡＧＡＰ認証、ＧＬＯＢＡＬＧ．Ａ．Ｐ．認証に係る審査費用を助成します。初回認証時に限り、コンサルタント契約料も助成対象とします。 また、認証の取得や継続の趣旨に沿った研修に参加した場合、受講費用を助成します。 助成率：1/2以内,公益財団法人東京都農林水産振興財団 地産地消推進課　認証支援係 電話　042-528-0510,https://www.tokyo-aff.or.jp/site/business/1129.html,,,,,子供・教育;環境・自然;産業・仕事,学校教育,手当・助成金等,助成・補助金;規制・許認可;成長・成熟期の支援;商業・地域・団体支援,給付・助成;補助金;規制・許認可その他,事業計画・経営企画;販路開拓;環境・省エネ;商業・地域・団体支援,https://www.support-navi.metro.tokyo.lg.jp/detail/1/TCxQ2B1RLAPYwnFEy,https://www.support-navi.metro.tokyo.lg.jp/detail/2/TCxQ2B1RLAPYwnFEy,13,東京都,2024/3/22,,,,,,,,,,,,,,,,,,,,,,,,,,,,,,,
1000000538,事業者向け,広域食育推進民間活動支援,都内における食育の取り組みを一層推進していくことを目的として、民間団体が都民を対象に行う食育推進活動に対する補助金を交付しています。,補助対象となる経費の2分の1以内で、1事業実施主体あたり120万円以内（千円未満の金額は切り捨て）を補助します。,公益財団法人東京都農林水産振興財団 地産地消推進課　地産地消食育係 Tel：042-528-0510,https://www.tokyo-aff.or.jp/soshiki/5/68021.html,,,,,,,,助成・補助金;成長・成熟期の支援;商業・地域・団体支援,補助金,環境・省エネ;商業・地域・団体支援,,https://www.support-navi.metro.tokyo.lg.jp/detail/2/e37hSx6wRNQWdlQ2y,13,東京都,2024/3/22,,,,,,,,,,,,,,,,,,,,,,,,,,,,,,,
1000000537,事業者向け,死亡牛処理費補助,補助金の目的：死亡牛の処理・運搬費用を補助する  ,"補助対象経費：死亡牛の処理・運搬費用の一部 負担割合　　：運搬費最大3,500円、処理費最大7,500円",産業労働局農林水産部食料安全課 03-5320-4845,,都内の牛飼養者,,,,,,,助成・補助金,補助金,,,https://www.support-navi.metro.tokyo.lg.jp/detail/2/nJCLPuqayoL7FfW4G,13,東京都,2024/3/22,,,,,,,,,,,,,,,,,,,,,,,,,,,,,,,
1000000536,事業者向け,生産農場清浄化対策,補助金の目的：ヨーネ病、牛ウイルス性下痢、牛伝染性リンパ腫に感染している牛を淘汰する  ,補助対象経費：当該牛の評価額から利用額を控除した額 負担割合　　：都1/3以内,産業労働局農林水産部食料安全課 03-5320-4845,,都内の牛飼養者,,,,,,,助成・補助金,補助金,,,https://www.support-navi.metro.tokyo.lg.jp/detail/2/PwU7RHNnfvmL0MqQs,13,東京都,2024/3/22,,,,,,,,,,,,,,,,,,,,,,,,,,,,,,,
1000000535,事業者向け,特定家畜伝染病侵入防止対策事業費補助金,補助金の目的：特定家畜伝染病の感染防止を推進する  ,補助対象経費：特定家畜伝染病の病原体の侵入を防止する取組 負担割合　　：1/2以内,産業労働局農林水産部食料安全課 03-5320-4845,,都内の家畜・家きん飼養者,,,,,,,助成・補助金,補助金,,,https://www.support-navi.metro.tokyo.lg.jp/detail/2/2U5aVMYMQkawt5K2o,13,東京都,2024/3/22,,,,,,,,,,,,,,,,,,,,,,,,,,,,,,,
1000000534,事業者向け,中食における東京産食材ＰＲ事業費補助金,補助金の目的：東京産食材のＰＲ  ,補助対象経費：東京産食材の購入費 負担割合　　：都1/2、事業者1/2,産業労働局農林水産部食料安全課 03-5320-4837,https://www.sangyo-rodo.metro.tokyo.lg.jp/nourin/news/2023/0928_18204.html,23区内中食事業者,,2023/9/28 0:00,2023/11/30 0:00,,,,助成・補助金,給付・助成;補助金,,,https://www.support-navi.metro.tokyo.lg.jp/detail/2/qaSpN23YMQtcZ15ew,13,東京都,2024/3/22,,,,,,,,,,,,,,,,,,,,,,,,,,,,,,,
1000000533,事業者向け,食品産業の輸出向けHACCP等対応施設整備事業補助金（仮）,補助金の目的：農林水産物及び食品の輸出促進  ,補助対象経費：施設整備及び機器整備に要する経費 負担割合　　：国1/2、事業者1/2,産業労働局農林水産部食料安全課 03-5320-4882,,,,,,,,,助成・補助金;成長・成熟期の支援,補助金,設備投資,,https://www.support-navi.metro.tokyo.lg.jp/detail/2/lh90AeiYQWdqTGxEf,13,東京都,2024/3/22,,,,,,,,,,,,,,,,,,,,,,,,,,,,,,,
1000000532,事業者向け,肥料コスト低減緊急対策事業費補助金,補助金の目的：肥料購入経費を低減するため、土壌診断を実施  ,補助対象経費：肥料コスト低減緊急対策事業に要する経費 負担割合　　：都10/10,産業労働局農林水産部 食料安全課 03-5320-4834,,東京都農業協同組合中央会,,,,,,,助成・補助金,補助金,,,https://www.support-navi.metro.tokyo.lg.jp/detail/2/V1JfxDXFi5XIymTC0,13,東京都,2024/3/22,,,,,,,,,,,,,,,,,,,,,,,,,,,,,,,
