支援情報ID,タグ（対象者）,事業（制度）名,概要,支援内容,問合せ先,詳細リンク先（URL）,対象者,利用・申請方法,受付開始日,受付終了日,タグ（個人向けカテゴリー）,タグ（ライフシーン）,タグ（個人向け行政サービス分類）,タグ（事業者向けカテゴリー）,タグ（事業者向け行政サービス分類）,タグ（事業ステージ）,掲載URL（個人向け）,掲載URL（事業者向け）,全国地方公共団体コード,制度所管組織,更新日,通称,対象年齢（未満）,対象年齢（以下）,対象年齢（以上）,対象年齢（超過）,支給内容（本文）,支給内容（金銭的支援）,支給内容（物的支援）,利用費用,実施期間（開始日時）,実施期間（終了日時）,実施場所（名称）,実施場所（住所）,定員,利用時間（開始時間）,利用時間（終了時間）,休日,手続きできる人,手続き方法,持ち物,手続き書類（様式）,手続き書類（記入例）,手続き窓口,タイトル,UMID,種別,根拠法令等（名称）,根拠法令等（条項）,タグ（コンテンツ）,タグ,市町村
1000000737,事業者向け,社会福祉施設等への非常用電源等整備促進事業補助金,補助金の目的：非常用電源等を導入する社会福祉施設等に対し、電源設備、機器等の購入に要する経費を補助することにより、災害時にも施設機能を維持することで社会福祉施設等利用者の安全確保を図る,"【補助対象機器・補助基準額】 （１）非常用電源設備：5,000千円 （２）外部給電器：800千円 （３）Ｖ２Ｈ：1,300千円 （４）可搬型蓄電池：400千円 （５）車両接続型電源：250千円 （６）外部電源接続切替盤：500千円 （７）外部給電器及び外部電源接続切替盤：1,300千円 （８）車両接続型電源及び外部電源接続切替盤：750千円  【補助率】　4分の3 ",東京都社会福祉施設等への非常用電源等の整備促進事業コールセンター TEL：0120-984-302　　受付時間：平日9:00-18:00（年末年始は除く。）,https://ps-support.jp/,都知事または都内区市町村長の指定等を受けた入所・通所・訪問・相談系等全ての社会福祉施設等 （ただし、実績報告時までにBCP（Business Continuity Plan：事業継続計画）を策定していること。）,申請手続きについて、ホームページ（下部詳細リンク先）をご覧ください。,2024/5/10 14:00,2024/6/28 23:59,,,,助成・補助金,補助金,,,https://www.support-navi.metro.tokyo.lg.jp/detail/2/9sgmW7FRlSBmGqdYf,13,東京都,2024/5/14,,,,,,,,,,,,,,,,,,,,,,,,,,,,,,,
1000000736,事業者向け,高齢者向け製品・サービスの販路開拓支援事業,都内の中小企業者等が自社で開発した高齢者向け製品等について販路開拓を促進するため、国内外の展示会等に出展等を行うための費用の一部を助成します。,・対象経費 （１）展示会等参加費（国内・海外・オンラインのいずれも可） 　　　①出展小間料　②資材費　③輸送費　④オンライン出展基本料 （２）ECサイト出店初期登録料 （３）自社webサイト制作・改修費 （４）販売促進費　※２ 　　　①印刷物制作費　②PR動画制作費　③広告費 ※２　助成対象経費のうち、（４）販売促進費 のみでの申請はできません。  ・対象額 　上限150万円、助成率2/3,(公財)東京都中小企業振興公社助成課　  電話　０３－３２５１－７８９５ ,https://www.tokyo-kosha.or.jp/support/josei/jigyo/koureisya_hanrokaitaku.html,東京都内の本店又は支店で実質的な事業活動を引き続き１年以上行っている中小企業者（会社及び個人事業主）、中小企業団体、特定非営利活動法人、一般財団法人、一般社団法人等,電子申請,2024/6/24 10:00,2024/8/19 17:00,,,,助成・補助金;成長・成熟期の支援,補助金,販路開拓,,https://www.support-navi.metro.tokyo.lg.jp/detail/2/xYw358oeX1ztsCFqh,13,東京都,2024/5/14,,,,,,,,,,,,,,,,,,,,,,,,,,,,,,,
1000000735,事業者向け,障害者向け製品等の販路開拓支援事業,都内の中小企業者等が自社で開発したパラスポーツ関連の製品や障害者向け製品等について販路開拓を促進するため、国内外の展示会等に出展等を行うための費用の一部を助成します。,・対象経費 （１）展示会等参加費（国内・海外・オンラインのいずれも可） 　　　①出展小間料　②資材費　③輸送費　④オンライン出展基本料 （２）ECサイト出店初期登録料 （３）自社webサイト制作・改修費 （４）販売促進費　※２ 　　　①印刷物制作費　②PR動画制作費　③広告費 ※２　助成対象経費のうち、（４）販売促進費 のみでの申請はできません。  ・対象額 　上限１５０万円、助成率2/3 　,(公財)東京都中小企業振興公社助成課 電話　０３－３２５１－７８９４・５ ,https://www.tokyo-kosha.or.jp/support/josei/jigyo/shogaisha.html,東京都内の本店又は支店で実質的な事業活動を引き続き１年以上行っている中小企業者（会社及び個人事業主）、中小企業団体、特定非営利活動法人、一般財団法人、一般社団法人等,電子申請または郵送,2024/6/24 10:00,2024/8/19 17:00,,,,助成・補助金;成長・成熟期の支援,補助金,販路開拓,,https://www.support-navi.metro.tokyo.lg.jp/detail/2/PwU7RHNnfvmGUMqQs,13,東京都,2024/5/14,,,,,,,,,,,,,,,,,,,,,,,,,,,,,,,
1000000734,事業者向け,地域連携型商談機会創出事業,東京都と東京商工会議所は、福島県、福島県産業振興センターと連携し、双方の中小企業のビジネスチャンスの拡大と産業の活性化につなげていくため、福島地域のものづくり企業との商談会を開催 します。 ,○日 時：令和６年７月２４日（水）１２：３０～１６：５０ ○会 場：ビッグパレットふくしま 　　　　（〒963-0115 福島県郡山市南二丁目 52 番） ○内 容： 商談会等の開催  　　　　 都内ものづくり企業と福島地域ものづくり企業との商談会(１商談２０分)  ○募 集 数：２０社程度 ○支援内容 ：宿泊費 、交通費 を所定の条件のもと東京都が負担します。 ,東京商工会議所 ビジネス交流部 電話 03-3283-7804（直通 ） ,https://myevent.tokyo-cci.or.jp/detail.php?event_kanri_id=203567,都内中小企業 ※参加要件：東京都内に事業所を有するものづくり企業で福島県内の企業との連携に意欲をもっているこ,東京商工会議所 HP よりお申し込みください。 ※定員になり次第、締め切らせていただきますので予めご了承ください。,2024/4/8 14:00,2024/5/17 17:00,,,,サービス;成長・成熟期の支援,セミナー・研修・イベント,販路開拓,,https://www.support-navi.metro.tokyo.lg.jp/detail/2/AZWutSsgXv2D21bfu,13,東京都,2024/4/8,,,,,,,,,,,,,,,,,,,,,,,,,,,,,,,
1000000733,個人向け,旧統一教会に関する相談窓口,「旧統一教会」問題や同種の問題等の相談窓口をご案内しています。,,,https://www.seisakukikaku.metro.tokyo.lg.jp/cross-efforts/liaison-meeting/consultation-service,,,,,くらし・住まい;健康・医療;高齢者・福祉;子供・教育,,相談,,,,https://www.support-navi.metro.tokyo.lg.jp/detail/1/7IlsEwdGgw8NbDoaf,,13,東京都,2024/3/25,,,,,,,,,,,,,,,,,,,,,,,,,,,,,,,
1000000732,個人向け,介護保険制度相談窓口,東京都では、都民の皆様からの介護保険のご利用に関する様々な問い合わせ等に応えるため、相談窓口を設置しています。,都民の皆様からの介護保険のご利用に関する様々な問い合わせ等に応じています。 電話受付時間： 月曜日から金曜日（土曜日・日曜日・祝日は休業） 午前９時から午前12時まで、午後1時から午後4時30分まで,介護保険制度相談専用電話　 03-5320-4597（ダイヤルイン）,https://www.fukushi.metro.tokyo.lg.jp/kourei/sodan/soudan.html,,,,,健康・医療;子供・教育,高齢者・介護,相談;情報提供,,,,https://www.support-navi.metro.tokyo.lg.jp/detail/1/hksrZ3B8eMcuKvZfg,,13,東京都,2024/3/22,,,,,,,,,,,,,,,,,,,,,,,,,,,,,,,
1000000731,両方,警視庁の相談ホットラインのご案内,サイバー犯罪相談窓口,サイバー犯罪・サイバーセキュリティ等に関する対処方法をご案内しています。,03-5805-1731　　　　　　　　　　　　　　　　　　　　　　　　　　　　　平日午前8時30分から午後5時15分まで,https://www.keishicho.metro.tokyo.lg.jp/kurashi/cyber/index.html,,,,,防災;くらし・住まい;デジタル・最新技術;インフラ・まちづくり,,相談;情報提供,サービス,情報提供・相談,,https://www.support-navi.metro.tokyo.lg.jp/detail/1/OxPejFJNimR7wLtaV,https://www.support-navi.metro.tokyo.lg.jp/detail/2/OxPejFJNimR7wLtaV,13,東京都,2024/3/22,,,,,,,,,,,,,,,,,,,,,,,,,,,,,,,
1000000730,両方,警視庁の相談ホットラインのご案内,外国人専用相談,外国人の方からの相談に対応します。,03-3503-8484　　　　　　　　　　　　　　　　　　　　　　　　　　　　　平日午前8時30分から午後5時15分まで,,,,,,くらし・住まい,,相談,サービス,情報提供・相談,,https://www.support-navi.metro.tokyo.lg.jp/detail/1/YLQtXnEC7EBHFTrib,https://www.support-navi.metro.tokyo.lg.jp/detail/2/YLQtXnEC7EBHFTrib,13,東京都,2024/3/22,,,,,,,,,,,,,,,,,,,,,,,,,,,,,,,
1000000729,両方,警視庁の相談ホットラインのご案内,交通相談コーナー,交通に関する相談,03-3593-0941　　　　　　　　　　　　　　　　　　　　　　　　　平日午前8時30分から午後5時15分まで,,,,,,くらし・住まい;インフラ・まちづくり,,相談,サービス,情報提供・相談,,https://www.support-navi.metro.tokyo.lg.jp/detail/1/vuBnkAmoPZ7SszlyS,https://www.support-navi.metro.tokyo.lg.jp/detail/2/vuBnkAmoPZ7SszlyS,13,東京都,2024/3/22,,,,,,,,,,,,,,,,,,,,,,,,,,,,,,,
1000000728,両方,警視庁の相談ホットラインのご案内,薬物・銃器ホットライン,拳銃を見た、拳銃に関する情報を知っているなどについては薬物・銃器ホットラインまで情報をお寄せください。,03-3593-7970　24時間受付　　　,https://www.keishicho.metro.tokyo.lg.jp/kurashi/drug/kenju/joho.html,,,,,防災,,相談;お知らせ,サービス,情報提供・相談;サービスその他,,https://www.support-navi.metro.tokyo.lg.jp/detail/1/j5RSn0wu8WwZApHlO,https://www.support-navi.metro.tokyo.lg.jp/detail/2/j5RSn0wu8WwZApHlO,13,東京都,2024/3/22,,,,,,,,,,,,,,,,,,,,,,,,,,,,,,,
1000000727,両方,警視庁の相談ホットラインのご案内,暴力ホットライン,暴力団から脅されている、因縁を付けられ金品を要求されている、取引に暴力団が絡んでいる、暴力団をやめたい、暴力団に入るよう勧められている、貸した部屋がいつの間にか暴力団事務所になっているなど、暴力団に関することで困っている方は暴力ホットラインへご相談ください。,03-3580-2222　24時間受付　　　,https://www.keishicho.metro.tokyo.lg.jp/sodan/madoguchi/wide/index.html,,,,,防災,,相談,サービス,情報提供・相談,,https://www.support-navi.metro.tokyo.lg.jp/detail/1/vuBnkAmoPZ7SRzlyS,https://www.support-navi.metro.tokyo.lg.jp/detail/2/vuBnkAmoPZ7SRzlyS,13,東京都,2024/3/22,,,,,,,,,,,,,,,,,,,,,,,,,,,,,,,
1000000726,両方,警視庁の相談ホットラインのご案内,行方不明者相談,家族の行方不明、震災時の行方不明者等の行方不明者届に関する相談に対応しています。,03-5281-0123　　　　　　　　　　　　　平日午前8時30分から午後5時15分まで,https://www.keishicho.metro.tokyo.lg.jp/sodan/madoguchi/missing/info.html,,,,,防災;くらし・住まい,,相談,サービス,情報提供・相談,,https://www.support-navi.metro.tokyo.lg.jp/detail/1/1SoAYj79GEe1JLT4w,https://www.support-navi.metro.tokyo.lg.jp/detail/2/1SoAYj79GEe1JLT4w,13,東京都,2024/3/22,,,,,,,,,,,,,,,,,,,,,,,,,,,,,,,
1000000725,両方,警視庁の相談ホットラインのご案内,ヤング・テレホン・コーナー,少年や保護者、その他関係者の方々から少年にかかわる相談全般をお受けいたします。希望により面談相談も可能です。希望により都内８ヵ所にある少年センターでの面談相談も可能です。,03-3580-4970　24時間受付　　　　　　　　　　　　　　　　月曜日から金曜日まで(午前8時30分から午後5時15分)は、専門の担当者(心理職および警察官)が対応します。 夜間及び土曜・日曜・祝日は、宿直の警察官が対応します。,https://www.keishicho.metro.tokyo.lg.jp/sodan/shonen/young.html,,,,,防災;くらし・住まい;子供・教育,子育て;学校教育,相談,サービス,情報提供・相談,,https://www.support-navi.metro.tokyo.lg.jp/detail/1/TCxQ2B1RLAPmMnFEy,https://www.support-navi.metro.tokyo.lg.jp/detail/2/TCxQ2B1RLAPmMnFEy,13,東京都,2024/3/22,,,,,,,,,,,,,,,,,,,,,,,,,,,,,,,
1000000724,個人向け,警視庁の相談ホットラインのご案内,犯罪被害者ホットライン,事件や事故の被害にあわれた方々やそのご家族が抱えるこころの悩みに対応しています。,03-3597-7830　　　　　　　　　　　　　　　平日午前8時30分から午後5時15分まで,,,,,,防災;健康・医療,,相談,,,,https://www.support-navi.metro.tokyo.lg.jp/detail/1/e37hSx6wRNQnmlQ2y,,13,東京都,2024/3/22,,,,,,,,,,,,,,,,,,,,,,,,,,,,,,,
1000000723,両方,警視庁の相談ホットラインのご案内,警視庁総合相談センター,相談内容に応じて専門の相談窓口等をご案内します。（東京都を管轄）　ただし、たった今「被害や交通事故に遭った」「事件・事故を目撃した」という場合には、緊急ダイヤル「１１０番」に電話してください。,電話番号  ＃9110又は03-3501-0110,,,,,,防災;くらし・住まい,,相談;お知らせ,サービス,情報提供・相談;サービスその他,,https://www.support-navi.metro.tokyo.lg.jp/detail/1/nJCLPuqayoLSQfW4G,https://www.support-navi.metro.tokyo.lg.jp/detail/2/nJCLPuqayoLSQfW4G,13,東京都,2024/3/22,,,,,,,,,,,,,,,,,,,,,,,,,,,,,,,
1000000722,両方,消防水利開発補助,補助金の目的：東京都震災対策条例第５条に基づく特別区内における消防水利施設の設置促進  ,補助対象経費：消防水利施設の設置に要する経費（消防水利施設の設置容量により上限額が異なる）,東京消防庁防災部水利課 03-3212-2111,http://www.tfd.metro.tokyo.lg.jp/hp-suirika/suiri/index.html,,,,,防災;インフラ・まちづくり,,手当・助成金等,助成・補助金;成長・成熟期の支援,補助金,設備投資,https://www.support-navi.metro.tokyo.lg.jp/detail/1/PwU7RHNnfvmG8MqQs,https://www.support-navi.metro.tokyo.lg.jp/detail/2/PwU7RHNnfvmG8MqQs,13,東京都,2024/3/22,,,,,,,,,,,,,,,,,,,,,,,,,,,,,,,
1000000721,事業者向け,労働争議の調整（あっせん）や不当労働行為の審査等の労働委員会制度、その利用方法に関する案内・相談窓口,労働組合と使用者との団体交渉がうまくいかないときや、組合員に対する不利益取扱いなど、労働組合と使用者との間のトラブルでお困りの労働組合又は使用者からのご相談に対応します。 ※その他の労働問題全般に関する相談については、労働相談情報センターで受け付けています。 ,当委員会では次のことについて相談に応じています。 ・労働争議の調整及び不当労働行為に関わる労使間の問題 ・その申請や申立ての手続 ・資格審査の申請の手続,労働委員会事務局審査調整課調整担当 電話：03-5320-6996,https://www.toroui.metro.tokyo.lg.jp/index.html,労働組合または事業者,,,,,,,サービス;成長・成熟期の支援;商業・地域・団体支援,情報提供・相談;サービスその他,雇用・人材採用;商業・地域・団体支援,,https://www.support-navi.metro.tokyo.lg.jp/detail/2/2U5aVMYMQkaW45K2o,13,東京都,2024/3/22,,,,,,,,,,,,,,,,,,,,,,,,,,,,,,,
1000000720,個人向け,身体が不自由な人の投票について,選挙の際に障害のある方が円滑に投票することができるよう、東京都選挙管理委員会ホームページにおいて、投票方法や投票所に設置している備品等を案内しています。,以下の事項について案内しています。 ・代理投票 ・点字投票 ・郵便等による不在者投票 ・身体が不自由な方のために投票所に設置している備品等,東京都選挙管理委員会事務局 電話：03－5000－7259,https://www.senkyo.metro.tokyo.lg.jp/qa/qa-touhyou-2/,,,,,高齢者・福祉;行財政,,情報提供,,,,https://www.support-navi.metro.tokyo.lg.jp/detail/1/qaSpN23YMQtyo15ew,,13,東京都,2024/3/22,,,,,,,,,,,,,,,,,,,,,,,,,,,,,,,
1000000719,個人向け,江戸・東京デジタルミュージアム,都立中央図書館特別文庫室で所蔵する江戸・東京に関する貴重資料を通して、江戸・東京の歴史や文化に楽しみながら触れていただくウェブサイト。掲載している画像はオープンデータとして自由に利用可能。,都立図書館HPで公開。特別文庫室所蔵の浮世絵や古地図、番付などの貴重資料を、娯楽、ファッション、グルメ、町づくり、教育など、様々なテーマに沿って画像と解説で紹介しています。,特別文庫担当 03-3442-8451,https://www.library.metro.tokyo.lg.jp/portals/0/edo/tokyo_library/index.html,,,,,文化・芸術,,情報提供,,,,https://www.support-navi.metro.tokyo.lg.jp/detail/1/lh90AeiYQWdRgGxEf,,13,東京都,2024/3/22,,,,,,,,,,,,,,,,,,,,,,,,,,,,,,,
1000000718,個人向け,視覚障害者等サービス,視覚障害者等の都民の読書支援のための様々なサービスを実施している。,視覚障害者等の方が利用しやすい録音図書、点字図書の貸出（来館・郵送）、資料製作、来館（オンラインを含む）での所蔵資料の音訳サービス等を実施。,視覚障害者等サービス担当 電話：03-3442-8451,https://www.library.metro.tokyo.lg.jp/assist/,東京都内に在住、通勤又は通学視覚障害者等。,来館、電話、メールにより登録申込書（必要により利用登録確認項目リスト）を提出する。,,,高齢者・福祉;文化・芸術,,人的支援・その他サービス;施設,,,,https://www.support-navi.metro.tokyo.lg.jp/detail/1/V1JfxDXFi5Xk8mTC0,,13,東京都,2024/3/22,,,,,,,,,,,,,,,,,,,,,,,,,,,,,,,
1000000717,個人向け,東京都立図書館デジタルアーカイブ(TOKYOアーカイブ）,都立図書館がデジタル化した、江戸・東京関係資料の画像を検索・閲覧できるデータベース。ダウンロードした画像はオープンデータとして自由に利用可能（一部の画像を除く）。,都立図書館HPで公開。,都市・東京情報担当 電話：03-3442-8451,https://archive.library.metro.tokyo.lg.jp/da/top,,,,,文化・芸術,,情報提供,,,,https://www.support-navi.metro.tokyo.lg.jp/detail/1/JoN6wGagkGV31EyD1,,13,東京都,2024/3/22,,,,,,,,,,,,,,,,,,,,,,,,,,,,,,,
1000000716,個人向け,東京マガジンバンクカレッジ,"東京都立多摩図書館は、「東京マガジンバンク」として、約19,000タイトルの雑誌を所蔵し、雑誌の特性を活かしたサービスを実施しています。 豊富な所蔵雑誌を活用し、学びと交流の拠点を作り上げることを目指す「東京マガジンバンクカレッジ」という取組を行っています。",講演会やワークショップ等を実施しています。 内容や日程等については東京都立図書館ホームページでお知らせします。 https://www.library.metro.tokyo.lg.jp/,東京都立多摩図書館　情報サービス担当 電話：042-359-4020,https://www.library.metro.tokyo.lg.jp/search/research_guide/magazinebank/college/index.html,,,,,子供・教育;文化・芸術,,教室・講習会;イベント;施設;情報提供,,,,https://www.support-navi.metro.tokyo.lg.jp/detail/1/lh90AeiYQWdRTGxEf,,13,東京都,2024/3/22,,,,,,,,,,,,,,,,,,,,,,,,,,,,,,,
1000000715,個人向け,都立学校開放事業,東京都教育委員会では、学校教育上支障のない限り、都立学校を広く開放し、都民の学習・文化・スポーツ活動の振興に資するとともに、地域に開かれた学校づくりを促進するため、都立学校の教育機能と施設を開放することを目的として「都立学校開放事業」を実施しています。,①都立学校公開講座 　都立学校が有する人材・施設設備・教材等の教育機能を開放し、都民に学習機会を提供する事業として、実施しています。 ②都立学校施設開放 　都立学校の施設をスポーツ活動や学習・文化活動等の場として提供し、都民の利用に供する事業として、実施しています。,教育庁地域教育支援部生涯学習課学校支援担当 電話：03-5320-6857,https://www.syougai.metro.tokyo.lg.jp/sesaku/kaihou/index.html,①都立学校公開講座 　都内在住・在勤の成人 　講座の内容により都内在住・在学の児童・生徒 ②都立学校施設開放 　ご利用にあたっては、団体登録が必要となります。登録の要件等は詳細リンク先からご確認ください。,詳細リンク先からご確認ください。,,,子供・教育;スポーツ;文化・芸術,学校教育,施設,,,,https://www.support-navi.metro.tokyo.lg.jp/detail/1/m2jqKsxOj85rI3R1c,,13,東京都,2024/3/22,,,,,,,,,,,,,,,,,,,,,,,,,,,,,,,
1000000714,個人向け,東京都立学校等給付型奨学金（特別支援学校）,家庭の経済状況にかかわらず、生徒が希望する進路に挑戦できるよう、生徒が学校の多様な教育活動に参加するために必要な経費を、現物給付により支援します。  ,"① 生活保護受給世帯及び非課税世帯、並びに、区市町村民税所得割額及び都道府県民税所得割額の合算額が非課税の世帯 　　給付限度額　50,000円 ② 区市町村民税所得割額及び都道府県民税所得割額の合算が85,500円未満の世帯　（①以外） 　　給付限度額　30,000円",教育庁都立学校教育部特別支援教育課 電話：03-5320-6754,https://www.kyoiku.metro.tokyo.lg.jp/admission/tuition/tuition/non-refundable_scholarship.html,"次のいずれかに該当する生徒 ・生活保護受給世帯並びに住民税所得割が非課税の世帯、家計急変により住民税所得割額が非課税相当となる世帯であること ・住民税の所得割額の合算が85,500円未満の世帯、家計急変により住民税所得割額の合算が85,500円未満相当となる世帯であること",詳細リンク先からご確認ください。,,,高齢者・福祉;子供・教育,学校教育,手当・助成金等,,,,https://www.support-navi.metro.tokyo.lg.jp/detail/1/HTOwmiVD5K4kytRQA,,13,東京都,2024/3/22,,,,,,,,,,,,,,,,,,,,,,,,,,,,,,,
1000000713,個人向け,高等学校等学び直し支援金（特別支援学校）,高等学校等を中途退学した後、「学び直し」のため、都立特別支援学校高等部に再び入学した生徒を対象に、授業料の支援を行います。,高等学校等を中途退学した後、「学び直し」のため、都立特別支援学校高等部に再び入学した生徒を対象に、一定の条件のもと、就学支援金の支給期間経過後も最大12か月にわたり、授業料相当額として高等学校等学び直し支援金を支給します。  ※支給される学び直し支援金は、在学する学校が、生徒本人に代わり生徒の授業料として受け取ります。,教育庁都立学校教育部特別支援教育課 電話：03-5320-6754,,"都立特別支援学校高等部に在学し、次のすべてにあてはまる方 ・日本国内に住所を有する者 ・保護者等の区市町村民税の「課税標準額（課税所得額）」×6％ － 区市町村民税の「調整控除の額」（親権を行う父母の合算額）が30万4,200円未満の者 ・高等学校等を卒業又は修了していない者 ・平成26年4月1日以降に高等学校等に入学した者であり、かつ、高等学校等を中途退学したことがある者 ・36月を超えて在学する者 ・在学期間が48月を超えない者",,,,子供・教育,学校教育,手当・助成金等,,,,https://www.support-navi.metro.tokyo.lg.jp/detail/1/wQeIqTfpWIexHJ9IZ,,13,東京都,2024/3/22,,,,,,,,,,,,,,,,,,,,,,,,,,,,,,,
