1000000378,事業者向け,下請取引等の相談,専門相談員や弁護士が企業間の取引の無料相談及び調停・あっせんを行い、取引上の問題を解決するとともに、講習会を開催します。,①苦情紛争処理（相談対応、調停・あっせん） ②下請法講習会の実施,（公財）東京都中小企業振興公社　下請センター東京　03-3251-9390 下請センター東京　多摩支援室　042-500-3909,https://www.tokyo-kosha.or.jp/support/shitauke/soudan/index.html,,,,,,,,サービス;成長・成熟期の支援,専門家派遣;セミナー・研修・イベント;情報提供・相談,事業計画・経営企画;人材育成・教育・研修,,https://www.support-navi.metro.tokyo.lg.jp/detail/2/4mDRB9O6sVf4WlLDe,13,東京都,2024/3/22,,,,,,,,,,,,,,,,,,,,,,,,,,,,,,,
1000000377,事業者向け,飲食事業者向け経営基盤強化支援事業,早期に経営基盤の安定化を図り、収益の確保や安定的な集客につなげていく取組を支援します。,専門家派遣及び助成金支援,飲食事業者向け経営基盤強化支援事業　事務局　03-5822-7246,https://www.tokyo-kosha.or.jp/support/josei/jigyo/inshoku-kyoka.html,,,,,,,,助成・補助金;サービス;成長・成熟期の支援,給付・助成;専門家派遣,設備投資;販路開拓,,https://www.support-navi.metro.tokyo.lg.jp/detail/2/g04jvlHmDu3rsJlK3,13,東京都,2024/3/22,,,,,,,,,,,,,,,,,,,,,,,,,,,,,,,
1000000376,事業者向け,明日にチャレンジ中小企業基盤強化事業,下請中小企業が行う技術・サービスの高度化・高付加価値化に向けた技術開発等に要する経費の一部を助成します。,明日にチャレンジ中小企業基盤強化事業助成金,東京都中小企業団体中央会　支援事務局　03-6278-7936,https://www.tokyochuokai.or.jp/sienseido/jyoseijigyou/asuchare.html,,,,,,,,助成・補助金;成長・成熟期の支援,給付・助成,研究開発;知的財産管理,,https://www.support-navi.metro.tokyo.lg.jp/detail/2/WyvKcE0jeVxNIr4DG,13,東京都,2024/3/22,,,,,,,,,,,,,,,,,,,,,,,,,,,,,,,
1000000375,事業者向け,中小企業人的資本経営支援事業,「人的資本経営」を推進するため、普及啓発セミナーやワークショップの開催、推進人材の育成及び情報発信を実施しています。,（１）普及啓発セミナー （２）ワークショップ （３）経営人財育成スクールNEXT 　①入門コース　募集企業数40社、受講料１万円 　②組織マネジメントコース 　　・ベーシック　募集企業数20社、受講料２万円 　　・アドバンス　募集企業数20社、受講料２万円 　③新規事業開発コース 　　・ベーシック　募集企業数20社、受講料２万円 　　・アドバンス　募集企業数20社、受講料２万円 （４）情報発信・交流,（公財）東京都中小企業振興公社　企業人材支援課　03-3251-7904,https://www.tokyo-kosha.or.jp/support/shien/jinteki_shihon/index.html,,,,,,,,サービス;成長・成熟期の支援,セミナー・研修・イベント;情報提供・相談,人材育成・教育・研修,,https://www.support-navi.metro.tokyo.lg.jp/detail/2/m2jqKsxOj85aE3R1c,13,東京都,2024/3/22,,,,,,,,,,,,,,,,,,,,,,,,,,,,,,,
1000000374,事業者向け,経営革新計画の申請,新事業に取り組み経営の向上を図る経営計画書を都が承認。経営目標が明確になり、承認企業には低利融資等の支援策も用意しております。,○フォローアップ支援（専門家派遣）  ○東京都中小企業制度融資  ○日本政策金融公庫の特別利率による融資制度 ○信用保証の特例 ○海外展開事業者への支援制度 ○中小企業投資育成株式会社からの投資　など,（申請書の提出について） （公財）東京都中小企業振興公社　総合支援課　03-3251-7881 東京商工会議所　中小企業相談センター　03-3283-7700 東京都商工会連合会　経営革新室　042-500-3886 商工部　経営支援課　03-5320-4784 （制度全般について） 商工部　経営支援課　03-5320-4795,https://www.sangyo-rodo.metro.tokyo.lg.jp/chushou/shoko/keiei/kakushin/,,,,,,,,金融;規制・許認可;成長・成熟期の支援,貸付（融資）;信用保証;免除・猶予,事業計画・経営企画;海外展開,,https://www.support-navi.metro.tokyo.lg.jp/detail/2/cFkOgbuQAm385aMk2,13,東京都,2024/3/22,,,,,,,,,,,,,,,,,,,,,,,,,,,,,,,
1000000373,事業者向け,ワンストップ総合相談窓口,経営・金融、法律、ＩＴ関連、税務、悪質クレーム対応等の様々な分野の相談に経験豊富な専門家が無料で対応します。,相談対応,（公財）東京都中小企業振興公社　　　　同　総合支援課　03-3251-7881　　　　　　　　　　　　　　　　　　　同　城東支社　03-5680-4631　　　　　　　　　　　　　　　　　　　同　城南支社　03-3733-6248 同　多摩支社　042-500-3901,https://www.tokyo-kosha.or.jp/support/shien/soudan/index.html,,,,,,,,サービス;成長・成熟期の支援;転換期の支援,情報提供・相談,事業計画・経営企画;販路開拓;海外展開;雇用・人材採用;人材育成・教育・研修;知的財産管理;社会保障・福利厚生;事業再生;事業承継,,https://www.support-navi.metro.tokyo.lg.jp/detail/2/IchMpQvctfNUdB29K,13,東京都,2024/3/22,,,,,,,,,,,,,,,,,,,,,,,,,,,,,,,
1000000372,個人向け,腎移植にかかる組織適合検査補助,補助金の目的：腎移植を推進し、患者の負担軽減を図る。  ,補助対象経費：腎臓移植組織適合性検査費 負担割合　　：都10/10,保健医療局保健政策部疾病対策課 03-5320-4506,https://www.hokeniryo.metro.tokyo.lg.jp/kenkou/k_isyoku/annai.html,献腎移植を希望し、（公社）日本臓器移植ネットワークに移植希望の登録をする方,詳細はリンクからご確認ください。,,,健康・医療,,手当・助成金等,,,,https://www.support-navi.metro.tokyo.lg.jp/detail/1/NfLdeVzxHFnk7Xtjs,,13,東京都,2024/3/22,,,,,,,,,,,,,,,,,,,,,,,,,,,,,,,
1000000371,個人向け,肝炎初回精密検査費用助成・肝炎定期検査費用助成,補助金の目的：ウイルス性肝炎の重症化予防を図る。  ,補助対象経費：検査費用（一部自己負担あり） 負担割合　　：国1/2、都1/2,保健医療局保健政策部疾病対策課 03-5320-4476,https://www.hokeniryo.metro.tokyo.lg.jp/kenkou/kenkou/kanen_senryaku/kanen_kensahiyou_josei.html,【初回精密検査】肝炎ウイルス検査で陽性と判定された方　【定期検査】肝炎ウイルスによる慢性肝疾患で療養中の方（各検査とも要綱に詳細な規定あり）,,,,健康・医療,妊娠・出産,手当・助成金等,,,,https://www.support-navi.metro.tokyo.lg.jp/detail/1/uGKJHZ21iVznuYTy7,,13,東京都,2024/3/22,,,,,,,,,,,,,,,,,,,,,,,,,,,,,,,
1000000370,両方,在宅人工呼吸器使用難病患者非常用電源設備整備事業補助金,停電時等における難病患者の安全確保を図るため、人工呼吸療法を実施する医療機関に対し、在宅で人工呼吸器を使用する難病患者さんに無償で貸与するための非常用電源の購入経費を補助します。,"医療機関が非常用電源の購入する際の費用を、以下の金額を上限に補助します。 ・自家発電装置　　 212,000円 ・無停電電源装置　   41,100円 ・蓄電池                     104,000円 ※自家発電装置と蓄電池は、どちらか一方を選んでご申請ください。 ※千円未満の端数は切り捨てとなります。 ",保健医療局保健政策部疾病対策課在宅難病事業担当 電話番号：03-5320-4477,https://www.hokeniryo.metro.tokyo.lg.jp/kenkou/nanbyo/portal/service/zaitaku/dengen.html,在宅人工呼吸器使用難病患者 ※原則常時人工呼吸器を使用している方,医療機関が東京都に申請書類を提出する。 ※詳細はリンク先からご確認ください。,,,健康・医療;高齢者・福祉,高齢者・介護,手当・助成金等,助成・補助金;成長・成熟期の支援,補助金,設備投資,https://www.support-navi.metro.tokyo.lg.jp/detail/1/EpAybqhZUPzcTxlYn,https://www.support-navi.metro.tokyo.lg.jp/detail/2/EpAybqhZUPzcTxlYn,13,東京都,2024/3/22,,,,,,,,,,,,,,,,,,,,,,,,,,,,,,,
1000000369,事業者向け,受動喫煙防止対策支援補助金,補助金の目的：都内中小・個人規模の飲食店の受動喫煙防止対策に係る環境の整備を支援する。  ,補助対象経費：事業の実施に必要な経費 負担割合　　：都（客席面積により）2/3または9/10、事業者（客席面積により）1/3または1/10,保健医療局保健政策部健康推進課 03-5320-4361,https://www.hokeniryo.metro.tokyo.lg.jp/kensui/kitsuen/insyokutentaisaku/insyokutenhojo/index.html,飲食施設の運営事業者（要綱にて詳細な規定あり）,,,,,,,助成・補助金;成長・成熟期の支援,補助金,設備投資,,https://www.support-navi.metro.tokyo.lg.jp/detail/2/dvi8hf4QJGy5vw94C,13,東京都,2024/3/22,,,,,,,,,,,,,,,,,,,,,,,,,,,,,,,
1000000368,事業者向け,東京都地域自殺対策強化補助事業補助金等,補助金の目的：民間団体が実施する自殺対策強化事業について財政支援を行うことにより、地域における更なる自殺対策の強化を図る。  ,補助対象経費： 地域における自殺対策の強化に資する効果的な取組に係る経費 負担割合　　：国1/2～10/10、民間団体0～1/2　※新型コロナに対応した自殺防止対策事業は、国3/4、都1/4,保健医療局保健政策部健康推進課 03-5320-4310,https://www.hokeniryo.metro.tokyo.lg.jp/kenkou/tokyokaigi/minkandantai.html,民間団体,,,,,,,助成・補助金;成長・成熟期の支援;商業・地域・団体支援,補助金,設備投資;人材育成・教育・研修;商業・地域・団体支援,,https://www.support-navi.metro.tokyo.lg.jp/detail/2/X7a9oPbHuN2m2bvCS,13,東京都,2024/3/22,,,,,,,,,,,,,,,,,,,,,,,,,,,,,,,
1000000366,個人向け,東京都医療安全支援センター　「患者の声相談窓口」,患者や住民からの、医療に関する相談や苦情に対応しています。,・患者さんや都民と病院（２０床以上の病床を有する医療機関）等との信頼関係の構築を支援するようにします。 ・患者さんや都民と医療従事者や病院等の間にあって、中立的な立場から問題解決に向けた双方の取組みを支援するようにします。 ・患者・都民と病院等の双方から信頼されるようにします。 ・相談者のプライバシーを保護し、相談により相談者が不利益を被ることがないように配慮し、安心して相談できるようにします。 ・ご相談は匿名でも受けています。,患者の声相談窓口 電話：03-5320-4435,https://www.hokeniryo.metro.tokyo.lg.jp/iryo/sodan/madoguchi.html,,・医療行為における過失や因果関係の有無、責任の所在の判断・決定は行いません。 ・医療機関との紛争の仲介や調停は行いません。 ・現在の症状に関する診断はできません。,,,健康・医療,,相談;施設,,,,https://www.support-navi.metro.tokyo.lg.jp/detail/1/CNYbUKSgewMzmrHvs,,13,東京都,2024/3/22,,,,,,,,,,,,,,,,,,,,,,,,,,,,,,,
1000000365,両方,ホームページ「東京都がんポータルサイト」の運営,がん患者・家族の医療機関の選択や療養上の悩みの解決、がんに対する理解の促進に役立つよう、がんに関する各種の情報を集約し、分かりやすい形で提供しています。 　,本サイトでは、がんに関する様々な情報を掲載しています。 (例) ・がんに関する基礎的な情報 ・がんに関する公開講座等の情報 ・がん医療に関する情報 ・社会保障制度などの公的な支援制度の情報 ・緩和ケアに関する情報　　 ・がん相談に関する情報 ・各種関連サイト等とのリンク,保健医療局医療政策部医療政策課,https://www.hokeniryo.metro.tokyo.lg.jp/iryo/iryo_hoken/gan_portal/index.html,,,,,健康・医療,,教室・講習会;相談;情報提供,サービス;成長・成熟期の支援,情報提供・相談,社会保障・福利厚生,https://www.support-navi.metro.tokyo.lg.jp/detail/1/9sgmW7FRlSBaxqdYf,https://www.support-navi.metro.tokyo.lg.jp/detail/2/9sgmW7FRlSBaxqdYf,13,東京都,2024/3/22,,,,,,,,,,,,,,,,,,,,,,,,,,,,,,,
1000000364,個人向け,肝疾患相談センター,東京都では、虎の門病院・武蔵野赤十字病院を東京都肝疾患診療連携拠点病院として指定し、肝疾患相談センターの設置など、患者や市民、医療従事者を対象とした講演会や研修会の開催をはじめ、肝疾患に関する総合的な相談支援を行っています。,肝炎患者さんやご家族の方、医療従事者の方からの肝疾患に関する電話又は面談による相談に対応しています（面談は予約制です）。また、肝臓病教室や講演会なども開催しています。,【国家公務員共済組合連合会虎の門病院】03-3560-7672 【武蔵野赤十字病院】0422-32-3135 ※いずれも、平日9時30分から16時まで,https://www.hokeniryo.metro.tokyo.lg.jp/kenkou/kenkou/kanen_senryaku/kanshikkan_soudancenter.html,,,,,健康・医療;子供・教育,,教室・講習会;相談;施設;情報提供,,,,https://www.support-navi.metro.tokyo.lg.jp/detail/1/xYw358oeX1zMICFqh,,13,東京都,2024/3/22,,,,,,,,,,,,,,,,,,,,,,,,,,,,,,,
1000000363,個人向け,東京都難病ポータルサイト,難病医療費助成制度に関する情報や、難病患者さんの療養支援についての情報などを掲載しているホームページです。,難病医療費助成の対象疾病や助成内容、申請手続について掲載しているほか、指定医及び、指定医療機関の一覧から、難病指定医、指定医療機関の指定状況を確認できます。また、難病患者の方が利用できるサービスや、日常生活における相談・就労支援などの問合せ先を掲載しています。,東京都保健医療局保健政策部疾病対策課疾病対策担当 電話番号：03-5320-4471,https://www.hokeniryo.metro.tokyo.lg.jp/kenkou/nanbyo/portal/index.html,,,,,くらし・住まい;健康・医療;高齢者・福祉;産業・仕事,,情報提供,,,,https://www.support-navi.metro.tokyo.lg.jp/detail/1/PwU7RHNnfvmF9MqQs,,13,東京都,2024/3/22,,,,,,,,,,,,,,,,,,,,,,,,,,,,,,,
1000000362,個人向け,ほっとけないぞ！CKD,慢性腎臓病（CKD）についての情報を掲載したホームページで、CKDの概要などを掲載しています。,CKDの概要や、ステージに応じた専門家によるアドバイスを掲載しているほか、血液検査の結果を入力することで腎機能の状態（CKDのステージ）を調べることができます。,東京都保健医療局保健政策部疾病対策課疾病対策推進担当 電話番号：03-5320-4476,https://www.hokeniryo.metro.tokyo.lg.jp/shippei/ckd/,,,,,健康・医療,,情報提供,,,,https://www.support-navi.metro.tokyo.lg.jp/detail/1/AZWutSsgXv2Rk1bfu,,13,東京都,2024/3/22,,,,,,,,,,,,,,,,,,,,,,,,,,,,,,,
1000000361,個人向け,気軽に実践！　健康づくり応援ガイド,日常生活のなかで「今、できること」から取り組める健康づくりについて紹介しています。,日常生活のなかで「今、できること」から取り組める運動・食生活などの健康づくりを紹介し、都民の健康づくりを支援しています。,保健医療局保健政策部健康推進課健康推進担当 電話：03-5320-4356,https://www.hokeniryo.metro.tokyo.lg.jp/kensui/territory2/kenkoudukuri/index.html,【対象】 都内在住または在勤の方、都内事業者,URLからサイトをご覧ください。,,,健康・医療;スポーツ,,情報提供,,,,https://www.support-navi.metro.tokyo.lg.jp/detail/1/7IlsEwdGgw8ocDoaf,,13,東京都,2024/3/22,,,,,,,,,,,,,,,,,,,,,,,,,,,,,,,
1000000360,個人向け,TOKYO 　WALKING　MAP,都民の方が楽しみながら健康づくりに取り組めるよう、都内区市町村等が作成したウォーキングマップを紹介しています。自分に合ったウォーキングコースを手軽に検索でき、Googleマップでルートを確認できるのが特徴です。,健康づくりのために大切な運動の中でも手軽で取り組みやすいウォーキングを促進するため、都内のウォーキングコースを紹介することで、都民の健康づくりを支援しています。,保健医療局保健政策部健康推進課健康推進担当 電話：03-5320-4356,https://www.hokeniryo.metro.tokyo.lg.jp/walkmap/,【対象】 都内在住または在勤の方、都内事業者,URLからサイトをご覧ください。,,,健康・医療;スポーツ,,情報提供,,,,https://www.support-navi.metro.tokyo.lg.jp/detail/1/hksrZ3B8eMcWqvZfg,,13,東京都,2024/3/22,,,,,,,,,,,,,,,,,,,,,,,,,,,,,,,
1000000359,個人向け,TOKYO♯女子けんこう部,女性特有の病気や、女性が健康に過ごすために知っておきたいことをマンガで手軽に学べるサイトです。,女性の健康を支援するポータルサイトです。女性特有の病気や、女性が健康に過ごすために知っておきたいことを掲載しています。,保健医療局保健政策部健康推進課 電話番号：03-5320-4367,https://www.hokeniryo.metro.tokyo.lg.jp/joshi-kenkobu/,主に20歳以上の女性,URLからサイトをご覧ください。,,,健康・医療;スポーツ,,情報提供,,,,https://www.support-navi.metro.tokyo.lg.jp/detail/1/OxPejFJNimRSFLtaV,,13,東京都,2024/3/22,,,,,,,,,,,,,,,,,,,,,,,,,,,,,,,
1000000358,個人向け,とうきょう健康ステーション,とうきょう健康ステーションでは、都民の健康づくりに役立つ情報を配信しています。,がん検診、生活習慣病や、身体活動や食生活等の生活習慣改善など、都民の健康づくりを支援する情報を提供しています。,保健医療局保健政策部健康推進課健康推進担当 電話：03-5320-4356,https://www.hokeniryo.metro.tokyo.lg.jp/kensui/,【対象】 都内在住または在勤の方、都内事業者,URLからサイトをご覧ください。,,,健康・医療,,情報提供,,,,https://www.support-navi.metro.tokyo.lg.jp/detail/1/YLQtXnEC7EBlqTrib,,13,東京都,2024/3/22,,,,,,,,,,,,,,,,,,,,,,,,,,,,,,,
1000000357,個人向け,東京都立看護専門学校一日体験入学,　都立看護専門学校において、高校生及び社会人を対象に、看護に関する体験学習、施設見学及び懇談会を行い、看護に対する理解と関心を深めるとともに、将来の進路決定の参考となる機会を提供します。,各都立看護専門学校において、看護週間前後に一日体験入学をを実施します。 ※「看護の日・看護週間」：フローレンス・ナイチンゲールの誕生日にちなみ、旧厚生省が5月12日を「看護の日」とし、その日を含む週の日曜日～土曜日前後の一週間を「看護週間」としています。,保健医療局医療政策部医療人材課 03-5320-4447,https://www.hokeniryo.metro.tokyo.lg.jp/joho/soshiki/isei/ijin/oshirase/ichinichitaiken.html,個人向け,詳細リンク先からご確認ください。,,,健康・医療;子供・教育,学校教育,教室・講習会,,,,https://www.support-navi.metro.tokyo.lg.jp/detail/1/vuBnkAmoPZ7UczlyS,,13,東京都,2024/3/22,,,,,,,,,,,,,,,,,,,,,,,,,,,,,,,
1000000356,個人向け,医療機関・薬局案内サービス,都内の医療機関の情報について、コンピュータによる音声自動応答、案内員による案内を行っています。また、都民からの保健医療福祉に関する相談や問い合わせに相談員が応じています。,【医療機関案内】 電話：03-5272-0303 ﾌｧｸｼﾐﾘ：03-5285-8080（聴覚・言語障害者専用） 毎日　24時間 【保健医療福祉相談】 電話：03-5272-0303 月～金　9:00~20:00（祝日、12/29~1/3を除く）,保健医療局医療政策部医療政策課東京都保健医療情報センター 電話：03-5272-1801,https://www.hokeniryo.metro.tokyo.lg.jp/iryo/sodan/komatta/nearby_doc.html,,,,,健康・医療,,相談;情報提供,,,,https://www.support-navi.metro.tokyo.lg.jp/detail/1/j5RSn0wu8WwehpHlO,,13,東京都,2024/3/22,,,,,,,,,,,,,,,,,,,,,,,,,,,,,,,
1000000355,個人向け,外国語による医療情報サービス,外国人向けに、外国語で対応する医療機関や日本の医療制度等について、5か国語（英語・中国語・韓国語・タイ語・スペイン語）で案内しています。,【相談先】 電話：03-5285-8181  毎日　 9:00-20:00 【利用料】 無料,保健医療局医療政策部医療政策課東京都保健医療情報センター 電話：03-5272-1801,https://www.hokeniryo.metro.tokyo.lg.jp/iryo/iryo_hoken/gaikokujin/interpreter/himawari.html,【対象】 都内在住外国人、外国人旅行者,,,,健康・医療,,相談,,,,https://www.support-navi.metro.tokyo.lg.jp/detail/1/vuBnkAmoPZ7UhzlyS,,13,東京都,2024/3/22,,,,,,,,,,,,,,,,,,,,,,,,,,,,,,,
1000000354,個人向け,ホームページ「東京都こども医療ガイド」の運営,育児経験の少ない親御さんをターゲットに、誰もが気軽に利用できる親しみやすいイラストを用いて子育てに際して直面する様々な健康上の問題についてのアドバイスや乳幼児の健康、医療に関する情報提供を行います。,「子供が熱を出した」「夜泣きがひどい」等、子育てに際して直面するさまざまな健康上の問題について、アドバイスを行い、育児経験の少ない親御さんの子育てを支援します。,保健医療局医療政策部医療政策課医療改革推進担当 電話：03-5320-4448,https://www.guide.metro.tokyo.lg.jp,,,,,健康・医療;子供・教育,妊娠・出産;子育て,情報提供,,,,https://www.support-navi.metro.tokyo.lg.jp/detail/1/1SoAYj79GEeOMLT4w,,13,東京都,2024/3/22,,,,,,,,,,,,,,,,,,,,,,,,,,,,,,,
1000000353,個人向け,ホームページ「知って安心暮らしの中の医療情報ナビ」の運営,都民の皆様にご自身や家族が患者になった時の為に、医療の仕組みや医療保険などの知っておきたい情報をご案内します。,身近で起こり得る突然の事例をもとに物語が進み、それぞれの場面で必要となる医療に関する知識をご提供します。,保健医療局医療政策部医療政策課医療改革推進担当 電話：03-5320-4448,https://www.hokeniryo.metro.tokyo.lg.jp/inavi/,,,,,健康・医療;高齢者・福祉;子供・教育,子育て;高齢者・介護,情報提供,,,,https://www.support-navi.metro.tokyo.lg.jp/detail/1/TCxQ2B1RLAPGVnFEy,,13,東京都,2024/3/22,,,,,,,,,,,,,,,,,,,,,,,,,,,,,,,
1000000352,両方,新型コロナ保健医療情報ポータル,新型コロナウイルス感染症に対して、保健医療施策に関する情報を掲載しています。,感染の状況に関するデータや相談窓口等を掲載しています。,保健医療局感染症対策部計画課 ※各事業のお問い合わせは、個別ページの担当課へお問い合わせください。,https://www.hokeniryo.metro.tokyo.lg.jp/kansen/corona_portal/index.html,,,,,防災;新型コロナ;健康・医療,,情報提供,サービス,情報提供・相談,,https://www.support-navi.metro.tokyo.lg.jp/detail/1/e37hSx6wRNQqZlQ2y,https://www.support-navi.metro.tokyo.lg.jp/detail/2/e37hSx6wRNQqZlQ2y,13,東京都,2024/3/22,,,,,,,,,,,,,,,,,,,,,,,,,,,,,,,
1000000349,事業者向け,感染管理認定看護師等資格取得支援事業補助金,感染管理認定看護師等資格取得を支援するため、資格取得にかかる経費を補助します。  ,補助対象経費：資格取得にかかる経費 負担割合　　：都3/4、事業者1/4,保健医療局感染症対策部医療体制整備第一課 03-5320-4332,https://www.hokeniryo.metro.tokyo.lg.jp/kansen/corona_portal/iryokikan/kansenkanri.html,,,,,,,,助成・補助金;成長・成熟期の支援,補助金,人材育成・教育・研修,,https://www.support-navi.metro.tokyo.lg.jp/detail/2/2U5aVMYMQkaf05K2o,13,東京都,2024/3/22,,,,,,,,,,,,,,,,,,,,,,,,,,,,,,,
