1000000163,個人向け,自立相談支援機関（生活困窮者自立支援制度）,経済的に困窮し、最低限度の生活を維持することができなくなるおそれのある方に対して、自立の促進を図ることを目的として、個々の状況に応じた支援を行います。,各区市（町村部については東京都）が実施主体となり、自立相談支援機関において策定される自立支援計画に基づき、各種支援が行われます。 複合的な課題を抱える生活困窮者を幅広く受け止め、包括的な相談支援を行う自立相談支援事業（必須事業）と、本人の状況に応じた支援を行う各支援事業（任意事業）があります。  ＜必須事業＞ 1.自立相談支援事業 就労その他の自立に関する相談支援、自立に向けた支援計画の作成等を実施します。 2.住居確保給付金の支給 離職?廃業から2年以内の?または休業等により収?が減少し、離職?廃業と同程度の状況にある?で住居を失った場合や住居を失うおそれのある場合に、就職に向けた活動をすることなどを条件に、?定期間家賃相当額を?給します。  ＜任意事業＞ 1.就労準備支援事業 一般就労に必要な訓練を、日常生活自立、社会生活自立段階から有期で実施します。 2.一時生活支援事業 住居のない方に対して、一定期間、宿泊場所や衣食の提供等を行います。 3.家計改善支援事業 家計状況の把握や家計改善に向けた意欲の向上を図る支援、貸付けのあっせん等を行います。 4.子どもの学習・生活支援事業 生活困窮世帯の子どもに対して、学習支援や保護者への進学助言、生活習慣や育成環境の改善に関する助言等を行います。  ※任意事業の実施状況については、自治体によって異なります。各区市の実施状況については、東京都福祉局のページでご確認ください。,各自立相談支援機関 https://www.fukushi.metro.tokyo.lg.jp/seikatsu/seikatsukonnkyuu/jiritsu.files/R5madoguchiichiran.pdf,https://www.fukushi.metro.tokyo.lg.jp/seikatsu/seikatsukonnkyuu/jiritsu.html,就労の状況、心身の状況、地域社会との関係性その他の事情により、現に経済的に困窮し、最低限度の生活を維持することができなくなるおそれのある方,お住まいの地域の自立相談支援機関へお問い合わせください。,,,くらし・住まい;高齢者・福祉,,手当・助成金等;相談,,,,https://www.support-navi.metro.tokyo.lg.jp/detail/1/2U5aVMYMQkaXy5K2o,,13,東京都,2024/3/22,,,,,,,,,,,,,,,,,,,,,,,,,,,,,,,
1000000162,個人向け,生活保護,生活保護は、資産や働く能力などのすべてを活用しても、なお生活ができない場合に、その困窮の程度に応じて援助を行う制度です。憲法25条の「すべて国民は、健康で文化的な最低限度の生活を営む権利を有する」という理念に基づき最低限度の生活を保障する制度であり、生活保護を受けることは国民の権利です。,・生活保護は、生活扶助とその他の扶助（教育・住宅・医療・介護・出産・生業・葬祭）に分かれており、保護を受ける人の世帯構成や収入などの状況に応じて、その全部または一部が適用されます。 ・保護費は、世帯全員の収入（給料、仕送り、年金など）と国が定める基準によって算出された最低生活費を比較して、収入が最低生活費を下回る場合に、その不足分が支給されます。 ※生活保護の申請については、お住まいの地域または現在地を管轄する福祉事務所にためらわずにご相談ください。 ,各福祉事務所 https://www.fukushi.metro.tokyo.lg.jp/seikatsu/shisetsu/fukushi.html,https://www.fukushi.metro.tokyo.lg.jp/seikatsu/hogo/index.html,保護を必要とする状態にある方,お住まいの地域または現在地を管轄する福祉事務所へご相談ください。,,,くらし・住まい;高齢者・福祉,,手当・助成金等;相談,,,,https://www.support-navi.metro.tokyo.lg.jp/detail/1/qaSpN23YMQtJn15ew,,13,東京都,2024/3/22,,,,,,,,,,,,,,,,,,,,,,,,,,,,,,,
1000000161,個人向け,生活困窮者自立支援制度,経済的に困窮し、最低限度の生活を維持することができなくなるおそれのある方に対して、自立の促進を図ることを目的として、個々の状況に応じた支援を行います。,各区市（町村部については東京都）が実施主体となり、自立相談支援機関において策定される自立支援計画に基づき、各種支援が行われます。 複合的な課題を抱える生活困窮者を幅広く受け止め、包括的な相談支援を行う自立相談支援事業（必須事業）と、本人の状況に応じた支援を行う各支援事業（任意事業）があります。  ＜必須事業＞ 1.自立相談支援事業 就労その他の自立に関する相談支援、自立に向けた支援計画の作成等を実施します。 2.住居確保給付金の支給 離職?廃業から2年以内の?または休業等により収?が減少し、離職?廃業と同程度の状況にある?で住居を失った場合や住居を失うおそれのある場合に、就職に向けた活動をすることなどを条件に、?定期間家賃相当額を?給します。  ＜任意事業＞ 1.就労準備支援事業 一般就労に必要な訓練を、日常生活自立、社会生活自立段階から有期で実施します。 2.一時生活支援事業 住居のない方に対して、一定期間、宿泊場所や衣食の提供等を行います。 3.家計改善支援事業 家計状況の把握や家計改善に向けた意欲の向上を図る支援、貸付けのあっせん等を行います。 4.子どもの学習・生活支援事業 生活困窮世帯の子どもに対して、学習支援や保護者への進学助言、生活習慣や育成環境の改善に関する助言等を行います。  ※任意事業の実施状況については、自治体によって異なります。各区市の実施状況については、東京都福祉局のページでご確認ください。,各自立相談支援機関 https://www.fukushi.metro.tokyo.lg.jp/seikatsu/seikatsukonnkyuu/jiritsu.files/R5madoguchiichiran.pdf,https://www.fukushi.metro.tokyo.lg.jp/seikatsu/seikatsukonnkyuu/jiritsu.html,就労の状況、心身の状況、地域社会との関係性その他の事情により、現に経済的に困窮し、最低限度の生活を維持することができなくなるおそれのある方,お住まいの地域の自立相談支援機関へお問い合わせください。,,,くらし・住まい;高齢者・福祉,,手当・助成金等;相談,,,,https://www.support-navi.metro.tokyo.lg.jp/detail/1/lh90AeiYQWdAxGxEf,,13,東京都,2024/3/22,,,,,,,,,,,,,,,,,,,,,,,,,,,,,,,
1000000160,個人向け,生活保護制度,生活保護は、資産や働く能力などのすべてを活用しても、なお生活ができない場合に、その困窮の程度に応じて援助を行う制度です。憲法25条の「すべて国民は、健康で文化的な最低限度の生活を営む権利を有する」という理念に基づき最低限度の生活を保障する制度であり、生活保護を受けることは国民の権利です。,・生活保護は、生活扶助とその他の扶助（教育・住宅・医療・介護・出産・生業・葬祭）に分かれており、保護を受ける人の世帯構成や収入などの状況に応じて、その全部または一部が適用されます。 ・保護費は、世帯全員の収入（給料、仕送り、年金など）と国が定める基準によって算出された最低生活費を比較して、収入が最低生活費を下回る場合に、その不足分が支給されます。 ※生活保護の申請については、お住まいの地域または現在地を管轄する福祉事務所にためらわずにご相談ください。  ＜現下の状況における保護の弾力的な運用について＞ 以下に該当すると思われる場合は、まずは、福祉事務所にご相談ください。 ・働く能力がある人はその能力を活用することが保護の要件ですが、現在の状況下において、十分に求職活動を行うことが難しいと認められる場合は、この要件についていったん判断されないまま、保護を受けることができる場合があります。 ・利用しうる資産を活用することが保護の要件であり、自動車については処分していただくのが原則ですが、通勤用の自動車を持ちながら求職している場合に、処分しないまま保護を受けることができる場合があります。 ・自営業のために必要な店舗・器具も、処分しないまま保護を受けることができる場合があります。,各福祉事務所 https://www.fukushi.metro.tokyo.lg.jp/seikatsu/shisetsu/fukushi.html,https://www.fukushi.metro.tokyo.lg.jp/seikatsu/hogo/index.html,保護を必要とする状態にある方,お住まいの地域または現在地を管轄する福祉事務所へご相談ください。,,,くらし・住まい;高齢者・福祉,,手当・助成金等;相談,,,,https://www.support-navi.metro.tokyo.lg.jp/detail/1/V1JfxDXFi5XZCmTC0,,13,東京都,2024/3/22,,,,,,,,,,,,,,,,,,,,,,,,,,,,,,,
1000000159,個人向け,失業等に伴う住居喪失者への一時住宅等の提供（ＴＯＫＹＯチャレンジネット）,東京都では、インターネットカフェや漫画喫茶などで寝泊まりしながら不安定な就労に従事している方や離職されている方に対して、生活支援、居住支援、就労支援および資金貸付相談などを実施しています。,生活支援、居住支援、就労支援および資金貸付相談などを実施しています。 詳細は、「TOKYOチャレンジネット」のWebサイトをご覧ください。,・TOKYOチャレンジネット TEL：0120-874-225 / 0120-874-505（女性専用ダイヤル） ・各福祉事務所 ・各自立相談支援機関,https://www.fukushi.metro.tokyo.lg.jp/seikatsu/teisyotokusyataisaku/tokyochallenge.html,●就労を継続して自立した生活を目指しており、東京都内での生活実態がある方 ●上記以外で生活に困窮している方（就労による自立が困難な方）,＜就労により自立した生活を目指している方＞ 「TOKYOチャレンジネット」のWebサイトでご確認ください。 ＜就労による自立が困難な方＞ お住まいの（ネットカフェなどの所在の）地域の福祉事務所、自立相談支援機関へお問合せください。,,,くらし・住まい;高齢者・福祉;産業・仕事,引越し・住まい;就職・転職・退職,人的支援・その他サービス;相談,,,,https://www.support-navi.metro.tokyo.lg.jp/detail/1/JoN6wGagkGVBrEyD1,,13,東京都,2024/3/22,,,,,,,,,,,,,,,,,,,,,,,,,,,,,,,
1000000158,事業者向け,保護施設等整備費都補助金,補助金の目的：無料低額宿泊所・日常生活支援住居施設の整備に係る補助  ,補助対象経費：施設整備費及び特別な事由により東京都知事が必要と認めた附帯工事費 負担割合　　：国1/2、都1/4、事業者1/4,福祉局生活福祉部保護課 03-5320-4086,https://www.fukushi.metro.tokyo.lg.jp/seikatsu/shisetsu/shukuhaku/seibihihojo.html,社会福祉法人が設置する保護施設等,福祉局生活福祉部保護課（03-5320-4086）までお問い合わせください。,,,,,,助成・補助金;成長・成熟期の支援,補助金,設備投資,,https://www.support-navi.metro.tokyo.lg.jp/detail/2/lh90AeiYQWdAWGxEf,13,東京都,2024/3/22,,,,,,,,,,,,,,,,,,,,,,,,,,,,,,,
1000000157,事業者向け,保護施設等整備費都補助金,補助金の目的：保護施設等の整備に要する費用について補助  ,補助対象経費：施設整備費及び特別な事由により東京都知事が必要と認めた附帯工事費 負担割合　　：国1/2、都1/4、事業者1/4,福祉局生活福祉部保護課 03-5320-4086,https://www.fukushi.metro.tokyo.lg.jp/seikatsu/shisetsu/hogo/hogo_seibi.html,社会福祉法人が設置する保護施設等,福祉局生活福祉部保護課（03-5320-4086）までお問い合わせください。,,,,,,助成・補助金;成長・成熟期の支援,補助金,設備投資,,https://www.support-navi.metro.tokyo.lg.jp/detail/2/m2jqKsxOj85nm3R1c,13,東京都,2024/3/22,,,,,,,,,,,,,,,,,,,,,,,,,,,,,,,
1000000156,事業者向け,保護施設等の感染拡大防止対策等支援事業補助金,補助金の目的：施設等における新型コロナウイルス感染症の感染防止対策の取組推進  ,補助対象経費：感染防止対策のために発生する経費 負担割合　　：国3/4、都1/4,福祉局生活福祉部保護課 03-5320-4086,,保護施設等,福祉局生活福祉部保護課（03-5320-4086）までお問い合わせください。,,,,,,助成・補助金,補助金,,,https://www.support-navi.metro.tokyo.lg.jp/detail/2/HTOwmiVD5K4l5tRQA,13,東京都,2024/3/22,,,,,,,,,,,,,,,,,,,,,,,,,,,,,,,
1000000155,事業者向け,東京都民間社会福祉施設サービス推進費補助金（保護施設）,補助金の目的：社会福祉施設の運営費用等の一部補助による社会福祉施設利用者の福祉の向上  ,補助対象経費：運営費及び施設整備費 負担割合　　：都10/10,福祉局生活福祉部保護課 03-5320-4086,,適正な運営が確保されている社会福祉法人等が設置する保護施設,福祉局生活福祉部保護課（03-5320-4086）までお問い合わせください。,,,,,,助成・補助金,補助金,,,https://www.support-navi.metro.tokyo.lg.jp/detail/2/wQeIqTfpWIetnJ9IZ,13,東京都,2024/3/22,,,,,,,,,,,,,,,,,,,,,,,,,,,,,,,
1000000154,事業者向け,日本語指導事業補助金,補助金の目的：中国帰国者の日本語習得の機会を提供し、自立促進を進める。  ,補助対象経費：日本語教室運営に関する経費 負担割合　　：都1/2、事業者1/2,福祉局生活福祉部企画課 03-5320-4084,,中国帰国者支援の事業を実施し、日本語指導事業を継続して運営する団体,中国帰国者支援の事業を実施する団体であり、日本語指導事業を継続して運営することができる公益法人又は公共的事業を行うことを目的とする団体の方で、中国帰国者向けの日本語指導教室等の運営を検討されている方は、申請に係る必要書類や必要事項等についてお伝えいたしますので、福祉局生活福祉部企画課（03-5320-4084）までお問い合わせください。,,,,,,助成・補助金,補助金,,,https://www.support-navi.metro.tokyo.lg.jp/detail/2/oEfWQRldh1oKUrmYJ,13,東京都,2024/3/22,,,,,,,,,,,,,,,,,,,,,,,,,,,,,,,
1000000153,個人向け,ＺＥＶ普及促進事業（燃料電池自動車用外部給電器）,環境にやさしい車・バイクの導入に対して補助します,＜対象＞ 燃料電池自動車用外部給電器の購入費用 ＜要件＞ 購入日から申請受付日までの期間が１年以内であること。　等,クール・ネット東京モビリティチーム 03-5990-5068,https://www.tokyo-co2down.jp/subsidy/ev-feed,都内の法人または個人・都内区市町村・リース事業者,詳細はリンク先からご確認ください。,,,くらし・住まい;環境・自然,,手当・助成金等,,,,https://www.support-navi.metro.tokyo.lg.jp/detail/1/BK8CMWj3JMD42oW9U,,13,東京都,2024/3/22,,,,,,,,,,,,,,,,,,,,,,,,,,,,,,,
1000000152,個人向け,ＺＥＶ普及促進事業（燃料電池自動車）,環境にやさしい車・バイクの導入に対して補助します,＜対象＞ 燃料電池自動車の購入費用 ＜要件＞ 初度登録または初度検査の日から１年以内であり、代金の支払いが完了している自動車（中古車は除く。）であること　等,クール・ネット東京モビリティチーム 050-3155-5646,https://www.tokyo-co2down.jp/subsidy/ev,都内の法人または個人・都内区市町村・リース事業者,詳細はリンク先からご確認ください。,,,くらし・住まい;環境・自然,,手当・助成金等,,,,https://www.support-navi.metro.tokyo.lg.jp/detail/1/0rm5uhTSnG6r7t5CB,,13,東京都,2024/3/22,,,,,,,,,,,,,,,,,,,,,,,,,,,,,,,
1000000151,個人向け,ＺＥＶ普及促進事業（電気自動車・プラグインハイブリッド自動車用外部給電器）,環境にやさしい車・バイクの導入に対して補助します,＜対象＞ 電気自動車（EV）・プラグインハイブリッド自動車（PHEV）用外部給電器 ＜要件＞ 購入日から申請受付日までの期間が１年以内であること。　等,クール・ネット東京モビリティチーム 03-5990-5068,https://www.tokyo-co2down.jp/subsidy/ev-feed,都内の法人または個人 上記の者とリース契約を締結したリース事業者　等,詳細はリンク先からご確認ください。,,,くらし・住まい;環境・自然,,手当・助成金等,,,,https://www.support-navi.metro.tokyo.lg.jp/detail/1/Rq1ECmera6IhtNSDB,,13,東京都,2024/3/22,,,,,,,,,,,,,,,,,,,,,,,,,,,,,,,
1000000150,個人向け,ＺＥＶ普及促進事業（電気自動車・プラグインハイブリッド自動車）,環境にやさしい車・バイクの導入に対して補助します,＜対象＞ 電気自動車（EV）・プラグインハイブリッド自動車（PHEV） ＜要件＞ 初度登録または初度検査の日から１年以内であり、代金の支払いが完了している自動車（中古車は除く。）であること　等,クール・ネット東京モビリティチーム 050-3155-5646,https://www.tokyo-co2down.jp/subsidy/ev,都内の法人または個人 上記の者とリース契約を締結したリース事業者　等,詳細はリンク先からご確認ください。,,,くらし・住まい;環境・自然,,手当・助成金等,,,,https://www.support-navi.metro.tokyo.lg.jp/detail/1/sM02yI8GkELaxjzta,,13,東京都,2024/3/22,,,,,,,,,,,,,,,,,,,,,,,,,,,,,,,
1000000149,事業者向け,３Rアドバイザー事業,都内のオフィスビルや商業施設を対象に、廃プラスチックを中心とした3Rの取組を助言する相談窓口を開設し、３Rアドバイザーを派遣します。,"＜対象＞ 　都内の事業用大規模建築物 ＜要件＞ ・業種等：オフィス・商業施設（病院や学校での実績もあり） ・事業用延床面積：3,000㎡以上（自治体によって異なる） ＜支援内容＞ ①３Rに関するアドバイス　 　事業者を訪問し、現状についてお話を伺い、現地確認のうえ、口頭で簡単なアドバイスを実施 ②アフターフォロー　 　訪問した事業者様に対し、後日、改めて事業所への訪問やアンケート調査を実施し、各種課題に対する解決策の提案・取組状況の確認等を支援 ③講習会の開催　 　社内での３Rに関する講習会の開催も、要望に応じて支援",東京サーキュラーエコノミー推進センター　行動変容支援チーム 03-6666-9182,https://www.tokyokankyo.jp/jigyo/resource-circulation/3r-adviser,都内に事業用大規模建築物を持つ事業者,詳細リンク先からご確認ください。,,,,,,サービス;成長・成熟期の支援,専門家派遣;セミナー・研修・イベント,人材育成・教育・研修;環境・省エネ,,https://www.support-navi.metro.tokyo.lg.jp/detail/2/F8Hx0dGNbqv83Xvan,13,東京都,2024/3/22,,,,,,,,,,,,,,,,,,,,,,,,,,,,,,,
1000000148,両方,微量PCB 廃棄物処理支援事業,微量PCBが混入した電気機器等の分析費用と処理費用を補助します。,＜対象＞ ①微量のPCBに汚染された可能性のある変圧器及びコンデンサー類の電気機器の絶縁油の分析費用 ②微量PCB含有が確認された絶縁油・容器・電気機器の処理（運搬・処分）費用 ＜要件＞ 補助金の申請は分析や処理を実施する前に行うこと,公益財団法人東京都環境公社微量PCB助成金交付担当 03-3649-8541,https://www.tokyokankyo.jp/jigyo/resource-circulation/pcb,都内に微量PCB廃棄物を保管している個人、中小企業等,詳細リンク先からご確認ください。,,,環境・自然;産業・仕事,,手当・助成金等,助成・補助金;成長・成熟期の支援;転換期の支援,給付・助成,環境・省エネ;廃業,https://www.support-navi.metro.tokyo.lg.jp/detail/1/5XqzJrQCsVInfZJmE,https://www.support-navi.metro.tokyo.lg.jp/detail/2/5XqzJrQCsVInfZJmE,13,東京都,2024/3/22,,,,,,,,,,,,,,,,,,,,,,,,,,,,,,,
1000000147,事業者向け,太陽光パネル高度循環利用の推進,住宅から排出される使用済住宅用太陽光パネルのリサイクル費用を補助します。,＜対象＞ 使用済住宅用太陽光パネルを都の指定するリサイクル施設においてリサイクルするために係る処理費 ＜要件＞ 都内の住宅から排出される使用済住宅用太陽光パネル（発電出力10kW未満）であること リサイクルするため、都が指定する産業廃棄物中間処理施設に、令和５年４月１日以降に処理の委託を行うこと,クール・ネット東京 03-6258-5313,https://www.tokyo-co2down.jp/subsidy/pvrecycle,使用済住宅用太陽光パネルの処理の委託を行う排出事業者,詳細リンク先からご確認ください。,,,,,,助成・補助金;成長・成熟期の支援,補助金,環境・省エネ,,https://www.support-navi.metro.tokyo.lg.jp/detail/2/MOrUDcnoJYilHyIvX,13,東京都,2024/3/22,,,,,,,,,,,,,,,,,,,,,,,,,,,,,,,
1000000146,事業者向け,賞味期限前食品の廃棄ゼロ行動促進事業,賞味期限前食品のフードバンクへの寄贈に係る輸送費を補助します。,＜対象＞ フードバンクへの食品輸送に要する費用 ＜要件＞ 都内のフードバンクに、まだ食べられるにも関わらず廃棄になる可能性のある賞味期限前食品を寄贈することを目的として輸送すること 補助対象事業完了後に、寄贈によるコスト削減のメリットや物流面の課題等、実態を把握するためのアンケートに協力できること　等,東京サーキュラーエコノミー推進センター行動変容支援チーム 03-6666-9243,https://www.circulareconomy.metro.tokyo.lg.jp/subsidized-business/food-bank-donation,中小小売店,詳細リンク先からご確認ください。,,,,,,助成・補助金;成長・成熟期の支援,補助金,環境・省エネ,,https://www.support-navi.metro.tokyo.lg.jp/detail/2/z9p46Xc3VCHP3wwsj,13,東京都,2024/3/22,,,,,,,,,,,,,,,,,,,,,,,,,,,,,,,
1000000145,事業者向け,アスベスト対策に関する出前講座（講師派遣）,事業者が工事従事者や発注担当者向けに行う社内研修などに都の職員がお伺いして、石綿（アスベスト）に関する大気汚染防止法・環境確保条例の規制の内容（解体・改修等工事実施時の注意点）等について分かりやすく説明を行う出前講座を無料で実施します。,＜実施内容＞ ・アスベストに関する基礎知識（アスベストの性質やアスベスト含有建材の種類・使用箇所など） ・工事着手前に必要な手続き（事前調査の実施等）や措置等 ・アスベストがあった場合、工事において行わなければならない飛散防止措置の概要 ・法令改正事項等,東京都環境局環境改善部大気保全課 03-5388-3493,https://www.kankyo.metro.tokyo.lg.jp/air/air_pollution/emission_control/asbestos/seminar/index.html,(1) 建築物の解体工事や改修工事を行う事業者（建設・解体工事、電気工事、管工事、塗装工事、内装仕上工事、リフォーム工事など） (2) 建築物を所有または維持管理等を行う事業者 (3) (1)(2)の事業に関する団体,詳細リンク先からご確認ください。,,,,,,サービス;成長・成熟期の支援;商業・地域・団体支援,専門家派遣;セミナー・研修・イベント,人材育成・教育・研修;環境・省エネ;商業・地域・団体支援,,https://www.support-navi.metro.tokyo.lg.jp/detail/2/DjG18gP3Xo6xxsKJF,13,東京都,2024/3/22,,,,,,,,,,,,,,,,,,,,,,,,,,,,,,,
